group_id,arrival_datetime,number_in_party,language,language2,destination,state_name,state_abb,method_of_travel,day_m_d_yy,departure_date,company,destination_city,country,country2,arrival_date,stay_length,week_number,arrival_year,arrival_month
0,1/26/2021 13:04:33,1,Spanish,NA,Arizona - AZ,Arizona,AZ,NA,01/26/2021,2021-01-26,Alaska,,Mexico,NA,2021-01-26,0,4,2021,1
1,1/26/2021 13:37:56,1,Spanish,NA,Arizona - AZ,Arizona,AZ,NA,01/26/2021,2021-01-26,NA,,Mexico,NA,2021-01-26,0,4,2021,1
2,1/29/2021 8:28:52,1,Spanish,NA,Utah - UT,Utah,UT,NA,01/30/2021,2021-01-30,NA,,Venezuela,NA,2021-01-29,1,5,2021,1
3,1/29/2021 13:59:06,1,Mixteco,NA,California - CA,California,CA,NA,01/29/2021,2021-01-29,NA,,Mexico,NA,2021-01-29,0,5,2021,1
4,2/1/2021 12:26:16,1,Spanish,NA,Arizona - AZ,Arizona,AZ,NA,02/02/2021,2021-02-02,NA,,Cuba,NA,2021-02-01,1,5,2021,2
5,2/1/2021 16:08:53,1,Spanish,NA,Maryland - MD,Maryland,MD,NA,02/06/2021,2021-02-06,NA,,Guatemala,NA,2021-02-01,5,5,2021,2
6,2/2/2021 12:58:05,4,Spanish,NA,Texas - TX,Texas,TX,NA,02/03/2021,2021-02-03,NA,,Venezuela,NA,2021-02-02,1,5,2021,2
6,2/2/2021 12:58:05,4,Spanish,NA,Texas - TX,Texas,TX,NA,02/03/2021,2021-02-03,NA,,Venezuela,NA,2021-02-02,1,5,2021,2
6,2/2/2021 12:58:05,4,Spanish,NA,Texas - TX,Texas,TX,NA,02/03/2021,2021-02-03,NA,,Venezuela,NA,2021-02-02,1,5,2021,2
6,2/2/2021 12:58:05,4,Spanish,NA,Texas - TX,Texas,TX,NA,02/03/2021,2021-02-03,NA,,Venezuela,NA,2021-02-02,1,5,2021,2
7,2/2/2021 13:03:02,1,Spanish,NA,Florida - FL,Florida,FL,NA,02/03/2021,2021-02-03,NA,,Cuba,NA,2021-02-02,1,5,2021,2
8,2/2/2021 13:08:42,1,Spanish,NA,Tennessee - TN,Tennessee,TN,NA,02/03/2021,2021-02-03,NA,,Venezuela,NA,2021-02-02,1,5,2021,2
9,2/2/2021 13:16:09,1,Spanish,NA,New Jersey - NJ,New Jersey,NJ,NA,02/03/2021,2021-02-03,NA,,Ecuador,NA,2021-02-02,1,5,2021,2
10,2/2/2021 13:26:40,3,Spanish,NA,Florida - FL,Florida,FL,NA,02/03/2021,2021-02-03,NA,,Cuba,NA,2021-02-02,1,5,2021,2
10,2/2/2021 13:26:40,3,Spanish,NA,Florida - FL,Florida,FL,NA,02/03/2021,2021-02-03,NA,,Cuba,NA,2021-02-02,1,5,2021,2
10,2/2/2021 13:26:40,3,Spanish,NA,Florida - FL,Florida,FL,NA,02/03/2021,2021-02-03,NA,,Cuba,NA,2021-02-02,1,5,2021,2
11,2/2/2021 13:43:00,3,Spanish,NA,Texas - TX,Texas,TX,NA,02/03/2021,2021-02-03,NA,,Venezuela,NA,2021-02-02,1,5,2021,2
11,2/2/2021 13:43:00,3,Spanish,NA,Texas - TX,Texas,TX,NA,02/03/2021,2021-02-03,NA,,Venezuela,NA,2021-02-02,1,5,2021,2
11,2/2/2021 13:43:00,3,Spanish,NA,Texas - TX,Texas,TX,NA,02/03/2021,2021-02-03,NA,,Venezuela,NA,2021-02-02,1,5,2021,2
12,2/3/2021 13:38:51,3,Spanish,NA,Tennessee - TN,Tennessee,TN,NA,02/04/2021,2021-02-04,NA,,Venezuela,NA,2021-02-03,1,5,2021,2
12,2/3/2021 13:38:51,3,Spanish,NA,Tennessee - TN,Tennessee,TN,NA,02/04/2021,2021-02-04,NA,,Venezuela,NA,2021-02-03,1,5,2021,2
12,2/3/2021 13:38:51,3,Spanish,NA,Tennessee - TN,Tennessee,TN,NA,02/04/2021,2021-02-04,NA,,Venezuela,NA,2021-02-03,1,5,2021,2
13,2/3/2021 13:51:21,3,Spanish,NA,Florida - FL,Florida,FL,NA,02/05/2021,2021-02-05,NA,,Venezuela,NA,2021-02-03,2,5,2021,2
13,2/3/2021 13:51:21,3,Spanish,NA,Florida - FL,Florida,FL,NA,02/05/2021,2021-02-05,NA,,Venezuela,NA,2021-02-03,2,5,2021,2
13,2/3/2021 13:51:21,3,Spanish,NA,Florida - FL,Florida,FL,NA,02/05/2021,2021-02-05,NA,,Venezuela,NA,2021-02-03,2,5,2021,2
14,2/3/2021 13:58:21,2,Spanish,NA,New York - NY,New York,NY,NA,02/04/2021,2021-02-04,NA,,Ecuador,NA,2021-02-03,1,5,2021,2
14,2/3/2021 13:58:21,2,Spanish,NA,New York - NY,New York,NY,NA,02/04/2021,2021-02-04,NA,,Ecuador,NA,2021-02-03,1,5,2021,2
15,2/3/2021 14:07:27,4,Spanish,NA,Florida - FL,Florida,FL,NA,02/04/2021,2021-02-04,NA,,Venezuela,NA,2021-02-03,1,5,2021,2
15,2/3/2021 14:07:27,4,Spanish,NA,Florida - FL,Florida,FL,NA,02/04/2021,2021-02-04,NA,,Venezuela,NA,2021-02-03,1,5,2021,2
15,2/3/2021 14:07:27,4,Spanish,NA,Florida - FL,Florida,FL,NA,02/04/2021,2021-02-04,NA,,Venezuela,NA,2021-02-03,1,5,2021,2
15,2/3/2021 14:07:27,4,Spanish,NA,Florida - FL,Florida,FL,NA,02/04/2021,2021-02-04,NA,,Venezuela,NA,2021-02-03,1,5,2021,2
16,2/3/2021 14:08:17,2,Spanish,NA,California - CA,California,CA,NA,02/04/2021,2021-02-04,NA,,Guatemala,NA,2021-02-03,1,5,2021,2
16,2/3/2021 14:08:17,2,Spanish,NA,California - CA,California,CA,NA,02/04/2021,2021-02-04,NA,,Guatemala,NA,2021-02-03,1,5,2021,2
17,2/3/2021 14:26:29,1,Spanish,NA,Texas - TX,Texas,TX,NA,02/03/2021,2021-02-03,NA,,Cuba,NA,2021-02-03,0,5,2021,2
18,2/5/2021 9:07:33,3,Spanish,NA,Texas - TX,Texas,TX,NA,02/05/2021,2021-02-05,NA,,Venezuela,NA,2021-02-05,0,6,2021,2
18,2/5/2021 9:07:33,3,Spanish,NA,Texas - TX,Texas,TX,NA,02/05/2021,2021-02-05,NA,,Venezuela,NA,2021-02-05,0,6,2021,2
18,2/5/2021 9:07:33,3,Spanish,NA,Texas - TX,Texas,TX,NA,02/05/2021,2021-02-05,NA,,Venezuela,NA,2021-02-05,0,6,2021,2
19,2/5/2021 9:19:48,1,Spanish,NA,Florida - FL,Florida,FL,NA,02/05/2021,2021-02-05,NA,,Cuba,NA,2021-02-05,0,6,2021,2
20,2/5/2021 15:59:03,5,Spanish,NA,Idaho - ID,Idaho,ID,NA,02/06/2021,2021-02-06,NA,,Venezuela,NA,2021-02-05,1,6,2021,2
20,2/5/2021 15:59:03,5,Spanish,NA,Idaho - ID,Idaho,ID,NA,02/06/2021,2021-02-06,NA,,Venezuela,NA,2021-02-05,1,6,2021,2
20,2/5/2021 15:59:03,5,Spanish,NA,Idaho - ID,Idaho,ID,NA,02/06/2021,2021-02-06,NA,,Venezuela,NA,2021-02-05,1,6,2021,2
20,2/5/2021 15:59:03,5,Spanish,NA,Idaho - ID,Idaho,ID,NA,02/06/2021,2021-02-06,NA,,Venezuela,NA,2021-02-05,1,6,2021,2
20,2/5/2021 15:59:03,5,Spanish,NA,Idaho - ID,Idaho,ID,NA,02/06/2021,2021-02-06,NA,,Venezuela,NA,2021-02-05,1,6,2021,2
21,2/5/2021 16:10:24,5,Spanish,NA,Colorado - CO,Colorado,CO,NA,02/06/2021,2021-02-06,NA,,Venezuela,NA,2021-02-05,1,6,2021,2
21,2/5/2021 16:10:24,5,Spanish,NA,Colorado - CO,Colorado,CO,NA,02/06/2021,2021-02-06,NA,,Venezuela,NA,2021-02-05,1,6,2021,2
21,2/5/2021 16:10:24,5,Spanish,NA,Colorado - CO,Colorado,CO,NA,02/06/2021,2021-02-06,NA,,Venezuela,NA,2021-02-05,1,6,2021,2
21,2/5/2021 16:10:24,5,Spanish,NA,Colorado - CO,Colorado,CO,NA,02/06/2021,2021-02-06,NA,,Venezuela,NA,2021-02-05,1,6,2021,2
21,2/5/2021 16:10:24,5,Spanish,NA,Colorado - CO,Colorado,CO,NA,02/06/2021,2021-02-06,NA,,Venezuela,NA,2021-02-05,1,6,2021,2
22,2/6/2021 11:33:36,4,Spanish,NA,Texas - TX,Texas,TX,NA,02/07/2021,2021-02-07,NA,,Venezuela,NA,2021-02-06,1,6,2021,2
22,2/6/2021 11:33:36,4,Spanish,NA,Texas - TX,Texas,TX,NA,02/07/2021,2021-02-07,NA,,Venezuela,NA,2021-02-06,1,6,2021,2
22,2/6/2021 11:33:36,4,Spanish,NA,Texas - TX,Texas,TX,NA,02/07/2021,2021-02-07,NA,,Venezuela,NA,2021-02-06,1,6,2021,2
22,2/6/2021 11:33:36,4,Spanish,NA,Texas - TX,Texas,TX,NA,02/07/2021,2021-02-07,NA,,Venezuela,NA,2021-02-06,1,6,2021,2
23,2/6/2021 11:45:23,3,Spanish,NA,Texas - TX,Texas,TX,NA,02/07/2021,2021-02-07,NA,,Venezuela,NA,2021-02-06,1,6,2021,2
23,2/6/2021 11:45:23,3,Spanish,NA,Texas - TX,Texas,TX,NA,02/07/2021,2021-02-07,NA,,Venezuela,NA,2021-02-06,1,6,2021,2
23,2/6/2021 11:45:23,3,Spanish,NA,Texas - TX,Texas,TX,NA,02/07/2021,2021-02-07,NA,,Venezuela,NA,2021-02-06,1,6,2021,2
24,2/6/2021 12:04:24,2,Spanish,NA,Colorado - CO,Colorado,CO,NA,02/07/2021,2021-02-07,NA,,Venezuela,NA,2021-02-06,1,6,2021,2
24,2/6/2021 12:04:24,2,Spanish,NA,Colorado - CO,Colorado,CO,NA,02/07/2021,2021-02-07,NA,,Venezuela,NA,2021-02-06,1,6,2021,2
25,2/6/2021 12:24:31,1,Spanish,NA,Florida - FL,Florida,FL,NA,02/07/2021,2021-02-07,NA,,Guatemala,NA,2021-02-06,1,6,2021,2
26,2/6/2021 12:37:20,2,Spanish,NA,Texas - TX,Texas,TX,NA,02/07/2021,2021-02-07,NA,,Venezuela,NA,2021-02-06,1,6,2021,2
26,2/6/2021 12:37:20,2,Spanish,NA,Texas - TX,Texas,TX,NA,02/07/2021,2021-02-07,NA,,Venezuela,NA,2021-02-06,1,6,2021,2
27,2/7/2021 14:21:29,1,Spanish,NA,New York - NY,New York,NY,NA,02/08/2021,2021-02-08,NA,,Ecuador,NA,2021-02-07,1,6,2021,2
28,2/7/2021 14:30:32,1,Spanish,NA,Arizona - AZ,Arizona,AZ,NA,02/07/2021,2021-02-07,NA,,Mexico,NA,2021-02-07,0,6,2021,2
29,2/7/2021 14:39:46,2,Spanish,NA,California - CA,California,CA,NA,02/08/2021,2021-02-08,NA,,Mexico,NA,2021-02-07,1,6,2021,2
29,2/7/2021 14:39:46,2,Spanish,NA,California - CA,California,CA,NA,02/08/2021,2021-02-08,NA,,Mexico,NA,2021-02-07,1,6,2021,2
30,2/7/2021 14:50:22,3,Spanish,NA,Nebraska - NE,Nebraska,NE,NA,02/08/2021,2021-02-08,NA,,El Salvador,NA,2021-02-07,1,6,2021,2
30,2/7/2021 14:50:22,3,Spanish,NA,Nebraska - NE,Nebraska,NE,NA,02/08/2021,2021-02-08,NA,,El Salvador,NA,2021-02-07,1,6,2021,2
30,2/7/2021 14:50:22,3,Spanish,NA,Nebraska - NE,Nebraska,NE,NA,02/08/2021,2021-02-08,NA,,El Salvador,NA,2021-02-07,1,6,2021,2
31,2/9/2021 9:56:32,1,Spanish,NA,New Jersey - NJ,New Jersey,NJ,NA,03/13/2021,2021-03-13,NA,,Ecuador,NA,2021-02-09,32,6,2021,2
32,2/9/2021 11:42:15,1,Spanish,NA,Florida - FL,Florida,FL,NA,02/10/2021,2021-02-10,NA,,Cuba,NA,2021-02-09,1,6,2021,2
33,2/9/2021 11:49:45,3,Spanish,NA,Arizona - AZ,Arizona,AZ,NA,02/09/2021,2021-02-09,NA,,Venezuela,NA,2021-02-09,0,6,2021,2
33,2/9/2021 11:49:45,3,Spanish,NA,Arizona - AZ,Arizona,AZ,NA,02/09/2021,2021-02-09,NA,,Venezuela,NA,2021-02-09,0,6,2021,2
33,2/9/2021 11:49:45,3,Spanish,NA,Arizona - AZ,Arizona,AZ,NA,02/09/2021,2021-02-09,NA,,Venezuela,NA,2021-02-09,0,6,2021,2
34,2/9/2021 11:49:51,1,Spanish,NA,Florida - FL,Florida,FL,NA,02/09/2021,2021-02-09,NA,,Cuba,NA,2021-02-09,0,6,2021,2
35,2/9/2021 12:05:59,2,Spanish,NA,Arizona - AZ,Arizona,AZ,NA,02/09/2021,2021-02-09,NA,,Venezuela,NA,2021-02-09,0,6,2021,2
35,2/9/2021 12:05:59,2,Spanish,NA,Arizona - AZ,Arizona,AZ,NA,02/09/2021,2021-02-09,NA,,Venezuela,NA,2021-02-09,0,6,2021,2
36,2/9/2021 16:11:23,2,Spanish,NA,Texas - TX,Texas,TX,NA,02/10/2021,2021-02-10,NA,,Venezuela,NA,2021-02-09,1,6,2021,2
36,2/9/2021 16:11:23,2,Spanish,NA,Texas - TX,Texas,TX,NA,02/10/2021,2021-02-10,NA,,Venezuela,NA,2021-02-09,1,6,2021,2
37,2/10/2021 11:08:54,1,Spanish,NA,New Jersey - NJ,New Jersey,NJ,NA,02/13/2021,2021-02-13,NA,,Guatemala,NA,2021-02-10,3,6,2021,2
38,2/10/2021 11:18:56,4,Spanish,NA,Florida - FL,Florida,FL,NA,02/11/2021,2021-02-11,NA,,Cuba,NA,2021-02-10,1,6,2021,2
38,2/10/2021 11:18:56,4,Spanish,NA,Florida - FL,Florida,FL,NA,02/11/2021,2021-02-11,NA,,Cuba,NA,2021-02-10,1,6,2021,2
38,2/10/2021 11:18:56,4,Spanish,NA,Florida - FL,Florida,FL,NA,02/11/2021,2021-02-11,NA,,Cuba,NA,2021-02-10,1,6,2021,2
38,2/10/2021 11:18:56,4,Spanish,NA,Florida - FL,Florida,FL,NA,02/11/2021,2021-02-11,NA,,Cuba,NA,2021-02-10,1,6,2021,2
39,2/10/2021 11:24:18,2,Spanish,NA,Utah - UT,Utah,UT,NA,02/13/2021,2021-02-13,NA,,Venezuela,NA,2021-02-10,3,6,2021,2
39,2/10/2021 11:24:18,2,Spanish,NA,Utah - UT,Utah,UT,NA,02/13/2021,2021-02-13,NA,,Venezuela,NA,2021-02-10,3,6,2021,2
40,2/10/2021 13:53:39,3,Quichua,NA,Massachusetts - MA,Massachusetts,MA,NA,02/10/2021,2021-02-10,NA,,Ecuador,NA,2021-02-10,0,6,2021,2
40,2/10/2021 13:53:39,3,Quichua,NA,Massachusetts - MA,Massachusetts,MA,NA,02/10/2021,2021-02-10,NA,,Ecuador,NA,2021-02-10,0,6,2021,2
40,2/10/2021 13:53:39,3,Quichua,NA,Massachusetts - MA,Massachusetts,MA,NA,02/10/2021,2021-02-10,NA,,Ecuador,NA,2021-02-10,0,6,2021,2
41,2/10/2021 13:54:50,1,Spanish,NA,New Jersey - NJ,New Jersey,NJ,NA,02/11/2021,2021-02-11,NA,,Ecuador,NA,2021-02-10,1,6,2021,2
42,2/11/2021 10:23:40,3,Spanish,NA,Texas - TX,Texas,TX,NA,02/11/2021,2021-02-11,NA,,Venezuela,NA,2021-02-11,0,6,2021,2
42,2/11/2021 10:23:40,3,Spanish,NA,Texas - TX,Texas,TX,NA,02/11/2021,2021-02-11,NA,,Venezuela,NA,2021-02-11,0,6,2021,2
42,2/11/2021 10:23:40,3,Spanish,NA,Texas - TX,Texas,TX,NA,02/11/2021,2021-02-11,NA,,Venezuela,NA,2021-02-11,0,6,2021,2
43,2/11/2021 10:26:49,3,Spanish,NA,Washington - WA,Washington,WA,NA,02/11/2021,2021-02-11,NA,,Venezuela,NA,2021-02-11,0,6,2021,2
43,2/11/2021 10:26:49,3,Spanish,NA,Washington - WA,Washington,WA,NA,02/11/2021,2021-02-11,NA,,Venezuela,NA,2021-02-11,0,6,2021,2
43,2/11/2021 10:26:49,3,Spanish,NA,Washington - WA,Washington,WA,NA,02/11/2021,2021-02-11,NA,,Venezuela,NA,2021-02-11,0,6,2021,2
44,2/11/2021 10:31:46,3,Spanish,NA,Arizona - AZ,Arizona,AZ,NA,02/11/2021,2021-02-11,NA,,Cuba,NA,2021-02-11,0,6,2021,2
44,2/11/2021 10:31:46,3,Spanish,NA,Arizona - AZ,Arizona,AZ,NA,02/11/2021,2021-02-11,NA,,Cuba,NA,2021-02-11,0,6,2021,2
44,2/11/2021 10:31:46,3,Spanish,NA,Arizona - AZ,Arizona,AZ,NA,02/11/2021,2021-02-11,NA,,Cuba,NA,2021-02-11,0,6,2021,2
45,2/11/2021 17:37:48,1,Spanish,NA,Mexico,NA,NA,NA,02/13/2021,2021-02-13,NA,,Mexico,NA,2021-02-11,2,6,2021,2
46,2/12/2021 11:35:27,1,Spanish,NA,New York - NY,New York,NY,NA,02/13/2021,2021-02-13,NA,,Ecuador,NA,2021-02-12,1,7,2021,2
47,2/12/2021 11:39:01,1,Spanish,NA,Florida - FL,Florida,FL,NA,02/13/2021,2021-02-13,NA,,Venezuela,NA,2021-02-12,1,7,2021,2
48,2/12/2021 15:54:53,1,Spanish,NA,Florida - FL,Florida,FL,NA,02/19/2021,2021-02-19,NA,,Mexico,NA,2021-02-12,7,7,2021,2
49,2/13/2021 9:30:55,2,Spanish,NA,Florida - FL,Florida,FL,NA,02/14/2021,2021-02-14,NA,,Venezuela,NA,2021-02-13,1,7,2021,2
49,2/13/2021 9:30:55,2,Spanish,NA,Florida - FL,Florida,FL,NA,02/14/2021,2021-02-14,NA,,Venezuela,NA,2021-02-13,1,7,2021,2
50,2/13/2021 9:39:43,2,Spanish,NA,Florida - FL,Florida,FL,NA,02/13/2021,2021-02-13,NA,,Venezuela,NA,2021-02-13,0,7,2021,2
50,2/13/2021 9:39:43,2,Spanish,NA,Florida - FL,Florida,FL,NA,02/13/2021,2021-02-13,NA,,Venezuela,NA,2021-02-13,0,7,2021,2
51,2/13/2021 12:15:59,2,Spanish,NA,Florida - FL,Florida,FL,NA,02/16/2021,2021-02-16,NA,,Venezuela,NA,2021-02-13,3,7,2021,2
51,2/13/2021 12:15:59,2,Spanish,NA,Florida - FL,Florida,FL,NA,02/16/2021,2021-02-16,NA,,Venezuela,NA,2021-02-13,3,7,2021,2
52,2/13/2021 12:23:10,1,Spanish,NA,New York - NY,New York,NY,NA,02/14/2021,2021-02-14,NA,,Ecuador,NA,2021-02-13,1,7,2021,2
53,2/14/2021 10:46:50,2,Spanish,NA,North Carolina - NC,North Carolina,NC,NA,02/19/2021,2021-02-19,NA,,Nicaragua,NA,2021-02-14,5,7,2021,2
53,2/14/2021 10:46:50,2,Spanish,NA,North Carolina - NC,North Carolina,NC,NA,02/19/2021,2021-02-19,NA,,Nicaragua,NA,2021-02-14,5,7,2021,2
54,2/14/2021 11:17:29,1,Spanish,NA,NA,NA,NA,NA,02/16/2021,2021-02-16,NA,,Honduras,NA,2021-02-14,2,7,2021,2
55,2/15/2021 10:47:27,2,Spanish,NA,Virginia - VA,Virginia,VA,NA,02/16/2021,2021-02-16,NA,,Venezuela,NA,2021-02-15,1,7,2021,2
55,2/15/2021 10:47:27,2,Spanish,NA,Virginia - VA,Virginia,VA,NA,02/16/2021,2021-02-16,NA,,Venezuela,NA,2021-02-15,1,7,2021,2
56,2/15/2021 10:56:35,3,Spanish,NA,Tennessee - TN,Tennessee,TN,NA,02/16/2021,2021-02-16,NA,,Venezuela,NA,2021-02-15,1,7,2021,2
56,2/15/2021 10:56:35,3,Spanish,NA,Tennessee - TN,Tennessee,TN,NA,02/16/2021,2021-02-16,NA,,Venezuela,NA,2021-02-15,1,7,2021,2
56,2/15/2021 10:56:35,3,Spanish,NA,Tennessee - TN,Tennessee,TN,NA,02/16/2021,2021-02-16,NA,,Venezuela,NA,2021-02-15,1,7,2021,2
57,2/15/2021 11:05:00,3,Spanish,NA,Connecticut - CT,Connecticut,CT,NA,02/16/2021,2021-02-16,NA,,Ecuador,NA,2021-02-15,1,7,2021,2
57,2/15/2021 11:05:00,3,Spanish,NA,Connecticut - CT,Connecticut,CT,NA,02/16/2021,2021-02-16,NA,,Ecuador,NA,2021-02-15,1,7,2021,2
57,2/15/2021 11:05:00,3,Spanish,NA,Connecticut - CT,Connecticut,CT,NA,02/16/2021,2021-02-16,NA,,Ecuador,NA,2021-02-15,1,7,2021,2
58,2/15/2021 11:22:21,4,Spanish,NA,California - CA,California,CA,NA,02/15/2021,2021-02-15,NA,,Venezuela,NA,2021-02-15,0,7,2021,2
58,2/15/2021 11:22:21,4,Spanish,NA,California - CA,California,CA,NA,02/15/2021,2021-02-15,NA,,Venezuela,NA,2021-02-15,0,7,2021,2
58,2/15/2021 11:22:21,4,Spanish,NA,California - CA,California,CA,NA,02/15/2021,2021-02-15,NA,,Venezuela,NA,2021-02-15,0,7,2021,2
58,2/15/2021 11:22:21,4,Spanish,NA,California - CA,California,CA,NA,02/15/2021,2021-02-15,NA,,Venezuela,NA,2021-02-15,0,7,2021,2
59,2/15/2021 14:59:34,1,Spanish,NA,Florida - FL,Florida,FL,NA,02/17/2021,2021-02-17,NA,,Cuba,NA,2021-02-15,2,7,2021,2
60,2/15/2021 15:10:49,3,Spanish,NA,Florida - FL,Florida,FL,NA,02/16/2021,2021-02-16,NA,,Cuba,NA,2021-02-15,1,7,2021,2
60,2/15/2021 15:10:49,3,Spanish,NA,Florida - FL,Florida,FL,NA,02/16/2021,2021-02-16,NA,,Cuba,NA,2021-02-15,1,7,2021,2
60,2/15/2021 15:10:49,3,Spanish,NA,Florida - FL,Florida,FL,NA,02/16/2021,2021-02-16,NA,,Cuba,NA,2021-02-15,1,7,2021,2
61,2/16/2021 9:22:03,3,Spanish,NA,Texas - TX,Texas,TX,NA,02/17/2021,2021-02-17,NA,,Venezuela,NA,2021-02-16,1,7,2021,2
61,2/16/2021 9:22:03,3,Spanish,NA,Texas - TX,Texas,TX,NA,02/17/2021,2021-02-17,NA,,Venezuela,NA,2021-02-16,1,7,2021,2
61,2/16/2021 9:22:03,3,Spanish,NA,Texas - TX,Texas,TX,NA,02/17/2021,2021-02-17,NA,,Venezuela,NA,2021-02-16,1,7,2021,2
62,2/16/2021 14:59:14,2,Spanish,NA,Massachusetts - MA,Massachusetts,MA,NA,02/19/2021,2021-02-19,NA,,Ecuador,NA,2021-02-16,3,7,2021,2
62,2/16/2021 14:59:14,2,Spanish,NA,Massachusetts - MA,Massachusetts,MA,NA,02/19/2021,2021-02-19,NA,,Ecuador,NA,2021-02-16,3,7,2021,2
63,2/16/2021 15:18:55,3,Quichua,NA,New York - NY,New York,NY,NA,02/19/2021,2021-02-19,NA,,Ecuador,NA,2021-02-16,3,7,2021,2
63,2/16/2021 15:18:55,3,Quichua,NA,New York - NY,New York,NY,NA,02/19/2021,2021-02-19,NA,,Ecuador,NA,2021-02-16,3,7,2021,2
63,2/16/2021 15:18:55,3,Quichua,NA,New York - NY,New York,NY,NA,02/19/2021,2021-02-19,NA,,Ecuador,NA,2021-02-16,3,7,2021,2
64,2/16/2021 16:36:25,4,Spanish,NA,Florida - FL,Florida,FL,NA,02/16/2021,2021-02-16,NA,,Nicaragua,NA,2021-02-16,0,7,2021,2
64,2/16/2021 16:36:25,4,Spanish,NA,Florida - FL,Florida,FL,NA,02/16/2021,2021-02-16,NA,,Nicaragua,NA,2021-02-16,0,7,2021,2
64,2/16/2021 16:36:25,4,Spanish,NA,Florida - FL,Florida,FL,NA,02/16/2021,2021-02-16,NA,,Nicaragua,NA,2021-02-16,0,7,2021,2
64,2/16/2021 16:36:25,4,Spanish,NA,Florida - FL,Florida,FL,NA,02/16/2021,2021-02-16,NA,,Nicaragua,NA,2021-02-16,0,7,2021,2
65,2/16/2021 16:39:00,3,Spanish,NA,Florida - FL,Florida,FL,NA,02/16/2021,2021-02-16,NA,,Cuba,NA,2021-02-16,0,7,2021,2
65,2/16/2021 16:39:00,3,Spanish,NA,Florida - FL,Florida,FL,NA,02/16/2021,2021-02-16,NA,,Cuba,NA,2021-02-16,0,7,2021,2
65,2/16/2021 16:39:00,3,Spanish,NA,Florida - FL,Florida,FL,NA,02/16/2021,2021-02-16,NA,,Cuba,NA,2021-02-16,0,7,2021,2
66,2/16/2021 16:51:08,2,Romanian,NA,California - CA,California,CA,NA,02/16/2021,2021-02-16,NA,,Romania,NA,2021-02-16,0,7,2021,2
66,2/16/2021 16:51:08,2,Romanian,NA,California - CA,California,CA,NA,02/16/2021,2021-02-16,NA,,Romania,NA,2021-02-16,0,7,2021,2
67,2/16/2021 17:07:14,3,Spanish,NA,Florida - FL,Florida,FL,NA,02/16/2021,2021-02-16,NA,,Cuba,NA,2021-02-16,0,7,2021,2
67,2/16/2021 17:07:14,3,Spanish,NA,Florida - FL,Florida,FL,NA,02/16/2021,2021-02-16,NA,,Cuba,NA,2021-02-16,0,7,2021,2
67,2/16/2021 17:07:14,3,Spanish,NA,Florida - FL,Florida,FL,NA,02/16/2021,2021-02-16,NA,,Cuba,NA,2021-02-16,0,7,2021,2
68,2/16/2021 19:39:41,1,Spanish,NA,North Carolina - NC,North Carolina,NC,NA,02/24/2021,2021-02-24,NA,,Guatemala,NA,2021-02-16,8,7,2021,2
69,2/17/2021 11:10:52,3,Spanish,NA,Maryland - MD,Maryland,MD,NA,02/28/2021,2021-02-28,NA,,El Salvador,NA,2021-02-17,11,7,2021,2
69,2/17/2021 11:10:52,3,Spanish,NA,Maryland - MD,Maryland,MD,NA,02/28/2021,2021-02-28,NA,,El Salvador,NA,2021-02-17,11,7,2021,2
69,2/17/2021 11:10:52,3,Spanish,NA,Maryland - MD,Maryland,MD,NA,02/28/2021,2021-02-28,NA,,El Salvador,NA,2021-02-17,11,7,2021,2
70,2/17/2021 11:25:23,3,Spanish,NA,Oregon - OR,Oregon,OR,NA,02/18/2021,2021-02-18,NA,,Venezuela,NA,2021-02-17,1,7,2021,2
70,2/17/2021 11:25:23,3,Spanish,NA,Oregon - OR,Oregon,OR,NA,02/18/2021,2021-02-18,NA,,Venezuela,NA,2021-02-17,1,7,2021,2
70,2/17/2021 11:25:23,3,Spanish,NA,Oregon - OR,Oregon,OR,NA,02/18/2021,2021-02-18,NA,,Venezuela,NA,2021-02-17,1,7,2021,2
71,2/17/2021 11:39:31,3,Spanish,NA,Florida - FL,Florida,FL,NA,02/18/2021,2021-02-18,NA,,Venezuela,NA,2021-02-17,1,7,2021,2
71,2/17/2021 11:39:31,3,Spanish,NA,Florida - FL,Florida,FL,NA,02/18/2021,2021-02-18,NA,,Venezuela,NA,2021-02-17,1,7,2021,2
71,2/17/2021 11:39:31,3,Spanish,NA,Florida - FL,Florida,FL,NA,02/18/2021,2021-02-18,NA,,Venezuela,NA,2021-02-17,1,7,2021,2
72,2/17/2021 11:51:47,2,Spanish,NA,Florida - FL,Florida,FL,NA,02/18/2021,2021-02-18,NA,,Venezuela,NA,2021-02-17,1,7,2021,2
72,2/17/2021 11:51:47,2,Spanish,NA,Florida - FL,Florida,FL,NA,02/18/2021,2021-02-18,NA,,Venezuela,NA,2021-02-17,1,7,2021,2
73,2/17/2021 12:10:16,6,Spanish,NA,Utah - UT,Utah,UT,NA,02/17/2021,2021-02-17,NA,,Venezuela,NA,2021-02-17,0,7,2021,2
73,2/17/2021 12:10:16,6,Spanish,NA,Utah - UT,Utah,UT,NA,02/17/2021,2021-02-17,NA,,Venezuela,NA,2021-02-17,0,7,2021,2
73,2/17/2021 12:10:16,6,Spanish,NA,Utah - UT,Utah,UT,NA,02/17/2021,2021-02-17,NA,,Venezuela,NA,2021-02-17,0,7,2021,2
73,2/17/2021 12:10:16,6,Spanish,NA,Utah - UT,Utah,UT,NA,02/17/2021,2021-02-17,NA,,Venezuela,NA,2021-02-17,0,7,2021,2
73,2/17/2021 12:10:16,6,Spanish,NA,Utah - UT,Utah,UT,NA,02/17/2021,2021-02-17,NA,,Venezuela,NA,2021-02-17,0,7,2021,2
73,2/17/2021 12:10:16,6,Spanish,NA,Utah - UT,Utah,UT,NA,02/17/2021,2021-02-17,NA,,Venezuela,NA,2021-02-17,0,7,2021,2
74,2/17/2021 14:57:20,3,Spanish,NA,New York - NY,New York,NY,NA,02/23/2021,2021-02-23,NA,,Ecuador,NA,2021-02-17,6,7,2021,2
74,2/17/2021 14:57:20,3,Spanish,NA,New York - NY,New York,NY,NA,02/23/2021,2021-02-23,NA,,Ecuador,NA,2021-02-17,6,7,2021,2
74,2/17/2021 14:57:20,3,Spanish,NA,New York - NY,New York,NY,NA,02/23/2021,2021-02-23,NA,,Ecuador,NA,2021-02-17,6,7,2021,2
75,2/17/2021 15:05:24,2,Spanish,NA,New York - NY,New York,NY,NA,02/18/2021,2021-02-18,NA,,Ecuador,NA,2021-02-17,1,7,2021,2
75,2/17/2021 15:05:24,2,Spanish,NA,New York - NY,New York,NY,NA,02/18/2021,2021-02-18,NA,,Ecuador,NA,2021-02-17,1,7,2021,2
76,2/17/2021 15:39:11,1,Spanish,NA,Indiana - IN,Indiana,IN,NA,02/18/2021,2021-02-18,NA,,Venezuela,NA,2021-02-17,1,7,2021,2
77,2/17/2021 20:37:23,1,Spanish,NA,Florida - FL,Florida,FL,NA,02/25/2021,2021-02-25,NA,,Mexico,NA,2021-02-17,8,7,2021,2
78,2/18/2021 9:27:32,3,Spanish,NA,Georgia - GA,Georgia,GA,NA,02/19/2021,2021-02-19,NA,,Venezuela,NA,2021-02-18,1,7,2021,2
78,2/18/2021 9:27:32,3,Spanish,NA,Georgia - GA,Georgia,GA,NA,02/19/2021,2021-02-19,NA,,Venezuela,NA,2021-02-18,1,7,2021,2
78,2/18/2021 9:27:32,3,Spanish,NA,Georgia - GA,Georgia,GA,NA,02/19/2021,2021-02-19,NA,,Venezuela,NA,2021-02-18,1,7,2021,2
79,2/18/2021 9:33:23,1,Spanish,NA,Arizona - AZ,Arizona,AZ,NA,02/18/2021,2021-02-18,NA,,Venezuela,NA,2021-02-18,0,7,2021,2
80,2/18/2021 9:36:02,1,Spanish,NA,Florida - FL,Florida,FL,NA,02/19/2021,2021-02-19,NA,,Cuba,NA,2021-02-18,1,7,2021,2
81,2/18/2021 11:27:42,3,Spanish,NA,New York - NY,New York,NY,NA,02/19/2021,2021-02-19,NA,,Ecuador,NA,2021-02-18,1,7,2021,2
81,2/18/2021 11:27:42,3,Spanish,NA,New York - NY,New York,NY,NA,02/19/2021,2021-02-19,NA,,Ecuador,NA,2021-02-18,1,7,2021,2
81,2/18/2021 11:27:42,3,Spanish,NA,New York - NY,New York,NY,NA,02/19/2021,2021-02-19,NA,,Ecuador,NA,2021-02-18,1,7,2021,2
82,2/18/2021 16:18:59,1,Q'anjob'al,NA,California - CA,California,CA,NA,02/21/2021,2021-02-21,NA,,Guatemala,NA,2021-02-18,3,7,2021,2
83,2/19/2021 9:22:50,2,Spanish,NA,California - CA,California,CA,NA,02/21/2021,2021-02-21,NA,,Honduras,NA,2021-02-19,2,8,2021,2
83,2/19/2021 9:22:50,2,Spanish,NA,California - CA,California,CA,NA,02/21/2021,2021-02-21,NA,,Honduras,NA,2021-02-19,2,8,2021,2
84,2/19/2021 9:33:08,2,Spanish,NA,New York - NY,New York,NY,NA,02/21/2021,2021-02-21,NA,,Ecuador,NA,2021-02-19,2,8,2021,2
84,2/19/2021 9:33:08,2,Spanish,NA,New York - NY,New York,NY,NA,02/21/2021,2021-02-21,NA,,Ecuador,NA,2021-02-19,2,8,2021,2
85,2/19/2021 15:25:31,1,Spanish,NA,Massachusetts - MA,Massachusetts,MA,NA,02/22/2021,2021-02-22,NA,,Ecuador,NA,2021-02-19,3,8,2021,2
86,2/19/2021 15:33:50,2,Spanish,NA,New York - NY,New York,NY,NA,02/20/2021,2021-02-20,NA,,Ecuador,NA,2021-02-19,1,8,2021,2
86,2/19/2021 15:33:50,2,Spanish,NA,New York - NY,New York,NY,NA,02/20/2021,2021-02-20,NA,,Ecuador,NA,2021-02-19,1,8,2021,2
87,2/19/2021 15:35:01,2,Spanish,NA,Florida - FL,Florida,FL,NA,02/19/2021,2021-02-19,NA,,Guatemala,NA,2021-02-19,0,8,2021,2
87,2/19/2021 15:35:01,2,Spanish,NA,Florida - FL,Florida,FL,NA,02/19/2021,2021-02-19,NA,,Guatemala,NA,2021-02-19,0,8,2021,2
88,2/19/2021 15:43:15,2,Spanish,NA,New York - NY,New York,NY,NA,02/20/2021,2021-02-20,NA,,Ecuador,NA,2021-02-19,1,8,2021,2
88,2/19/2021 15:43:15,2,Spanish,NA,New York - NY,New York,NY,NA,02/20/2021,2021-02-20,NA,,Ecuador,NA,2021-02-19,1,8,2021,2
89,2/19/2021 15:44:04,2,Spanish,NA,Florida - FL,Florida,FL,NA,02/19/2021,2021-02-19,NA,,Cuba,NA,2021-02-19,0,8,2021,2
89,2/19/2021 15:44:04,2,Spanish,NA,Florida - FL,Florida,FL,NA,02/19/2021,2021-02-19,NA,,Cuba,NA,2021-02-19,0,8,2021,2
90,2/19/2021 15:56:43,3,Spanish,NA,New York - NY,New York,NY,NA,02/21/2021,2021-02-21,NA,,Ecuador,NA,2021-02-19,2,8,2021,2
90,2/19/2021 15:56:43,3,Spanish,NA,New York - NY,New York,NY,NA,02/21/2021,2021-02-21,NA,,Ecuador,NA,2021-02-19,2,8,2021,2
90,2/19/2021 15:56:43,3,Spanish,NA,New York - NY,New York,NY,NA,02/21/2021,2021-02-21,NA,,Ecuador,NA,2021-02-19,2,8,2021,2
91,2/19/2021 15:58:44,1,Spanish,NA,Georgia - GA,Georgia,GA,NA,02/19/2021,2021-02-19,NA,,Venezuela,NA,2021-02-19,0,8,2021,2
92,2/19/2021 15:58:53,1,Spanish,NA,Texas - TX,Texas,TX,NA,02/19/2021,2021-02-19,NA,,Venezuela,NA,2021-02-19,0,8,2021,2
93,2/19/2021 16:08:51,3,Spanish,NA,New York - NY,New York,NY,NA,02/21/2021,2021-02-21,NA,,Ecuador,NA,2021-02-19,2,8,2021,2
93,2/19/2021 16:08:51,3,Spanish,NA,New York - NY,New York,NY,NA,02/21/2021,2021-02-21,NA,,Ecuador,NA,2021-02-19,2,8,2021,2
93,2/19/2021 16:08:51,3,Spanish,NA,New York - NY,New York,NY,NA,02/21/2021,2021-02-21,NA,,Ecuador,NA,2021-02-19,2,8,2021,2
94,2/20/2021 10:03:09,3,Spanish,NA,Florida - FL,Florida,FL,NA,02/21/2021,2021-02-21,NA,,Cuba,NA,2021-02-20,1,8,2021,2
94,2/20/2021 10:03:09,3,Spanish,NA,Florida - FL,Florida,FL,NA,02/21/2021,2021-02-21,NA,,Cuba,NA,2021-02-20,1,8,2021,2
94,2/20/2021 10:03:09,3,Spanish,NA,Florida - FL,Florida,FL,NA,02/21/2021,2021-02-21,NA,,Cuba,NA,2021-02-20,1,8,2021,2
95,2/20/2021 10:15:48,3,Spanish,NA,Florida - FL,Florida,FL,NA,02/21/2021,2021-02-21,NA,,Cuba,NA,2021-02-20,1,8,2021,2
95,2/20/2021 10:15:48,3,Spanish,NA,Florida - FL,Florida,FL,NA,02/21/2021,2021-02-21,NA,,Cuba,NA,2021-02-20,1,8,2021,2
95,2/20/2021 10:15:48,3,Spanish,NA,Florida - FL,Florida,FL,NA,02/21/2021,2021-02-21,NA,,Cuba,NA,2021-02-20,1,8,2021,2
96,2/20/2021 10:48:48,3,Spanish,NA,Texas - TX,Texas,TX,NA,02/21/2021,2021-02-21,NA,,Cuba,NA,2021-02-20,1,8,2021,2
96,2/20/2021 10:48:48,3,Spanish,NA,Texas - TX,Texas,TX,NA,02/21/2021,2021-02-21,NA,,Cuba,NA,2021-02-20,1,8,2021,2
96,2/20/2021 10:48:48,3,Spanish,NA,Texas - TX,Texas,TX,NA,02/21/2021,2021-02-21,NA,,Cuba,NA,2021-02-20,1,8,2021,2
97,2/20/2021 13:49:15,3,Spanish,NA,Florida - FL,Florida,FL,NA,02/21/2021,2021-02-21,NA,,Cuba,NA,2021-02-20,1,8,2021,2
97,2/20/2021 13:49:15,3,Spanish,NA,Florida - FL,Florida,FL,NA,02/21/2021,2021-02-21,NA,,Cuba,NA,2021-02-20,1,8,2021,2
97,2/20/2021 13:49:15,3,Spanish,NA,Florida - FL,Florida,FL,NA,02/21/2021,2021-02-21,NA,,Cuba,NA,2021-02-20,1,8,2021,2
98,2/20/2021 14:03:35,4,Spanish,NA,Florida - FL,Florida,FL,NA,02/22/2021,2021-02-22,NA,,Cuba,NA,2021-02-20,2,8,2021,2
98,2/20/2021 14:03:35,4,Spanish,NA,Florida - FL,Florida,FL,NA,02/22/2021,2021-02-22,NA,,Cuba,NA,2021-02-20,2,8,2021,2
98,2/20/2021 14:03:35,4,Spanish,NA,Florida - FL,Florida,FL,NA,02/22/2021,2021-02-22,NA,,Cuba,NA,2021-02-20,2,8,2021,2
98,2/20/2021 14:03:35,4,Spanish,NA,Florida - FL,Florida,FL,NA,02/22/2021,2021-02-22,NA,,Cuba,NA,2021-02-20,2,8,2021,2
99,2/21/2021 14:49:01,2,Spanish,NA,New York - NY,New York,NY,NA,02/22/2021,2021-02-22,NA,,Ecuador,NA,2021-02-21,1,8,2021,2
99,2/21/2021 14:49:01,2,Spanish,NA,New York - NY,New York,NY,NA,02/22/2021,2021-02-22,NA,,Ecuador,NA,2021-02-21,1,8,2021,2
100,2/22/2021 10:27:27,2,Spanish,NA,Florida - FL,Florida,FL,NA,02/23/2021,2021-02-23,NA,,Cuba,NA,2021-02-22,1,8,2021,2
100,2/22/2021 10:27:27,2,Spanish,NA,Florida - FL,Florida,FL,NA,02/23/2021,2021-02-23,NA,,Cuba,NA,2021-02-22,1,8,2021,2
101,2/22/2021 10:34:58,1,Spanish,NA,Texas - TX,Texas,TX,NA,02/23/2021,2021-02-23,NA,,Venezuela,NA,2021-02-22,1,8,2021,2
102,2/22/2021 11:28:41,1,Spanish,NA,Tennessee - TN,Tennessee,TN,NA,02/23/2021,2021-02-23,NA,,Guatemala,NA,2021-02-22,1,8,2021,2
103,2/22/2021 17:12:29,1,Spanish,NA,Florida - FL,Florida,FL,NA,02/23/2021,2021-02-23,NA,,Venezuela,NA,2021-02-22,1,8,2021,2
104,2/22/2021 17:22:03,1,Spanish,NA,Florida - FL,Florida,FL,NA,02/23/2021,2021-02-23,NA,,Cuba,NA,2021-02-22,1,8,2021,2
105,2/22/2021 17:28:07,1,Spanish,NA,Florida - FL,Florida,FL,NA,02/23/2021,2021-02-23,NA,,Cuba,NA,2021-02-22,1,8,2021,2
106,2/22/2021 17:32:17,1,Spanish,NA,Florida - FL,Florida,FL,NA,02/23/2021,2021-02-23,NA,,Cuba,NA,2021-02-22,1,8,2021,2
107,2/23/2021 9:12:05,1,Spanish,NA,Massachusetts - MA,Massachusetts,MA,NA,02/26/2021,2021-02-26,NA,,Guatemala,NA,2021-02-23,3,8,2021,2
108,2/23/2021 11:30:48,1,Mam,NA,Tennessee - TN,Tennessee,TN,NA,02/24/2021,2021-02-24,NA,,Guatemala,NA,2021-02-23,1,8,2021,2
109,2/23/2021 13:18:40,2,Spanish,NA,Arizona - AZ,Arizona,AZ,NA,02/23/2021,2021-02-23,NA,,Venezuela,NA,2021-02-23,0,8,2021,2
109,2/23/2021 13:18:40,2,Spanish,NA,Arizona - AZ,Arizona,AZ,NA,02/23/2021,2021-02-23,NA,,Venezuela,NA,2021-02-23,0,8,2021,2
110,2/24/2021 12:51:21,2,Spanish,NA,New Jersey - NJ,New Jersey,NJ,NA,02/24/2021,2021-02-24,NA,,Venezuela,NA,2021-02-24,0,8,2021,2
110,2/24/2021 12:51:21,2,Spanish,NA,New Jersey - NJ,New Jersey,NJ,NA,02/24/2021,2021-02-24,NA,,Venezuela,NA,2021-02-24,0,8,2021,2
111,2/24/2021 12:51:54,3,Spanish,NA,Florida - FL,Florida,FL,NA,02/24/2021,2021-02-24,NA,,Cuba,NA,2021-02-24,0,8,2021,2
111,2/24/2021 12:51:54,3,Spanish,NA,Florida - FL,Florida,FL,NA,02/24/2021,2021-02-24,NA,,Cuba,NA,2021-02-24,0,8,2021,2
111,2/24/2021 12:51:54,3,Spanish,NA,Florida - FL,Florida,FL,NA,02/24/2021,2021-02-24,NA,,Cuba,NA,2021-02-24,0,8,2021,2
112,2/24/2021 12:53:17,3,Spanish,NA,Texas - TX,Texas,TX,NA,02/24/2021,2021-02-24,NA,,Venezuela,NA,2021-02-24,0,8,2021,2
112,2/24/2021 12:53:17,3,Spanish,NA,Texas - TX,Texas,TX,NA,02/24/2021,2021-02-24,NA,,Venezuela,NA,2021-02-24,0,8,2021,2
112,2/24/2021 12:53:17,3,Spanish,NA,Texas - TX,Texas,TX,NA,02/24/2021,2021-02-24,NA,,Venezuela,NA,2021-02-24,0,8,2021,2
113,2/24/2021 12:55:48,2,Spanish,NA,Utah - UT,Utah,UT,NA,02/24/2021,2021-02-24,NA,,Venezuela,NA,2021-02-24,0,8,2021,2
113,2/24/2021 12:55:48,2,Spanish,NA,Utah - UT,Utah,UT,NA,02/24/2021,2021-02-24,NA,,Venezuela,NA,2021-02-24,0,8,2021,2
114,2/24/2021 12:57:12,3,Spanish,NA,Florida - FL,Florida,FL,NA,02/24/2021,2021-02-24,NA,,Cuba,NA,2021-02-24,0,8,2021,2
114,2/24/2021 12:57:12,3,Spanish,NA,Florida - FL,Florida,FL,NA,02/24/2021,2021-02-24,NA,,Cuba,NA,2021-02-24,0,8,2021,2
114,2/24/2021 12:57:12,3,Spanish,NA,Florida - FL,Florida,FL,NA,02/24/2021,2021-02-24,NA,,Cuba,NA,2021-02-24,0,8,2021,2
115,2/24/2021 12:59:36,2,Spanish,NA,Florida - FL,Florida,FL,NA,02/24/2021,2021-02-24,NA,,Mexico,NA,2021-02-24,0,8,2021,2
115,2/24/2021 12:59:36,2,Spanish,NA,Florida - FL,Florida,FL,NA,02/24/2021,2021-02-24,NA,,Mexico,NA,2021-02-24,0,8,2021,2
116,2/24/2021 13:14:37,5,Spanish,NA,Tennessee - TN,Tennessee,TN,NA,02/24/2021,2021-02-24,NA,,Mexico,NA,2021-02-24,0,8,2021,2
116,2/24/2021 13:14:37,5,Spanish,NA,Tennessee - TN,Tennessee,TN,NA,02/24/2021,2021-02-24,NA,,Mexico,NA,2021-02-24,0,8,2021,2
116,2/24/2021 13:14:37,5,Spanish,NA,Tennessee - TN,Tennessee,TN,NA,02/24/2021,2021-02-24,NA,,Mexico,NA,2021-02-24,0,8,2021,2
116,2/24/2021 13:14:37,5,Spanish,NA,Tennessee - TN,Tennessee,TN,NA,02/24/2021,2021-02-24,NA,,Mexico,NA,2021-02-24,0,8,2021,2
116,2/24/2021 13:14:37,5,Spanish,NA,Tennessee - TN,Tennessee,TN,NA,02/24/2021,2021-02-24,NA,,Mexico,NA,2021-02-24,0,8,2021,2
117,2/24/2021 13:15:44,3,Spanish,NA,Indiana - IN,Indiana,IN,NA,02/24/2021,2021-02-24,NA,,Venezuela,NA,2021-02-24,0,8,2021,2
117,2/24/2021 13:15:44,3,Spanish,NA,Indiana - IN,Indiana,IN,NA,02/24/2021,2021-02-24,NA,,Venezuela,NA,2021-02-24,0,8,2021,2
117,2/24/2021 13:15:44,3,Spanish,NA,Indiana - IN,Indiana,IN,NA,02/24/2021,2021-02-24,NA,,Venezuela,NA,2021-02-24,0,8,2021,2
118,2/25/2021 12:03:08,2,Spanish,NA,Arizona - AZ,Arizona,AZ,NA,02/25/2021,2021-02-25,NA,,Venezuela,NA,2021-02-25,0,8,2021,2
118,2/25/2021 12:03:08,2,Spanish,NA,Arizona - AZ,Arizona,AZ,NA,02/25/2021,2021-02-25,NA,,Venezuela,NA,2021-02-25,0,8,2021,2
119,2/25/2021 15:16:21,1,Spanish,NA,Georgia - GA,Georgia,GA,NA,02/26/2021,2021-02-26,NA,,Venezuela,NA,2021-02-25,1,8,2021,2
120,2/25/2021 15:19:25,1,Spanish,NA,Texas - TX,Texas,TX,NA,02/26/2021,2021-02-26,NA,,Venezuela,NA,2021-02-25,1,8,2021,2
121,2/25/2021 15:22:32,1,Spanish,NA,Florida - FL,Florida,FL,NA,02/26/2021,2021-02-26,NA,,Cuba,NA,2021-02-25,1,8,2021,2
122,2/25/2021 15:27:49,1,Spanish,NA,Texas - TX,Texas,TX,NA,02/26/2021,2021-02-26,NA,,Venezuela,NA,2021-02-25,1,8,2021,2
123,2/25/2021 15:29:13,1,Spanish,NA,Washington - WA,Washington,WA,NA,02/26/2021,2021-02-26,NA,,Venezuela,NA,2021-02-25,1,8,2021,2
124,2/25/2021 15:40:25,2,Spanish,NA,Texas - TX,Texas,TX,NA,02/25/2021,2021-02-25,NA,,Cuba,NA,2021-02-25,0,8,2021,2
124,2/25/2021 15:40:25,2,Spanish,NA,Texas - TX,Texas,TX,NA,02/25/2021,2021-02-25,NA,,Cuba,NA,2021-02-25,0,8,2021,2
125,2/25/2021 15:43:25,1,Spanish,NA,Florida - FL,Florida,FL,NA,02/25/2021,2021-02-25,NA,,Cuba,NA,2021-02-25,0,8,2021,2
126,2/25/2021 17:28:48,1,Mam,NA,Pennsylvania - PA,Pennsylvania,PA,NA,02/27/2021,2021-02-27,NA,,Guatemala,NA,2021-02-25,2,8,2021,2
127,2/26/2021 11:17:43,3,Spanish,NA,Texas - TX,Texas,TX,NA,02/27/2021,2021-02-27,NA,,Venezuela,NA,2021-02-26,1,9,2021,2
127,2/26/2021 11:17:43,3,Spanish,NA,Texas - TX,Texas,TX,NA,02/27/2021,2021-02-27,NA,,Venezuela,NA,2021-02-26,1,9,2021,2
127,2/26/2021 11:17:43,3,Spanish,NA,Texas - TX,Texas,TX,NA,02/27/2021,2021-02-27,NA,,Venezuela,NA,2021-02-26,1,9,2021,2
128,2/26/2021 11:18:07,4,Spanish,NA,Florida - FL,Florida,FL,NA,02/27/2021,2021-02-27,NA,,Cuba,NA,2021-02-26,1,9,2021,2
128,2/26/2021 11:18:07,4,Spanish,NA,Florida - FL,Florida,FL,NA,02/27/2021,2021-02-27,NA,,Cuba,NA,2021-02-26,1,9,2021,2
128,2/26/2021 11:18:07,4,Spanish,NA,Florida - FL,Florida,FL,NA,02/27/2021,2021-02-27,NA,,Cuba,NA,2021-02-26,1,9,2021,2
128,2/26/2021 11:18:07,4,Spanish,NA,Florida - FL,Florida,FL,NA,02/27/2021,2021-02-27,NA,,Cuba,NA,2021-02-26,1,9,2021,2
129,2/26/2021 11:28:49,3,Spanish,NA,Texas - TX,Texas,TX,NA,02/27/2021,2021-02-27,NA,,Venezuela,NA,2021-02-26,1,9,2021,2
129,2/26/2021 11:28:49,3,Spanish,NA,Texas - TX,Texas,TX,NA,02/27/2021,2021-02-27,NA,,Venezuela,NA,2021-02-26,1,9,2021,2
129,2/26/2021 11:28:49,3,Spanish,NA,Texas - TX,Texas,TX,NA,02/27/2021,2021-02-27,NA,,Venezuela,NA,2021-02-26,1,9,2021,2
130,2/26/2021 11:29:48,4,Spanish,NA,Texas - TX,Texas,TX,NA,02/27/2021,2021-02-27,NA,,Venezuela,NA,2021-02-26,1,9,2021,2
130,2/26/2021 11:29:48,4,Spanish,NA,Texas - TX,Texas,TX,NA,02/27/2021,2021-02-27,NA,,Venezuela,NA,2021-02-26,1,9,2021,2
130,2/26/2021 11:29:48,4,Spanish,NA,Texas - TX,Texas,TX,NA,02/27/2021,2021-02-27,NA,,Venezuela,NA,2021-02-26,1,9,2021,2
130,2/26/2021 11:29:48,4,Spanish,NA,Texas - TX,Texas,TX,NA,02/27/2021,2021-02-27,NA,,Venezuela,NA,2021-02-26,1,9,2021,2
131,2/26/2021 11:44:30,1,Spanish,NA,Florida - FL,Florida,FL,NA,02/27/2021,2021-02-27,NA,,Venezuela,NA,2021-02-26,1,9,2021,2
132,2/26/2021 12:05:12,1,Spanish,NA,Texas - TX,Texas,TX,NA,02/27/2021,2021-02-27,NA,,Venezuela,NA,2021-02-26,1,9,2021,2
133,2/26/2021 14:51:59,1,Spanish,NA,New Jersey - NJ,New Jersey,NJ,NA,02/27/2021,2021-02-27,NA,,Costa Rica,NA,2021-02-26,1,9,2021,2
134,2/27/2021 10:10:57,3,Spanish,NA,New Jersey - NJ,New Jersey,NJ,NA,02/28/2021,2021-02-28,NA,,Cuba,NA,2021-02-27,1,9,2021,2
134,2/27/2021 10:10:57,3,Spanish,NA,New Jersey - NJ,New Jersey,NJ,NA,02/28/2021,2021-02-28,NA,,Cuba,NA,2021-02-27,1,9,2021,2
134,2/27/2021 10:10:57,3,Spanish,NA,New Jersey - NJ,New Jersey,NJ,NA,02/28/2021,2021-02-28,NA,,Cuba,NA,2021-02-27,1,9,2021,2
135,2/28/2021 11:55:55,2,Spanish,NA,New York - NY,New York,NY,NA,03/01/2021,2021-03-01,NA,,Ecuador,NA,2021-02-28,1,9,2021,2
135,2/28/2021 11:55:55,2,Spanish,NA,New York - NY,New York,NY,NA,03/01/2021,2021-03-01,NA,,Ecuador,NA,2021-02-28,1,9,2021,2
136,2/28/2021 12:13:22,3,Spanish,NA,Florida - FL,Florida,FL,NA,02/28/2021,2021-02-28,NA,,Venezuela,NA,2021-02-28,0,9,2021,2
136,2/28/2021 12:13:22,3,Spanish,NA,Florida - FL,Florida,FL,NA,02/28/2021,2021-02-28,NA,,Venezuela,NA,2021-02-28,0,9,2021,2
136,2/28/2021 12:13:22,3,Spanish,NA,Florida - FL,Florida,FL,NA,02/28/2021,2021-02-28,NA,,Venezuela,NA,2021-02-28,0,9,2021,2
137,2/28/2021 21:32:33,1,Spanish,NA,Georgia - GA,Georgia,GA,NA,03/01/2021,2021-03-01,NA,,Cuba,NA,2021-02-28,1,9,2021,2
138,2/28/2021 21:37:33,1,Spanish,NA,New York - NY,New York,NY,NA,03/01/2021,2021-03-01,NA,,Cuba,NA,2021-02-28,1,9,2021,2
139,2/28/2021 21:45:48,1,Spanish,NA,Kansas - KS,Kansas,KS,NA,03/02/2021,2021-03-02,NA,,Cuba,NA,2021-02-28,2,9,2021,2
140,2/28/2021 21:47:26,2,Spanish,NA,Texas - TX,Texas,TX,NA,03/01/2021,2021-03-01,NA,,Cuba,NA,2021-02-28,1,9,2021,2
140,2/28/2021 21:47:26,2,Spanish,NA,Texas - TX,Texas,TX,NA,03/01/2021,2021-03-01,NA,,Cuba,NA,2021-02-28,1,9,2021,2
141,2/28/2021 22:02:07,2,Portuguese,NA,Pennsylvania - PA,Pennsylvania,PA,NA,03/02/2021,2021-03-02,NA,,Brazil,NA,2021-02-28,2,9,2021,2
141,2/28/2021 22:02:07,2,Portuguese,NA,Pennsylvania - PA,Pennsylvania,PA,NA,03/02/2021,2021-03-02,NA,,Brazil,NA,2021-02-28,2,9,2021,2
142,2/28/2021 22:10:14,1,Spanish,NA,Texas - TX,Texas,TX,NA,03/01/2021,2021-03-01,NA,,Cuba,NA,2021-02-28,1,9,2021,2
143,2/28/2021 22:16:08,1,Spanish,NA,Texas - TX,Texas,TX,NA,03/06/2021,2021-03-06,NA,,Cuba,NA,2021-02-28,6,9,2021,2
144,2/28/2021 22:17:58,1,Spanish,NA,Florida - FL,Florida,FL,NA,03/01/2021,2021-03-01,NA,,Cuba,NA,2021-02-28,1,9,2021,2
145,2/28/2021 22:29:23,1,Spanish,NA,Florida - FL,Florida,FL,NA,03/02/2021,2021-03-02,NA,,Cuba,NA,2021-02-28,2,9,2021,2
146,2/28/2021 22:30:30,1,Spanish,NA,Florida - FL,Florida,FL,NA,03/01/2021,2021-03-01,NA,,Cuba,NA,2021-02-28,1,9,2021,2
147,2/28/2021 22:43:35,4,Portuguese,NA,Massachusetts - MA,Massachusetts,MA,NA,03/01/2021,2021-03-01,NA,,Brazil,NA,2021-02-28,1,9,2021,2
147,2/28/2021 22:43:35,4,Portuguese,NA,Massachusetts - MA,Massachusetts,MA,NA,03/01/2021,2021-03-01,NA,,Brazil,NA,2021-02-28,1,9,2021,2
147,2/28/2021 22:43:35,4,Portuguese,NA,Massachusetts - MA,Massachusetts,MA,NA,03/01/2021,2021-03-01,NA,,Brazil,NA,2021-02-28,1,9,2021,2
147,2/28/2021 22:43:35,4,Portuguese,NA,Massachusetts - MA,Massachusetts,MA,NA,03/01/2021,2021-03-01,NA,,Brazil,NA,2021-02-28,1,9,2021,2
148,2/28/2021 22:44:08,2,Spanish,NA,Florida - FL,Florida,FL,NA,03/01/2021,2021-03-01,NA,,Cuba,NA,2021-02-28,1,9,2021,2
148,2/28/2021 22:44:08,2,Spanish,NA,Florida - FL,Florida,FL,NA,03/01/2021,2021-03-01,NA,,Cuba,NA,2021-02-28,1,9,2021,2
149,2/28/2021 22:48:01,2,Spanish,NA,Texas - TX,Texas,TX,NA,03/01/2021,2021-03-01,NA,,Cuba,NA,2021-02-28,1,9,2021,2
149,2/28/2021 22:48:01,2,Spanish,NA,Texas - TX,Texas,TX,NA,03/01/2021,2021-03-01,NA,,Cuba,NA,2021-02-28,1,9,2021,2
150,2/28/2021 22:59:22,1,Spanish,NA,Florida - FL,Florida,FL,NA,03/02/2021,2021-03-02,NA,,Cuba,NA,2021-02-28,2,9,2021,2
151,2/28/2021 23:03:58,1,Spanish,NA,Nebraska - NE,Nebraska,NE,NA,03/02/2021,2021-03-02,NA,,Cuba,NA,2021-02-28,2,9,2021,2
152,3/1/2021 13:22:35,1,Nepali,NA,New York - NY,New York,NY,NA,03/02/2021,2021-03-02,NA,,Nepal,NA,2021-03-01,1,9,2021,3
153,3/1/2021 14:42:07,1,Spanish,NA,Kansas - KS,Kansas,KS,NA,03/02/2021,2021-03-02,NA,,Venezuela,NA,2021-03-01,1,9,2021,3
154,3/1/2021 14:45:49,2,Spanish,NA,Arizona - AZ,Arizona,AZ,NA,03/02/2021,2021-03-02,NA,,Venezuela,NA,2021-03-01,1,9,2021,3
154,3/1/2021 14:45:49,2,Spanish,NA,Arizona - AZ,Arizona,AZ,NA,03/02/2021,2021-03-02,NA,,Venezuela,NA,2021-03-01,1,9,2021,3
155,3/1/2021 14:52:57,1,Spanish,NA,Georgia - GA,Georgia,GA,NA,03/02/2021,2021-03-02,NA,,Venezuela,NA,2021-03-01,1,9,2021,3
156,3/1/2021 14:55:56,1,Albanian,NA,Connecticut - CT,Connecticut,CT,NA,03/03/2021,2021-03-03,NA,,Kosovo,NA,2021-03-01,2,9,2021,3
157,3/1/2021 15:00:00,1,Spanish,NA,Florida - FL,Florida,FL,NA,03/02/2021,2021-03-02,NA,,Cuba,NA,2021-03-01,1,9,2021,3
158,3/1/2021 15:05:23,1,Spanish,NA,Texas - TX,Texas,TX,NA,03/02/2021,2021-03-02,NA,,Venezuela,NA,2021-03-01,1,9,2021,3
159,3/1/2021 15:09:49,1,Spanish,NA,Florida - FL,Florida,FL,NA,03/02/2021,2021-03-02,NA,,Venezuela,NA,2021-03-01,1,9,2021,3
160,3/1/2021 15:11:26,2,Portuguese,NA,Massachusetts - MA,Massachusetts,MA,NA,03/01/2021,2021-03-01,NA,,Brazil,NA,2021-03-01,0,9,2021,3
160,3/1/2021 15:11:26,2,Portuguese,NA,Massachusetts - MA,Massachusetts,MA,NA,03/01/2021,2021-03-01,NA,,Brazil,NA,2021-03-01,0,9,2021,3
161,3/1/2021 15:23:46,1,Spanish,NA,Florida - FL,Florida,FL,NA,03/01/2021,2021-03-01,NA,,Cuba,NA,2021-03-01,0,9,2021,3
162,3/1/2021 15:35:46,1,Hindi,NA,California - CA,California,CA,NA,03/01/2021,2021-03-01,NA,,India,NA,2021-03-01,0,9,2021,3
163,3/1/2021 15:45:53,1,Hindi,NA,California - CA,California,CA,NA,03/01/2021,2021-03-01,NA,,India,NA,2021-03-01,0,9,2021,3
164,3/1/2021 15:58:37,2,Spanish,NA,Florida - FL,Florida,FL,NA,03/01/2021,2021-03-01,NA,,Cuba,NA,2021-03-01,0,9,2021,3
164,3/1/2021 15:58:37,2,Spanish,NA,Florida - FL,Florida,FL,NA,03/01/2021,2021-03-01,NA,,Cuba,NA,2021-03-01,0,9,2021,3
165,3/1/2021 16:08:21,1,Spanish,NA,Florida - FL,Florida,FL,NA,03/01/2021,2021-03-01,NA,,Cuba,NA,2021-03-01,0,9,2021,3
166,3/1/2021 16:23:08,2,Portuguese,NA,Florida - FL,Florida,FL,NA,03/02/2021,2021-03-02,NA,,Brazil,NA,2021-03-01,1,9,2021,3
166,3/1/2021 16:23:08,2,Portuguese,NA,Florida - FL,Florida,FL,NA,03/02/2021,2021-03-02,NA,,Brazil,NA,2021-03-01,1,9,2021,3
167,3/1/2021 16:56:05,3,Spanish,NA,Florida - FL,Florida,FL,NA,03/01/2021,2021-03-01,NA,,Cuba, Uruguay,2021-03-01,0,9,2021,3
167,3/1/2021 16:56:05,3,Spanish,NA,Florida - FL,Florida,FL,NA,03/01/2021,2021-03-01,NA,,Cuba, Uruguay,2021-03-01,0,9,2021,3
167,3/1/2021 16:56:05,3,Spanish,NA,Florida - FL,Florida,FL,NA,03/01/2021,2021-03-01,NA,,Cuba, Uruguay,2021-03-01,0,9,2021,3
168,3/1/2021 17:13:50,2,Spanish,NA,Texas - TX,Texas,TX,NA,03/01/2021,2021-03-01,NA,,Venezuela,NA,2021-03-01,0,9,2021,3
168,3/1/2021 17:13:50,2,Spanish,NA,Texas - TX,Texas,TX,NA,03/01/2021,2021-03-01,NA,,Venezuela,NA,2021-03-01,0,9,2021,3
169,3/1/2021 17:25:44,1,Spanish,NA,Nevada - NV,Nevada,NV,NA,03/01/2021,2021-03-01,NA,,Cuba,NA,2021-03-01,0,9,2021,3
170,3/1/2021 17:31:46,1,Spanish,NA,Texas - TX,Texas,TX,NA,03/01/2021,2021-03-01,NA,,Cuba,NA,2021-03-01,0,9,2021,3
171,3/1/2021 17:36:29,1,Spanish,NA,Nevada - NV,Nevada,NV,NA,03/01/2021,2021-03-01,NA,,Cuba,NA,2021-03-01,0,9,2021,3
172,3/1/2021 18:02:30,4,Portuguese,NA,Massachusetts - MA,Massachusetts,MA,NA,03/02/2021,2021-03-02,NA,,Brazil,NA,2021-03-01,1,9,2021,3
172,3/1/2021 18:02:30,4,Portuguese,NA,Massachusetts - MA,Massachusetts,MA,NA,03/02/2021,2021-03-02,NA,,Brazil,NA,2021-03-01,1,9,2021,3
172,3/1/2021 18:02:30,4,Portuguese,NA,Massachusetts - MA,Massachusetts,MA,NA,03/02/2021,2021-03-02,NA,,Brazil,NA,2021-03-01,1,9,2021,3
172,3/1/2021 18:02:30,4,Portuguese,NA,Massachusetts - MA,Massachusetts,MA,NA,03/02/2021,2021-03-02,NA,,Brazil,NA,2021-03-01,1,9,2021,3
173,3/1/2021 18:12:11,2,Spanish,NA,Texas - TX,Texas,TX,NA,03/01/2021,2021-03-01,NA,,Cuba,NA,2021-03-01,0,9,2021,3
173,3/1/2021 18:12:11,2,Spanish,NA,Texas - TX,Texas,TX,NA,03/01/2021,2021-03-01,NA,,Cuba,NA,2021-03-01,0,9,2021,3
174,3/1/2021 18:28:57,3,Spanish,NA,California - CA,California,CA,NA,03/01/2021,2021-03-01,NA,,Cuba,NA,2021-03-01,0,9,2021,3
174,3/1/2021 18:28:57,3,Spanish,NA,California - CA,California,CA,NA,03/01/2021,2021-03-01,NA,,Cuba,NA,2021-03-01,0,9,2021,3
174,3/1/2021 18:28:57,3,Spanish,NA,California - CA,California,CA,NA,03/01/2021,2021-03-01,NA,,Cuba,NA,2021-03-01,0,9,2021,3
175,3/1/2021 19:39:42,1,Spanish,NA,Nebraska - NE,Nebraska,NE,NA,03/01/2021,2021-03-01,NA,,Cuba,NA,2021-03-01,0,9,2021,3
176,3/1/2021 19:53:59,1,Spanish,NA,Florida - FL,Florida,FL,NA,03/02/2021,2021-03-02,NA,,Cuba,NA,2021-03-01,1,9,2021,3
177,3/1/2021 20:09:26,1,Portuguese,NA,Pennsylvania - PA,Pennsylvania,PA,NA,03/02/2021,2021-03-02,NA,,Brazil,NA,2021-03-01,1,9,2021,3
178,3/1/2021 20:12:56,1,Spanish,NA,Texas - TX,Texas,TX,NA,03/01/2021,2021-03-01,NA,,Cuba,NA,2021-03-01,0,9,2021,3
179,3/1/2021 20:20:10,1,Portuguese,NA,New Jersey - NJ,New Jersey,NJ,NA,03/02/2021,2021-03-02,NA,,Brazil,NA,2021-03-01,1,9,2021,3
180,3/1/2021 20:23:35,1,Spanish,NA,Florida - FL,Florida,FL,NA,03/04/2021,2021-03-04,NA,,Cuba,NA,2021-03-01,3,9,2021,3
181,3/1/2021 20:26:48,1,Portuguese,NA,Pennsylvania - PA,Pennsylvania,PA,NA,03/02/2021,2021-03-02,NA,,Brazil,NA,2021-03-01,1,9,2021,3
182,3/1/2021 20:29:25,1,Spanish,NA,Florida - FL,Florida,FL,NA,03/03/2021,2021-03-03,NA,,Cuba,NA,2021-03-01,2,9,2021,3
183,3/1/2021 20:33:13,1,Spanish,NA,Florida - FL,Florida,FL,NA,03/02/2021,2021-03-02,NA,,Cuba,NA,2021-03-01,1,9,2021,3
184,3/1/2021 20:33:52,1,Spanish,NA,Florida - FL,Florida,FL,NA,03/02/2021,2021-03-02,NA,,Mexico,NA,2021-03-01,1,9,2021,3
185,3/1/2021 20:45:03,1,Spanish,NA,Texas - TX,Texas,TX,NA,03/02/2021,2021-03-02,NA,,Cuba,NA,2021-03-01,1,9,2021,3
186,3/1/2021 20:53:32,1,Spanish,NA,Florida - FL,Florida,FL,NA,03/02/2021,2021-03-02,NA,,Cuba,NA,2021-03-01,1,9,2021,3
187,3/1/2021 21:02:02,1,Portuguese,NA,New Jersey - NJ,New Jersey,NJ,NA,03/02/2021,2021-03-02,NA,,Brazil,NA,2021-03-01,1,9,2021,3
188,3/1/2021 21:03:23,1,Spanish,NA,Florida - FL,Florida,FL,NA,03/02/1954,2021-03-02,NA,,Cuba,NA,2021-03-01,1,9,2021,3
189,3/1/2021 21:08:47,1,Spanish,NA,Florida - FL,Florida,FL,NA,03/02/2021,2021-03-02,NA,,Cuba,NA,2021-03-01,1,9,2021,3
190,3/2/2021 11:38:20,1,Spanish,NA,Georgia - GA,Georgia,GA,NA,03/04/2021,2021-03-04,NA,,Venezuela,NA,2021-03-02,2,9,2021,3
191,3/2/2021 11:48:15,4,Spanish,NA,New York - NY,New York,NY,NA,03/03/2021,2021-03-03,NA,,Ecuador,NA,2021-03-02,1,9,2021,3
191,3/2/2021 11:48:15,4,Spanish,NA,New York - NY,New York,NY,NA,03/03/2021,2021-03-03,NA,,Ecuador,NA,2021-03-02,1,9,2021,3
191,3/2/2021 11:48:15,4,Spanish,NA,New York - NY,New York,NY,NA,03/03/2021,2021-03-03,NA,,Ecuador,NA,2021-03-02,1,9,2021,3
191,3/2/2021 11:48:15,4,Spanish,NA,New York - NY,New York,NY,NA,03/03/2021,2021-03-03,NA,,Ecuador,NA,2021-03-02,1,9,2021,3
192,3/2/2021 13:51:49,2,Spanish,NA,Georgia - GA,Georgia,GA,NA,03/03/2021,2021-03-03,NA,,Mexico,NA,2021-03-02,1,9,2021,3
192,3/2/2021 13:51:49,2,Spanish,NA,Georgia - GA,Georgia,GA,NA,03/03/2021,2021-03-03,NA,,Mexico,NA,2021-03-02,1,9,2021,3
193,3/2/2021 14:03:28,2,Spanish,NA,Alabama - AL,Alabama,AL,NA,03/03/2021,2021-03-03,NA,,Guatemala,NA,2021-03-02,1,9,2021,3
193,3/2/2021 14:03:28,2,Spanish,NA,Alabama - AL,Alabama,AL,NA,03/03/2021,2021-03-03,NA,,Guatemala,NA,2021-03-02,1,9,2021,3
194,3/3/2021 10:48:20,1,Achi,NA,Florida - FL,Florida,FL,NA,03/04/2021,2021-03-04,NA,,Guatemala,NA,2021-03-03,1,9,2021,3
195,3/3/2021 11:22:49,6,Spanish,NA,Georgia - GA,Georgia,GA,NA,03/03/2021,2021-03-03,NA,,Venezuela,NA,2021-03-03,0,9,2021,3
195,3/3/2021 11:22:49,6,Spanish,NA,Georgia - GA,Georgia,GA,NA,03/03/2021,2021-03-03,NA,,Venezuela,NA,2021-03-03,0,9,2021,3
195,3/3/2021 11:22:49,6,Spanish,NA,Georgia - GA,Georgia,GA,NA,03/03/2021,2021-03-03,NA,,Venezuela,NA,2021-03-03,0,9,2021,3
195,3/3/2021 11:22:49,6,Spanish,NA,Georgia - GA,Georgia,GA,NA,03/03/2021,2021-03-03,NA,,Venezuela,NA,2021-03-03,0,9,2021,3
195,3/3/2021 11:22:49,6,Spanish,NA,Georgia - GA,Georgia,GA,NA,03/03/2021,2021-03-03,NA,,Venezuela,NA,2021-03-03,0,9,2021,3
195,3/3/2021 11:22:49,6,Spanish,NA,Georgia - GA,Georgia,GA,NA,03/03/2021,2021-03-03,NA,,Venezuela,NA,2021-03-03,0,9,2021,3
196,3/3/2021 11:32:53,1,Spanish,NA,Texas - TX,Texas,TX,NA,03/04/2021,2021-03-04,NA,,Venezuela,NA,2021-03-03,1,9,2021,3
197,3/3/2021 11:38:26,1,Spanish,NA,California - CA,California,CA,NA,03/03/2021,2021-03-03,NA,,Guatemala,NA,2021-03-03,0,9,2021,3
198,3/3/2021 11:44:38,2,Spanish,NA,Utah - UT,Utah,UT,NA,03/03/2021,2021-03-03,NA,,Venezuela,NA,2021-03-03,0,9,2021,3
198,3/3/2021 11:44:38,2,Spanish,NA,Utah - UT,Utah,UT,NA,03/03/2021,2021-03-03,NA,,Venezuela,NA,2021-03-03,0,9,2021,3
199,3/3/2021 11:52:28,2,Chuj,NA,Alabama - AL,Alabama,AL,NA,03/04/2021,2021-03-04,NA,,Guatemala,NA,2021-03-03,1,9,2021,3
199,3/3/2021 11:52:28,2,Chuj,NA,Alabama - AL,Alabama,AL,NA,03/04/2021,2021-03-04,NA,,Guatemala,NA,2021-03-03,1,9,2021,3
200,3/3/2021 19:00:00,2,Spanish,NA,"Newman Lake, WA",Washington,WA,NA,03/16/2021,2021-03-16,NA,Newman Lake,Venezuela,NA,2021-03-03,13,9,2021,3
200,3/3/2021 19:00:00,2,Spanish,NA,"Newman Lake, WA",Washington,WA,NA,03/16/2021,2021-03-16,NA,Newman Lake,Venezuela,NA,2021-03-03,13,9,2021,3
201,3/3/2021 19:00:00,1,Spanish,NA,"Tampa, FL",Florida,FL,NA,03/04/2021,2021-03-04,NA,Tampa,Cuba,NA,2021-03-03,1,9,2021,3
202,3/3/2021 19:00:00,1,Spanish,NA,"Miami, FL",Florida,FL,NA,03/04/2021,2021-03-04,NA,Miami,Cuba,NA,2021-03-03,1,9,2021,3
203,3/3/2021 19:00:00,1,Spanish,NA,"Las Vegas, NV",Nevada,NV,NA,03/04/2021,2021-03-04,NA,Las Vegas,Cuba,NA,2021-03-03,1,9,2021,3
204,3/3/2021 19:00:00,3,Portuguese,NA,"Philadelphia, PA",Pennsylvania,PA,NA,03/04/2021,2021-03-04,NA,Philadelphia,Brazil,NA,2021-03-03,1,9,2021,3
204,3/3/2021 19:00:00,3,Portuguese,NA,"Philadelphia, PA",Pennsylvania,PA,NA,03/04/2021,2021-03-04,NA,Philadelphia,Brazil,NA,2021-03-03,1,9,2021,3
204,3/3/2021 19:00:00,3,Portuguese,NA,"Philadelphia, PA",Pennsylvania,PA,NA,03/04/2021,2021-03-04,NA,Philadelphia,Brazil,NA,2021-03-03,1,9,2021,3
205,3/3/2021 19:00:00,3,Spanish,NA,"West Park, FL",Florida,FL,NA,03/04/2021,2021-03-04,NA,West Park,Venezuela,NA,2021-03-03,1,9,2021,3
205,3/3/2021 19:00:00,3,Spanish,NA,"West Park, FL",Florida,FL,NA,03/04/2021,2021-03-04,NA,West Park,Venezuela,NA,2021-03-03,1,9,2021,3
205,3/3/2021 19:00:00,3,Spanish,NA,"West Park, FL",Florida,FL,NA,03/04/2021,2021-03-04,NA,West Park,Venezuela,NA,2021-03-03,1,9,2021,3
206,3/3/2021 19:00:00,4,Spanish,NA,"Plantation, FL",Florida,FL,NA,03/04/2021,2021-03-04,NA,Plantation,Venezuela,NA,2021-03-03,1,9,2021,3
206,3/3/2021 19:00:00,4,Spanish,NA,"Plantation, FL",Florida,FL,NA,03/04/2021,2021-03-04,NA,Plantation,Venezuela,NA,2021-03-03,1,9,2021,3
206,3/3/2021 19:00:00,4,Spanish,NA,"Plantation, FL",Florida,FL,NA,03/04/2021,2021-03-04,NA,Plantation,Venezuela,NA,2021-03-03,1,9,2021,3
206,3/3/2021 19:00:00,4,Spanish,NA,"Plantation, FL",Florida,FL,NA,03/04/2021,2021-03-04,NA,Plantation,Venezuela,NA,2021-03-03,1,9,2021,3
207,3/3/2021 19:00:00,2,Spanish,NA,"Kissimee, FL",Florida,FL,NA,03/04/2021,2021-03-04,NA,Kissimmee,Cuba,NA,2021-03-03,1,9,2021,3
207,3/3/2021 19:00:00,2,Spanish,NA,"Kissimee, FL",Florida,FL,NA,03/04/2021,2021-03-04,NA,Kissimmee,Cuba,NA,2021-03-03,1,9,2021,3
208,3/3/2021 19:00:00,1,Spanish,NA,"Homested, FL",Florida,FL,NA,03/04/2021,2021-03-04,NA,Homestead,Cuba,NA,2021-03-03,1,9,2021,3
209,3/3/2021 19:00:00,1,Spanish,NA,"West Palm Beach, FL",Florida,FL,NA,03/04/2021,2021-03-04,NA,West Palm Beach,Cuba,NA,2021-03-03,1,9,2021,3
210,3/3/2021 19:00:00,1,Spanish,NA,"Fairdale, KY",Kentucky,KY,NA,03/04/2021,2021-03-04,NA,Fairdale,Cuba,NA,2021-03-03,1,9,2021,3
211,3/3/2021 19:00:00,1,Spanish,NA,"Venice, FL",Florida,FL,NA,03/04/2021,2021-03-04,NA,Venice,Cuba,NA,2021-03-03,1,9,2021,3
212,3/3/2021 19:00:00,1,Spanish,NA,"Las Vegas, NV",Nevada,NV,NA,03/04/2021,2021-03-04,NA,Las Vegas,Cuba,NA,2021-03-03,1,9,2021,3
213,3/3/2021 19:00:00,1,Spanish,NA,"Miami, FL",Florida,FL,NA,03/04/2021,2021-03-04,NA,Miami,Cuba,NA,2021-03-03,1,9,2021,3
214,3/3/2021 19:00:00,3,Portuguese,NA,"Pampano Beach, FL",Florida,FL,NA,03/04/2021,2021-03-04,NA,Pampano Beach,Brazil,NA,2021-03-03,1,9,2021,3
214,3/3/2021 19:00:00,3,Portuguese,NA,"Pampano Beach, FL",Florida,FL,NA,03/04/2021,2021-03-04,NA,Pampano Beach,Brazil,NA,2021-03-03,1,9,2021,3
214,3/3/2021 19:00:00,3,Portuguese,NA,"Pampano Beach, FL",Florida,FL,NA,03/04/2021,2021-03-04,NA,Pampano Beach,Brazil,NA,2021-03-03,1,9,2021,3
215,3/3/2021 19:00:00,1,Spanish,NA,"Hialeah, FL",Florida,FL,NA,03/04/2021,2021-03-04,NA,Hialeah,Cuba,NA,2021-03-03,1,9,2021,3
216,3/3/2021 19:00:00,1,Portuguese,NA,"Panama City, FL",Florida,FL,NA,03/04/2021,2021-03-04,NA,Panama City,Brazil,NA,2021-03-03,1,9,2021,3
217,3/3/2021 19:00:00,1,Spanish,NA,"Houston, TX",Texas,TX,NA,03/04/2021,2021-03-04,NA,Houston,Cuba,NA,2021-03-03,1,9,2021,3
218,3/3/2021 19:00:00,1,Spanish,NA,"Houston, TX",Texas,TX,NA,03/07/2021,2021-03-07,NA,Houston,Cuba,NA,2021-03-03,4,9,2021,3
219,3/3/2021 19:00:00,3,Portuguese,NA,"Farmingham, MA",Massachusetts,MA,NA,03/04/2021,2021-03-04,NA,Framingham,Brazil,NA,2021-03-03,1,9,2021,3
219,3/3/2021 19:00:00,3,Portuguese,NA,"Farmingham, MA",Massachusetts,MA,NA,03/04/2021,2021-03-04,NA,Framingham,Brazil,NA,2021-03-03,1,9,2021,3
219,3/3/2021 19:00:00,3,Portuguese,NA,"Farmingham, MA",Massachusetts,MA,NA,03/04/2021,2021-03-04,NA,Framingham,Brazil,NA,2021-03-03,1,9,2021,3
220,3/3/2021 19:00:00,2,Portuguese,NA,"Boston, MA",Massachusetts,MA,NA,03/04/2021,2021-03-04,NA,Boston,Brazil,NA,2021-03-03,1,9,2021,3
220,3/3/2021 19:00:00,2,Portuguese,NA,"Boston, MA",Massachusetts,MA,NA,03/04/2021,2021-03-04,NA,Boston,Brazil,NA,2021-03-03,1,9,2021,3
221,3/3/2021 19:00:00,3,Portuguese,NA,"Hoover, AL",Alabama,AL,NA,03/04/2021,2021-03-04,NA,Hoover,Brazil,NA,2021-03-03,1,9,2021,3
221,3/3/2021 19:00:00,3,Portuguese,NA,"Hoover, AL",Alabama,AL,NA,03/04/2021,2021-03-04,NA,Hoover,Brazil,NA,2021-03-03,1,9,2021,3
221,3/3/2021 19:00:00,3,Portuguese,NA,"Hoover, AL",Alabama,AL,NA,03/04/2021,2021-03-04,NA,Hoover,Brazil,NA,2021-03-03,1,9,2021,3
222,3/3/2021 19:00:00,2,Spanish,NA,"Metarie, LA",Louisiana,LA,NA,03/04/2021,2021-03-04,NA,Metairie,Nicaragua,NA,2021-03-03,1,9,2021,3
222,3/3/2021 19:00:00,2,Spanish,NA,"Metarie, LA",Louisiana,LA,NA,03/04/2021,2021-03-04,NA,Metairie,Nicaragua,NA,2021-03-03,1,9,2021,3
223,3/3/2021 19:00:00,3,Spanish,NA,"Tampa, FL",Florida,FL,NA,03/04/2021,2021-03-04,NA,Tampa,Cuba,NA,2021-03-03,1,9,2021,3
223,3/3/2021 19:00:00,3,Spanish,NA,"Tampa, FL",Florida,FL,NA,03/04/2021,2021-03-04,NA,Tampa,Cuba,NA,2021-03-03,1,9,2021,3
223,3/3/2021 19:00:00,3,Spanish,NA,"Tampa, FL",Florida,FL,NA,03/04/2021,2021-03-04,NA,Tampa,Cuba,NA,2021-03-03,1,9,2021,3
224,3/3/2021 19:00:00,3,Portuguese,NA,"Marshfield, MA",Massachusetts,MA,NA,03/04/2021,2021-03-04,NA,Marshfield,Brazil,NA,2021-03-03,1,9,2021,3
224,3/3/2021 19:00:00,3,Portuguese,NA,"Marshfield, MA",Massachusetts,MA,NA,03/04/2021,2021-03-04,NA,Marshfield,Brazil,NA,2021-03-03,1,9,2021,3
224,3/3/2021 19:00:00,3,Portuguese,NA,"Marshfield, MA",Massachusetts,MA,NA,03/04/2021,2021-03-04,NA,Marshfield,Brazil,NA,2021-03-03,1,9,2021,3
225,3/4/2021 16:05:50,4,Spanish,NA,Florida - FL,Florida,FL,NA,03/04/2021,2021-03-04,NA,,Venezuela,NA,2021-03-04,0,9,2021,3
225,3/4/2021 16:05:50,4,Spanish,NA,Florida - FL,Florida,FL,NA,03/04/2021,2021-03-04,NA,,Venezuela,NA,2021-03-04,0,9,2021,3
225,3/4/2021 16:05:50,4,Spanish,NA,Florida - FL,Florida,FL,NA,03/04/2021,2021-03-04,NA,,Venezuela,NA,2021-03-04,0,9,2021,3
225,3/4/2021 16:05:50,4,Spanish,NA,Florida - FL,Florida,FL,NA,03/04/2021,2021-03-04,NA,,Venezuela,NA,2021-03-04,0,9,2021,3
226,3/4/2021 16:16:27,3,Spanish,NA,Texas - TX,Texas,TX,NA,03/04/2021,2021-03-04,NA,,Venezuela,NA,2021-03-04,0,9,2021,3
226,3/4/2021 16:16:27,3,Spanish,NA,Texas - TX,Texas,TX,NA,03/04/2021,2021-03-04,NA,,Venezuela,NA,2021-03-04,0,9,2021,3
226,3/4/2021 16:16:27,3,Spanish,NA,Texas - TX,Texas,TX,NA,03/04/2021,2021-03-04,NA,,Venezuela,NA,2021-03-04,0,9,2021,3
227,3/4/2021 16:29:04,3,Spanish,NA,Texas - TX,Texas,TX,NA,03/04/2021,2021-03-04,NA,,Venezuela,NA,2021-03-04,0,9,2021,3
227,3/4/2021 16:29:04,3,Spanish,NA,Texas - TX,Texas,TX,NA,03/04/2021,2021-03-04,NA,,Venezuela,NA,2021-03-04,0,9,2021,3
227,3/4/2021 16:29:04,3,Spanish,NA,Texas - TX,Texas,TX,NA,03/04/2021,2021-03-04,NA,,Venezuela,NA,2021-03-04,0,9,2021,3
228,3/4/2021 16:30:06,4,Spanish,NA,Florida - FL,Florida,FL,NA,03/04/2021,2021-03-04,NA,,Cuba,NA,2021-03-04,0,9,2021,3
228,3/4/2021 16:30:06,4,Spanish,NA,Florida - FL,Florida,FL,NA,03/04/2021,2021-03-04,NA,,Cuba,NA,2021-03-04,0,9,2021,3
228,3/4/2021 16:30:06,4,Spanish,NA,Florida - FL,Florida,FL,NA,03/04/2021,2021-03-04,NA,,Cuba,NA,2021-03-04,0,9,2021,3
228,3/4/2021 16:30:06,4,Spanish,NA,Florida - FL,Florida,FL,NA,03/04/2021,2021-03-04,NA,,Cuba,NA,2021-03-04,0,9,2021,3
229,3/4/2021 16:49:33,1,Spanish,NA,Texas - TX,Texas,TX,NA,03/04/2021,2021-03-04,NA,,Cuba,NA,2021-03-04,0,9,2021,3
230,3/4/2021 17:01:39,3,Spanish,NA,Florida - FL,Florida,FL,NA,03/04/2021,2021-03-04,NA,,Cuba,NA,2021-03-04,0,9,2021,3
230,3/4/2021 17:01:39,3,Spanish,NA,Florida - FL,Florida,FL,NA,03/04/2021,2021-03-04,NA,,Cuba,NA,2021-03-04,0,9,2021,3
230,3/4/2021 17:01:39,3,Spanish,NA,Florida - FL,Florida,FL,NA,03/04/2021,2021-03-04,NA,,Cuba,NA,2021-03-04,0,9,2021,3
231,3/4/2021 18:22:00,2,Spanish,NA,"Miami, FL",Florida,FL,NA,03/07/2021,2021-03-07,NA,Miami,Cuba,NA,2021-03-04,3,9,2021,3
231,3/4/2021 18:22:00,2,Spanish,NA,"Miami, FL",Florida,FL,NA,03/07/2021,2021-03-07,NA,Miami,Cuba,NA,2021-03-04,3,9,2021,3
232,3/4/2021 18:22:00,1,Spanish,NA,"Miami, FL",Florida,FL,NA,03/05/2021,2021-03-05,NA,Miami,Cuba,NA,2021-03-04,1,9,2021,3
233,3/4/2021 18:22:00,3,Spanish,NA,"Miami, FL",Florida,FL,NA,03/04/2021,2021-03-04,NA,Miami,Cuba,NA,2021-03-04,0,9,2021,3
233,3/4/2021 18:22:00,3,Spanish,NA,"Miami, FL",Florida,FL,NA,03/04/2021,2021-03-04,NA,Miami,Cuba,NA,2021-03-04,0,9,2021,3
233,3/4/2021 18:22:00,3,Spanish,NA,"Miami, FL",Florida,FL,NA,03/04/2021,2021-03-04,NA,Miami,Cuba,NA,2021-03-04,0,9,2021,3
234,3/4/2021 18:22:00,2,Spanish,NA,"Miami, FL",Florida,FL,NA,03/05/2021,2021-03-05,NA,Miami,Cuba,NA,2021-03-04,1,9,2021,3
234,3/4/2021 18:22:00,2,Spanish,NA,"Miami, FL",Florida,FL,NA,03/05/2021,2021-03-05,NA,Miami,Cuba,NA,2021-03-04,1,9,2021,3
235,3/4/2021 18:22:00,1,Spanish,NA,"Miami, FL",Florida,FL,NA,03/04/2021,2021-03-04,NA,Miami,Cuba,NA,2021-03-04,0,9,2021,3
236,3/4/2021 18:22:00,1,Spanish,NA,"Miami, FL",Florida,FL,NA,03/05/2021,2021-03-05,NA,Miami,Cuba,NA,2021-03-04,1,9,2021,3
237,3/4/2021 18:22:00,3,Spanish,NA,"Miami, FL",Florida,FL,NA,03/05/2021,2021-03-05,NA,Miami,Cuba,NA,2021-03-04,1,9,2021,3
237,3/4/2021 18:22:00,3,Spanish,NA,"Miami, FL",Florida,FL,NA,03/05/2021,2021-03-05,NA,Miami,Cuba,NA,2021-03-04,1,9,2021,3
237,3/4/2021 18:22:00,3,Spanish,NA,"Miami, FL",Florida,FL,NA,03/05/2021,2021-03-05,NA,Miami,Cuba,NA,2021-03-04,1,9,2021,3
238,3/4/2021 18:22:00,3,Spanish,NA,"Houston, TX",Texas,TX,NA,03/05/2021,2021-03-05,NA,Houston,Cuba,NA,2021-03-04,1,9,2021,3
238,3/4/2021 18:22:00,3,Spanish,NA,"Houston, TX",Texas,TX,NA,03/05/2021,2021-03-05,NA,Houston,Cuba,NA,2021-03-04,1,9,2021,3
238,3/4/2021 18:22:00,3,Spanish,NA,"Houston, TX",Texas,TX,NA,03/05/2021,2021-03-05,NA,Houston,Cuba,NA,2021-03-04,1,9,2021,3
239,3/4/2021 18:22:00,1,Spanish,NA,"Miami, FL",Florida,FL,NA,03/05/2021,2021-03-05,NA,Miami,Cuba,NA,2021-03-04,1,9,2021,3
240,3/4/2021 18:22:00,1,Spanish,NA,"Houston, TX",Texas,TX,NA,03/05/2021,2021-03-05,NA,Houston,Cuba,NA,2021-03-04,1,9,2021,3
241,3/4/2021 18:22:00,1,Spanish,NA,"Miami, FL",Florida,FL,NA,03/05/2021,2021-03-05,NA,Miami,Cuba,NA,2021-03-04,1,9,2021,3
242,3/4/2021 18:22:00,1,Spanish,NA,"Houston, TX",Texas,TX,NA,03/05/2021,2021-03-05,NA,Houston,Cuba,NA,2021-03-04,1,9,2021,3
243,3/4/2021 18:22:00,4,Spanish,NA,"San Antonio, TX",Texas,TX,NA,03/04/2021,2021-03-04,NA,San Antonio,Cuba,NA,2021-03-04,0,9,2021,3
243,3/4/2021 18:22:00,4,Spanish,NA,"San Antonio, TX",Texas,TX,NA,03/04/2021,2021-03-04,NA,San Antonio,Cuba,NA,2021-03-04,0,9,2021,3
243,3/4/2021 18:22:00,4,Spanish,NA,"San Antonio, TX",Texas,TX,NA,03/04/2021,2021-03-04,NA,San Antonio,Cuba,NA,2021-03-04,0,9,2021,3
243,3/4/2021 18:22:00,4,Spanish,NA,"San Antonio, TX",Texas,TX,NA,03/04/2021,2021-03-04,NA,San Antonio,Cuba,NA,2021-03-04,0,9,2021,3
244,3/4/2021 18:22:00,2,Spanish,NA,"Detroit, MI",Michigan,MI,NA,03/05/2021,2021-03-05,NA,Detroit,Cuba,NA,2021-03-04,1,9,2021,3
244,3/4/2021 18:22:00,2,Spanish,NA,"Detroit, MI",Michigan,MI,NA,03/05/2021,2021-03-05,NA,Detroit,Cuba,NA,2021-03-04,1,9,2021,3
245,3/4/2021 18:22:00,1,Spanish,NA,"Tampa, FL",Florida,FL,NA,03/05/2021,2021-03-05,NA,Tampa,NA,NA,2021-03-04,1,9,2021,3
246,3/4/2021 18:22:00,1,Spanish,NA,"Miami, FL",Florida,FL,NA,03/05/2021,2021-03-05,NA,Miami,NA,NA,2021-03-04,1,9,2021,3
247,3/4/2021 18:22:00,1,Spanish,NA,"Miami, FL",Florida,FL,NA,03/05/2021,2021-03-05,NA,Miami,NA,NA,2021-03-04,1,9,2021,3
248,3/4/2021 18:22:00,1,Spanish,NA,"Miami, FL",Florida,FL,NA,03/05/2021,2021-03-05,NA,Miami,NA,NA,2021-03-04,1,9,2021,3
249,3/4/2021 18:22:00,3,Portuguese,NA,"Framingham, MA",Massachusetts,MA,NA,03/05/2021,2021-03-05,NA,Framingham,NA,NA,2021-03-04,1,9,2021,3
249,3/4/2021 18:22:00,3,Portuguese,NA,"Framingham, MA",Massachusetts,MA,NA,03/05/2021,2021-03-05,NA,Framingham,NA,NA,2021-03-04,1,9,2021,3
249,3/4/2021 18:22:00,3,Portuguese,NA,"Framingham, MA",Massachusetts,MA,NA,03/05/2021,2021-03-05,NA,Framingham,NA,NA,2021-03-04,1,9,2021,3
250,3/4/2021 18:22:00,1,Portuguese,NA,"San Francisco, CA",California,CA,NA,03/08/2021,2021-03-08,NA,San Francisco,NA,NA,2021-03-04,4,9,2021,3
251,3/4/2021 18:22:00,1,Portuguese,NA,"Quincy, MA",Massachusetts,MA,NA,03/05/2021,2021-03-05,NA,Quincy,NA,NA,2021-03-04,1,9,2021,3
252,3/4/2021 18:22:00,1,Spanish,NA,"Tampa, FL",Florida,FL,NA,03/04/2021,2021-03-04,NA,Tampa,NA,NA,2021-03-04,0,9,2021,3
253,3/4/2021 18:22:00,1,Spanish,NA,"Tampa, FL",Florida,FL,NA,03/05/2021,2021-03-05,NA,Tampa,NA,NA,2021-03-04,1,9,2021,3
254,3/4/2021 18:22:00,3,Spanish,NA,"Phoenix, AZ",Arizona,AZ,NA,03/05/2021,2021-03-05,NA,Phoenix,NA,NA,2021-03-04,1,9,2021,3
254,3/4/2021 18:22:00,3,Spanish,NA,"Phoenix, AZ",Arizona,AZ,NA,03/05/2021,2021-03-05,NA,Phoenix,NA,NA,2021-03-04,1,9,2021,3
254,3/4/2021 18:22:00,3,Spanish,NA,"Phoenix, AZ",Arizona,AZ,NA,03/05/2021,2021-03-05,NA,Phoenix,NA,NA,2021-03-04,1,9,2021,3
255,3/4/2021 18:22:00,1,Spanish,NA,"Miami, FL",Florida,FL,NA,03/05/2021,2021-03-05,NA,Miami,NA,NA,2021-03-04,1,9,2021,3
256,3/4/2021 18:22:00,1,Spanish,NA,"San Diego, CA",California,CA,NA,03/08/2021,2021-03-08,NA,San Diego,NA,NA,2021-03-04,4,9,2021,3
257,3/4/2021 18:22:00,1,Creole,NA,"Miami, FL",Florida,FL,NA,03/07/2021,2021-03-07,NA,Miami,NA,NA,2021-03-04,3,9,2021,3
258,3/4/2021 18:22:00,1,Spanish,NA,"Cypress, TX",Texas,TX,NA,03/05/2021,2021-03-05,NA,Cypress,NA,NA,2021-03-04,1,9,2021,3
259,3/4/2021 18:22:00,1,Spanish,NA,"Miami, FL",Florida,FL,NA,03/05/2021,2021-03-05,NA,Miami,NA,NA,2021-03-04,1,9,2021,3
260,3/4/2021 18:22:00,1,Spanish,NA,"San Antonio, TX",Texas,TX,NA,03/05/2021,2021-03-05,NA,San Antonio,NA,NA,2021-03-04,1,9,2021,3
261,3/4/2021 18:22:00,2,Spanish,NA,"Detroit, MI",Michigan,MI,NA,03/05/2021,2021-03-05,NA,Detroit,NA,NA,2021-03-04,1,9,2021,3
261,3/4/2021 18:22:00,2,Spanish,NA,"Detroit, MI",Michigan,MI,NA,03/05/2021,2021-03-05,NA,Detroit,NA,NA,2021-03-04,1,9,2021,3
262,3/4/2021 18:22:00,3,Portuguese,NA,"Milford, MS",Mississippi,MS,NA,03/04/2021,2021-03-04,NA,Milford,NA,NA,2021-03-04,0,9,2021,3
262,3/4/2021 18:22:00,3,Portuguese,NA,"Milford, MS",Mississippi,MS,NA,03/04/2021,2021-03-04,NA,Milford,NA,NA,2021-03-04,0,9,2021,3
262,3/4/2021 18:22:00,3,Portuguese,NA,"Milford, MS",Mississippi,MS,NA,03/04/2021,2021-03-04,NA,Milford,NA,NA,2021-03-04,0,9,2021,3
263,3/4/2021 18:23:00,2,Spanish,NA,NA,NA,NA,NA,03/05/2021,2021-03-05,NA,,NA,NA,2021-03-04,1,9,2021,3
263,3/4/2021 18:23:00,2,Spanish,NA,NA,NA,NA,NA,03/05/2021,2021-03-05,NA,,NA,NA,2021-03-04,1,9,2021,3
264,3/5/2021 10:04:00,1,Spanish,NA,Florida - FL,Florida,FL,NA,03/05/2021,2021-03-05,NA,,Venezuela,NA,2021-03-05,0,10,2021,3
265,3/5/2021 10:14:59,4,Spanish,NA,Florida - FL,Florida,FL,NA,03/05/2021,2021-03-05,NA,,Venezuela,NA,2021-03-05,0,10,2021,3
265,3/5/2021 10:14:59,4,Spanish,NA,Florida - FL,Florida,FL,NA,03/05/2021,2021-03-05,NA,,Venezuela,NA,2021-03-05,0,10,2021,3
265,3/5/2021 10:14:59,4,Spanish,NA,Florida - FL,Florida,FL,NA,03/05/2021,2021-03-05,NA,,Venezuela,NA,2021-03-05,0,10,2021,3
265,3/5/2021 10:14:59,4,Spanish,NA,Florida - FL,Florida,FL,NA,03/05/2021,2021-03-05,NA,,Venezuela,NA,2021-03-05,0,10,2021,3
266,3/5/2021 10:25:27,4,Spanish,NA,Texas - TX,Texas,TX,NA,03/05/2021,2021-03-05,NA,,Venezuela,NA,2021-03-05,0,10,2021,3
266,3/5/2021 10:25:27,4,Spanish,NA,Texas - TX,Texas,TX,NA,03/05/2021,2021-03-05,NA,,Venezuela,NA,2021-03-05,0,10,2021,3
266,3/5/2021 10:25:27,4,Spanish,NA,Texas - TX,Texas,TX,NA,03/05/2021,2021-03-05,NA,,Venezuela,NA,2021-03-05,0,10,2021,3
266,3/5/2021 10:25:27,4,Spanish,NA,Texas - TX,Texas,TX,NA,03/05/2021,2021-03-05,NA,,Venezuela,NA,2021-03-05,0,10,2021,3
267,3/5/2021 10:30:38,1,Spanish,NA,Texas - TX,Texas,TX,NA,03/05/2021,2021-03-05,NA,,Venezuela,NA,2021-03-05,0,10,2021,3
268,3/5/2021 11:36:14,1,Achi,NA,California - CA,California,CA,NA,03/07/2021,2021-03-07,NA,,Guatemala,NA,2021-03-05,2,10,2021,3
269,3/5/2021 11:47:29,4,Spanish,NA,Colorado - CO,Colorado,CO,NA,03/09/2021,2021-03-09,NA,,Mexico,NA,2021-03-05,4,10,2021,3
269,3/5/2021 11:47:29,4,Spanish,NA,Colorado - CO,Colorado,CO,NA,03/09/2021,2021-03-09,NA,,Mexico,NA,2021-03-05,4,10,2021,3
269,3/5/2021 11:47:29,4,Spanish,NA,Colorado - CO,Colorado,CO,NA,03/09/2021,2021-03-09,NA,,Mexico,NA,2021-03-05,4,10,2021,3
269,3/5/2021 11:47:29,4,Spanish,NA,Colorado - CO,Colorado,CO,NA,03/09/2021,2021-03-09,NA,,Mexico,NA,2021-03-05,4,10,2021,3
270,3/5/2021 11:51:14,1,Spanish,NA,California - CA,California,CA,NA,03/06/2021,2021-03-06,NA,,Guatemala,NA,2021-03-05,1,10,2021,3
271,3/5/2021 11:56:51,1,Achi,NA,New Jersey - NJ,New Jersey,NJ,NA,03/07/2021,2021-03-07,NA,,Guatemala,NA,2021-03-05,2,10,2021,3
272,3/5/2021 11:59:56,1,Spanish,NA,New York - NY,New York,NY,NA,03/06/2021,2021-03-06,NA,,Guatemala,NA,2021-03-05,1,10,2021,3
273,3/5/2021 15:16:50,1,Quichua,NA,New York - NY,New York,NY,NA,03/16/2021,2021-03-16,NA,,Ecuador,NA,2021-03-05,11,10,2021,3
274,3/6/2021 10:49:44,2,Spanish,NA,Georgia - GA,Georgia,GA,NA,03/07/2021,2021-03-07,NA,,Venezuela,NA,2021-03-06,1,10,2021,3
274,3/6/2021 10:49:44,2,Spanish,NA,Georgia - GA,Georgia,GA,NA,03/07/2021,2021-03-07,NA,,Venezuela,NA,2021-03-06,1,10,2021,3
275,3/6/2021 10:55:58,1,Spanish,NA,New Jersey - NJ,New Jersey,NJ,NA,03/07/2021,2021-03-07,NA,,Ecuador,NA,2021-03-06,1,10,2021,3
276,3/6/2021 11:05:34,1,Spanish,NA,Florida - FL,Florida,FL,NA,03/07/2021,2021-03-07,NA,,Cuba,NA,2021-03-06,1,10,2021,3
277,3/6/2021 11:10:59,1,Spanish,NA,Texas - TX,Texas,TX,NA,03/07/2021,2021-03-07,NA,,Venezuela,NA,2021-03-06,1,10,2021,3
278,3/6/2021 11:22:05,1,Spanish,NA,Florida - FL,Florida,FL,NA,03/07/2021,2021-03-07,NA,,Nicaragua,NA,2021-03-06,1,10,2021,3
279,3/6/2021 19:50:00,3,Spanish,NA,"Miami, FL",Florida,FL,NA,03/07/2021,2021-03-07,NA,Miami,Cuba,NA,2021-03-06,1,10,2021,3
279,3/6/2021 19:50:00,3,Spanish,NA,"Miami, FL",Florida,FL,NA,03/07/2021,2021-03-07,NA,Miami,Cuba,NA,2021-03-06,1,10,2021,3
279,3/6/2021 19:50:00,3,Spanish,NA,"Miami, FL",Florida,FL,NA,03/07/2021,2021-03-07,NA,Miami,Cuba,NA,2021-03-06,1,10,2021,3
280,3/6/2021 19:50:00,3,Spanish,NA,"Riviera Beach, FL",Florida,FL,NA,03/07/2021,2021-03-07,NA,Riviera Beach,NA,NA,2021-03-06,1,10,2021,3
280,3/6/2021 19:50:00,3,Spanish,NA,"Riviera Beach, FL",Florida,FL,NA,03/07/2021,2021-03-07,NA,Riviera Beach,NA,NA,2021-03-06,1,10,2021,3
280,3/6/2021 19:50:00,3,Spanish,NA,"Riviera Beach, FL",Florida,FL,NA,03/07/2021,2021-03-07,NA,Riviera Beach,NA,NA,2021-03-06,1,10,2021,3
281,3/6/2021 19:50:00,1,Spanish,NA,"Baton Rouge, LA",Louisiana,LA,NA,03/07/2021,2021-03-07,NA,Baton Rouge,NA,NA,2021-03-06,1,10,2021,3
282,3/6/2021 19:50:00,2,NA,NA,"Cutter Bay, FL",Florida,FL,NA,03/10/2021,2021-03-10,NA,Cutter Bay,NA,NA,2021-03-06,4,10,2021,3
282,3/6/2021 19:50:00,2,NA,NA,"Cutter Bay, FL",Florida,FL,NA,03/10/2021,2021-03-10,NA,Cutter Bay,NA,NA,2021-03-06,4,10,2021,3
283,3/6/2021 19:50:00,3,Spanish,NA,"Holliwood, FL",Florida,FL,NA,03/07/2021,2021-03-07,NA,Hollywood,NA,NA,2021-03-06,1,10,2021,3
283,3/6/2021 19:50:00,3,Spanish,NA,"Holliwood, FL",Florida,FL,NA,03/07/2021,2021-03-07,NA,Hollywood,NA,NA,2021-03-06,1,10,2021,3
283,3/6/2021 19:50:00,3,Spanish,NA,"Holliwood, FL",Florida,FL,NA,03/07/2021,2021-03-07,NA,Hollywood,NA,NA,2021-03-06,1,10,2021,3
284,3/6/2021 19:50:00,1,Spanish,NA,"Houston, TX",Texas,TX,NA,03/07/2021,2021-03-07,NA,Houston,NA,NA,2021-03-06,1,10,2021,3
285,3/6/2021 19:50:00,1,Spanish,NA,"Miami, FL",Florida,FL,NA,03/07/2021,2021-03-07,NA,Miami,NA,NA,2021-03-06,1,10,2021,3
286,3/6/2021 19:50:00,4,Romanian,NA,"Scottsbluff, NE",Nebraska,NE,NA,03/07/2021,2021-03-07,NA,Scottsbluff,Romania,NA,2021-03-06,1,10,2021,3
286,3/6/2021 19:50:00,4,Romanian,NA,"Scottsbluff, NE",Nebraska,NE,NA,03/07/2021,2021-03-07,NA,Scottsbluff,Romania,NA,2021-03-06,1,10,2021,3
286,3/6/2021 19:50:00,4,Romanian,NA,"Scottsbluff, NE",Nebraska,NE,NA,03/07/2021,2021-03-07,NA,Scottsbluff,Romania,NA,2021-03-06,1,10,2021,3
286,3/6/2021 19:50:00,4,Romanian,NA,"Scottsbluff, NE",Nebraska,NE,NA,03/07/2021,2021-03-07,NA,Scottsbluff,Romania,NA,2021-03-06,1,10,2021,3
287,3/6/2021 19:50:00,3,Spanish,NA,"Miami, FL",Florida,FL,NA,03/07/2021,2021-03-07,NA,Miami,Cuba,NA,2021-03-06,1,10,2021,3
287,3/6/2021 19:50:00,3,Spanish,NA,"Miami, FL",Florida,FL,NA,03/07/2021,2021-03-07,NA,Miami,Cuba,NA,2021-03-06,1,10,2021,3
287,3/6/2021 19:50:00,3,Spanish,NA,"Miami, FL",Florida,FL,NA,03/07/2021,2021-03-07,NA,Miami,Cuba,NA,2021-03-06,1,10,2021,3
288,3/6/2021 19:50:00,3,Romanian,NA,"Scottsbluff, NE",Nebraska,NE,NA,03/07/2021,2021-03-07,NA,Scottsbluff,Romania,NA,2021-03-06,1,10,2021,3
288,3/6/2021 19:50:00,3,Romanian,NA,"Scottsbluff, NE",Nebraska,NE,NA,03/07/2021,2021-03-07,NA,Scottsbluff,Romania,NA,2021-03-06,1,10,2021,3
288,3/6/2021 19:50:00,3,Romanian,NA,"Scottsbluff, NE",Nebraska,NE,NA,03/07/2021,2021-03-07,NA,Scottsbluff,Romania,NA,2021-03-06,1,10,2021,3
289,3/6/2021 19:50:00,3,Spanish,NA,NA,NA,NA,NA,03/07/2021,2021-03-07,NA,,Cuba,NA,2021-03-06,1,10,2021,3
289,3/6/2021 19:50:00,3,Spanish,NA,NA,NA,NA,NA,03/07/2021,2021-03-07,NA,,Cuba,NA,2021-03-06,1,10,2021,3
289,3/6/2021 19:50:00,3,Spanish,NA,NA,NA,NA,NA,03/07/2021,2021-03-07,NA,,Cuba,NA,2021-03-06,1,10,2021,3
290,3/6/2021 19:50:00,3,Spanish,NA,NA,NA,NA,NA,03/07/2021,2021-03-07,NA,,Cuba,Brazil,2021-03-06,1,10,2021,3
290,3/6/2021 19:50:00,3,Spanish,NA,NA,NA,NA,NA,03/07/2021,2021-03-07,NA,,Cuba,Brazil,2021-03-06,1,10,2021,3
290,3/6/2021 19:50:00,3,Spanish,NA,NA,NA,NA,NA,03/07/2021,2021-03-07,NA,,Cuba,Brazil,2021-03-06,1,10,2021,3
291,3/6/2021 19:50:00,3,Spanish,NA,NA,NA,NA,NA,03/08/2021,2021-03-08,NA,,Nicaragua,NA,2021-03-06,2,10,2021,3
291,3/6/2021 19:50:00,3,Spanish,NA,NA,NA,NA,NA,03/08/2021,2021-03-08,NA,,Nicaragua,NA,2021-03-06,2,10,2021,3
291,3/6/2021 19:50:00,3,Spanish,NA,NA,NA,NA,NA,03/08/2021,2021-03-08,NA,,Nicaragua,NA,2021-03-06,2,10,2021,3
292,3/6/2021 19:50:00,3,Spanish,NA,NA,NA,NA,NA,03/07/2021,2021-03-07,NA,,Nicaragua,NA,2021-03-06,1,10,2021,3
292,3/6/2021 19:50:00,3,Spanish,NA,NA,NA,NA,NA,03/07/2021,2021-03-07,NA,,Nicaragua,NA,2021-03-06,1,10,2021,3
292,3/6/2021 19:50:00,3,Spanish,NA,NA,NA,NA,NA,03/07/2021,2021-03-07,NA,,Nicaragua,NA,2021-03-06,1,10,2021,3
293,3/6/2021 19:50:00,4,Portuguese,NA,NA,NA,NA,NA,03/09/2021,2021-03-09,NA,,Brazil,NA,2021-03-06,3,10,2021,3
293,3/6/2021 19:50:00,4,Portuguese,NA,NA,NA,NA,NA,03/09/2021,2021-03-09,NA,,Brazil,NA,2021-03-06,3,10,2021,3
293,3/6/2021 19:50:00,4,Portuguese,NA,NA,NA,NA,NA,03/09/2021,2021-03-09,NA,,Brazil,NA,2021-03-06,3,10,2021,3
293,3/6/2021 19:50:00,4,Portuguese,NA,NA,NA,NA,NA,03/09/2021,2021-03-09,NA,,Brazil,NA,2021-03-06,3,10,2021,3
294,3/6/2021 19:50:00,2,Portuguese,NA,NA,NA,NA,NA,03/07/2021,2021-03-07,NA,,Brazil,NA,2021-03-06,1,10,2021,3
294,3/6/2021 19:50:00,2,Portuguese,NA,NA,NA,NA,NA,03/07/2021,2021-03-07,NA,,Brazil,NA,2021-03-06,1,10,2021,3
295,3/6/2021 19:50:00,2,Portuguese,NA,NA,NA,NA,NA,03/07/2021,2021-03-07,NA,,Brazil,NA,2021-03-06,1,10,2021,3
295,3/6/2021 19:50:00,2,Portuguese,NA,NA,NA,NA,NA,03/07/2021,2021-03-07,NA,,Brazil,NA,2021-03-06,1,10,2021,3
296,3/6/2021 19:50:00,1,NA,NA,NA,NA,NA,NA,03/07/2021,2021-03-07,NA,,India,NA,2021-03-06,1,10,2021,3
297,3/6/2021 19:50:00,1,Spanish,NA,NA,NA,NA,NA,03/07/2021,2021-03-07,NA,,Cuba,NA,2021-03-06,1,10,2021,3
298,3/6/2021 19:50:00,1,Spanish,NA,NA,NA,NA,NA,03/07/2021,2021-03-07,NA,,Venezuela,NA,2021-03-06,1,10,2021,3
299,3/6/2021 19:50:00,1,Spanish,NA,NA,NA,NA,NA,03/08/2021,2021-03-08,NA,,Cuba,NA,2021-03-06,2,10,2021,3
300,3/6/2021 19:50:00,1,Spanish,NA,Tennessee - TN,Tennessee,TN,NA,03/08/2021,2021-03-08,NA,,Cuba,NA,2021-03-06,2,10,2021,3
301,3/6/2021 19:50:00,1,Spanish,NA,"Miami, FL",Florida,FL,NA,03/18/2021,2021-03-18,NA,Miami,Cuba,NA,2021-03-06,12,10,2021,3
302,3/7/2021 14:16:25,2,Spanish,NA,Florida - FL,Florida,FL,NA,03/12/2021,2021-03-12,NA,,Venezuela,NA,2021-03-07,5,10,2021,3
302,3/7/2021 14:16:25,2,Spanish,NA,Florida - FL,Florida,FL,NA,03/12/2021,2021-03-12,NA,,Venezuela,NA,2021-03-07,5,10,2021,3
303,3/7/2021 14:32:39,2,Spanish,NA,Florida - FL,Florida,FL,NA,03/12/2021,2021-03-12,NA,,Venezuela,NA,2021-03-07,5,10,2021,3
303,3/7/2021 14:32:39,2,Spanish,NA,Florida - FL,Florida,FL,NA,03/12/2021,2021-03-12,NA,,Venezuela,NA,2021-03-07,5,10,2021,3
304,3/7/2021 14:53:10,3,Spanish,NA,Texas - TX,Texas,TX,NA,03/09/2021,2021-03-09,NA,,Cuba,NA,2021-03-07,2,10,2021,3
304,3/7/2021 14:53:10,3,Spanish,NA,Texas - TX,Texas,TX,NA,03/09/2021,2021-03-09,NA,,Cuba,NA,2021-03-07,2,10,2021,3
304,3/7/2021 14:53:10,3,Spanish,NA,Texas - TX,Texas,TX,NA,03/09/2021,2021-03-09,NA,,Cuba,NA,2021-03-07,2,10,2021,3
305,3/7/2021 16:48:59,3,Spanish,NA,Texas - TX,Texas,TX,NA,03/08/2021,2021-03-08,NA,,Cuba,NA,2021-03-07,1,10,2021,3
305,3/7/2021 16:48:59,3,Spanish,NA,Texas - TX,Texas,TX,NA,03/08/2021,2021-03-08,NA,,Cuba,NA,2021-03-07,1,10,2021,3
305,3/7/2021 16:48:59,3,Spanish,NA,Texas - TX,Texas,TX,NA,03/08/2021,2021-03-08,NA,,Cuba,NA,2021-03-07,1,10,2021,3
306,3/7/2021 17:24:52,1,Spanish,NA,California - CA,California,CA,NA,03/08/2021,2021-03-08,NA,,Cuba,NA,2021-03-07,1,10,2021,3
307,3/8/2021 14:29:32,2,Spanish,NA,"Florida, Texas",Florida,TX,NA,03/11/2021,2021-03-11,NA,,Venezuela,NA,2021-03-08,3,10,2021,3
307,3/8/2021 14:29:32,2,Spanish,NA,"Florida, Texas",Florida,TX,NA,03/11/2021,2021-03-11,NA,,Venezuela,NA,2021-03-08,3,10,2021,3
308,3/8/2021 14:34:50,5,Spanish,NA,Tennessee - TN,Tennessee,TN,NA,03/09/2021,2021-03-09,NA,,Venezuela,NA,2021-03-08,1,10,2021,3
308,3/8/2021 14:34:50,5,Spanish,NA,Tennessee - TN,Tennessee,TN,NA,03/09/2021,2021-03-09,NA,,Venezuela,NA,2021-03-08,1,10,2021,3
308,3/8/2021 14:34:50,5,Spanish,NA,Tennessee - TN,Tennessee,TN,NA,03/09/2021,2021-03-09,NA,,Venezuela,NA,2021-03-08,1,10,2021,3
308,3/8/2021 14:34:50,5,Spanish,NA,Tennessee - TN,Tennessee,TN,NA,03/09/2021,2021-03-09,NA,,Venezuela,NA,2021-03-08,1,10,2021,3
308,3/8/2021 14:34:50,5,Spanish,NA,Tennessee - TN,Tennessee,TN,NA,03/09/2021,2021-03-09,NA,,Venezuela,NA,2021-03-08,1,10,2021,3
309,3/8/2021 14:34:59,2,Spanish,NA,Texas - TX,Texas,TX,NA,03/09/2021,2021-03-09,NA,,Cuba,NA,2021-03-08,1,10,2021,3
309,3/8/2021 14:34:59,2,Spanish,NA,Texas - TX,Texas,TX,NA,03/09/2021,2021-03-09,NA,,Cuba,NA,2021-03-08,1,10,2021,3
310,3/8/2021 14:37:44,2,Spanish,NA,Texas - TX,Texas,TX,NA,03/09/2021,2021-03-09,NA,,Venezuela,NA,2021-03-08,1,10,2021,3
310,3/8/2021 14:37:44,2,Spanish,NA,Texas - TX,Texas,TX,NA,03/09/2021,2021-03-09,NA,,Venezuela,NA,2021-03-08,1,10,2021,3
311,3/8/2021 14:38:06,1,Spanish,NA,Florida - FL,Florida,FL,NA,03/08/2021,2021-03-08,NA,,Venezuela,NA,2021-03-08,0,10,2021,3
312,3/8/2021 14:42:33,1,Spanish,NA,Texas - TX,Texas,TX,NA,03/09/2021,2021-03-09,NA,,Venezuela,NA,2021-03-08,1,10,2021,3
313,3/8/2021 14:46:39,1,Spanish,NA,Texas - TX,Texas,TX,NA,03/09/2021,2021-03-09,NA,,Venezuela,NA,2021-03-08,1,10,2021,3
314,3/8/2021 14:47:32,1,Spanish,NA,South Carolina - SC,South Carolina,SC,NA,03/11/2021,2021-03-11,NA,,Nicaragua,NA,2021-03-08,3,10,2021,3
315,3/8/2021 14:47:58,6,Spanish,NA,Florida - FL,Florida,FL,NA,03/09/2021,2021-03-09,NA,,Venezuela, Cuba,2021-03-08,1,10,2021,3
315,3/8/2021 14:47:58,6,Spanish,NA,Florida - FL,Florida,FL,NA,03/09/2021,2021-03-09,NA,,Venezuela, Cuba,2021-03-08,1,10,2021,3
315,3/8/2021 14:47:58,6,Spanish,NA,Florida - FL,Florida,FL,NA,03/09/2021,2021-03-09,NA,,Venezuela, Cuba,2021-03-08,1,10,2021,3
315,3/8/2021 14:47:58,6,Spanish,NA,Florida - FL,Florida,FL,NA,03/09/2021,2021-03-09,NA,,Venezuela, Cuba,2021-03-08,1,10,2021,3
315,3/8/2021 14:47:58,6,Spanish,NA,Florida - FL,Florida,FL,NA,03/09/2021,2021-03-09,NA,,Venezuela, Cuba,2021-03-08,1,10,2021,3
315,3/8/2021 14:47:58,6,Spanish,NA,Florida - FL,Florida,FL,NA,03/09/2021,2021-03-09,NA,,Venezuela, Cuba,2021-03-08,1,10,2021,3
316,3/8/2021 14:47:58,1,Spanish,NA,Florida - FL,Florida,FL,NA,03/09/2021,2021-03-09,NA,,Cuba,NA,2021-03-08,1,10,2021,3
317,3/8/2021 14:55:54,1,Spanish,NA,Florida - FL,Florida,FL,NA,03/09/2021,2021-03-09,NA,,Cuba,NA,2021-03-08,1,10,2021,3
318,3/8/2021 15:01:01,1,Spanish,NA,Utah - UT,Utah,UT,NA,03/09/2021,2021-03-09,NA,,Venezuela,NA,2021-03-08,1,10,2021,3
319,3/8/2021 15:12:21,1,Spanish,NA,Florida - FL,Florida,FL,NA,03/10/2021,2021-03-10,NA,,Cuba,NA,2021-03-08,2,10,2021,3
320,3/8/2021 18:05:00,1,Spanish,NA,NA,NA,NA,NA,03/09/2021,2021-03-09,NA,,Cuba,NA,2021-03-08,1,10,2021,3
321,3/8/2021 18:05:00,2,Spanish,NA,Colorado - CO,Colorado,CO,NA,03/09/2021,2021-03-09,NA,,Cuba,NA,2021-03-08,1,10,2021,3
321,3/8/2021 18:05:00,2,Spanish,NA,Colorado - CO,Colorado,CO,NA,03/09/2021,2021-03-09,NA,,Cuba,NA,2021-03-08,1,10,2021,3
322,3/8/2021 18:05:00,1,Spanish,NA,Florida - FL,Florida,FL,NA,03/09/2021,2021-03-09,NA,,Cuba,NA,2021-03-08,1,10,2021,3
323,3/8/2021 18:05:00,1,Spanish,NA,Kentucky - KY,Kentucky,KY,NA,03/10/2021,2021-03-10,NA,,Cuba,NA,2021-03-08,2,10,2021,3
324,3/8/2021 18:05:00,1,Spanish,NA,Florida - FL,Florida,FL,NA,03/09/2021,2021-03-09,NA,,Cuba,NA,2021-03-08,1,10,2021,3
325,3/8/2021 18:05:00,1,Spanish,NA,NA,NA,NA,NA,03/09/2021,2021-03-09,NA,,Cuba,NA,2021-03-08,1,10,2021,3
326,3/8/2021 18:05:00,1,Spanish,NA,Florida - FL,Florida,FL,NA,03/09/2021,2021-03-09,NA,,Cuba,NA,2021-03-08,1,10,2021,3
327,3/8/2021 18:05:00,1,Spanish,NA,Florida - FL,Florida,FL,NA,03/09/2021,2021-03-09,NA,,Cuba,NA,2021-03-08,1,10,2021,3
328,3/8/2021 18:05:00,3,Punjabi,NA,California - CA,California,CA,NA,03/09/2021,2021-03-09,NA,,India,NA,2021-03-08,1,10,2021,3
328,3/8/2021 18:05:00,3,Punjabi,NA,California - CA,California,CA,NA,03/09/2021,2021-03-09,NA,,India,NA,2021-03-08,1,10,2021,3
328,3/8/2021 18:05:00,3,Punjabi,NA,California - CA,California,CA,NA,03/09/2021,2021-03-09,NA,,India,NA,2021-03-08,1,10,2021,3
329,3/8/2021 18:05:00,1,Spanish,NA,Florida - FL,Florida,FL,NA,03/09/2021,2021-03-09,NA,,Cuba,NA,2021-03-08,1,10,2021,3
330,3/8/2021 18:05:00,2,Spanish,NA,Texas - TX,Texas,TX,NA,03/09/2021,2021-03-09,NA,,Cuba,NA,2021-03-08,1,10,2021,3
330,3/8/2021 18:05:00,2,Spanish,NA,Texas - TX,Texas,TX,NA,03/09/2021,2021-03-09,NA,,Cuba,NA,2021-03-08,1,10,2021,3
331,3/8/2021 18:05:00,3,Portuguese,NA,NA,NA,NA,NA,03/09/2021,2021-03-09,NA,,Brazil,NA,2021-03-08,1,10,2021,3
331,3/8/2021 18:05:00,3,Portuguese,NA,NA,NA,NA,NA,03/09/2021,2021-03-09,NA,,Brazil,NA,2021-03-08,1,10,2021,3
331,3/8/2021 18:05:00,3,Portuguese,NA,NA,NA,NA,NA,03/09/2021,2021-03-09,NA,,Brazil,NA,2021-03-08,1,10,2021,3
332,3/8/2021 18:05:00,4,Spanish,NA,Florida - FL,Florida,FL,NA,03/09/2021,2021-03-09,NA,,Cuba,NA,2021-03-08,1,10,2021,3
332,3/8/2021 18:05:00,4,Spanish,NA,Florida - FL,Florida,FL,NA,03/09/2021,2021-03-09,NA,,Cuba,NA,2021-03-08,1,10,2021,3
332,3/8/2021 18:05:00,4,Spanish,NA,Florida - FL,Florida,FL,NA,03/09/2021,2021-03-09,NA,,Cuba,NA,2021-03-08,1,10,2021,3
332,3/8/2021 18:05:00,4,Spanish,NA,Florida - FL,Florida,FL,NA,03/09/2021,2021-03-09,NA,,Cuba,NA,2021-03-08,1,10,2021,3
333,3/8/2021 18:05:00,2,Spanish,NA,Nevada - NV,Nevada,NV,NA,03/09/2021,2021-03-09,NA,,Cuba,NA,2021-03-08,1,10,2021,3
333,3/8/2021 18:05:00,2,Spanish,NA,Nevada - NV,Nevada,NV,NA,03/09/2021,2021-03-09,NA,,Cuba,NA,2021-03-08,1,10,2021,3
334,3/8/2021 18:05:00,3,Spanish,NA,Florida - FL,Florida,FL,NA,03/09/2021,2021-03-09,NA,,Cuba,NA,2021-03-08,1,10,2021,3
334,3/8/2021 18:05:00,3,Spanish,NA,Florida - FL,Florida,FL,NA,03/09/2021,2021-03-09,NA,,Cuba,NA,2021-03-08,1,10,2021,3
334,3/8/2021 18:05:00,3,Spanish,NA,Florida - FL,Florida,FL,NA,03/09/2021,2021-03-09,NA,,Cuba,NA,2021-03-08,1,10,2021,3
335,3/8/2021 18:05:00,2,Spanish,NA,NA,NA,NA,NA,03/10/2021,2021-03-10,NA,,Cuba,NA,2021-03-08,2,10,2021,3
335,3/8/2021 18:05:00,2,Spanish,NA,NA,NA,NA,NA,03/10/2021,2021-03-10,NA,,Cuba,NA,2021-03-08,2,10,2021,3
336,3/8/2021 18:05:00,3,Spanish,NA,New York - NY,New York,NY,NA,03/09/2021,2021-03-09,NA,,Ecuador,NA,2021-03-08,1,10,2021,3
336,3/8/2021 18:05:00,3,Spanish,NA,New York - NY,New York,NY,NA,03/09/2021,2021-03-09,NA,,Ecuador,NA,2021-03-08,1,10,2021,3
336,3/8/2021 18:05:00,3,Spanish,NA,New York - NY,New York,NY,NA,03/09/2021,2021-03-09,NA,,Ecuador,NA,2021-03-08,1,10,2021,3
337,3/8/2021 18:05:00,3,Portuguese,NA,Florida - FL,Florida,FL,NA,03/09/2021,2021-03-09,NA,,Brazil,NA,2021-03-08,1,10,2021,3
337,3/8/2021 18:05:00,3,Portuguese,NA,Florida - FL,Florida,FL,NA,03/09/2021,2021-03-09,NA,,Brazil,NA,2021-03-08,1,10,2021,3
337,3/8/2021 18:05:00,3,Portuguese,NA,Florida - FL,Florida,FL,NA,03/09/2021,2021-03-09,NA,,Brazil,NA,2021-03-08,1,10,2021,3
338,3/8/2021 18:05:00,3,Portuguese,NA,NA,NA,NA,NA,03/09/2021,2021-03-09,NA,,Brazil,NA,2021-03-08,1,10,2021,3
338,3/8/2021 18:05:00,3,Portuguese,NA,NA,NA,NA,NA,03/09/2021,2021-03-09,NA,,Brazil,NA,2021-03-08,1,10,2021,3
338,3/8/2021 18:05:00,3,Portuguese,NA,NA,NA,NA,NA,03/09/2021,2021-03-09,NA,,Brazil,NA,2021-03-08,1,10,2021,3
339,3/8/2021 18:05:00,3,Spanish,NA,Vermont - VT,Vermont,VT,NA,03/10/2021,2021-03-10,NA,,Cuba,NA,2021-03-08,2,10,2021,3
339,3/8/2021 18:05:00,3,Spanish,NA,Vermont - VT,Vermont,VT,NA,03/10/2021,2021-03-10,NA,,Cuba,NA,2021-03-08,2,10,2021,3
339,3/8/2021 18:05:00,3,Spanish,NA,Vermont - VT,Vermont,VT,NA,03/10/2021,2021-03-10,NA,,Cuba,NA,2021-03-08,2,10,2021,3
340,3/8/2021 18:05:00,2,Spanish,NA,Texas - TX,Texas,TX,NA,03/09/2021,2021-03-09,NA,,Venezuela,NA,2021-03-08,1,10,2021,3
340,3/8/2021 18:05:00,2,Spanish,NA,Texas - TX,Texas,TX,NA,03/09/2021,2021-03-09,NA,,Venezuela,NA,2021-03-08,1,10,2021,3
341,3/8/2021 18:05:00,3,Spanish,NA,Florida - FL,Florida,FL,NA,03/09/2021,2021-03-09,NA,,Cuba,NA,2021-03-08,1,10,2021,3
341,3/8/2021 18:05:00,3,Spanish,NA,Florida - FL,Florida,FL,NA,03/09/2021,2021-03-09,NA,,Cuba,NA,2021-03-08,1,10,2021,3
341,3/8/2021 18:05:00,3,Spanish,NA,Florida - FL,Florida,FL,NA,03/09/2021,2021-03-09,NA,,Cuba,NA,2021-03-08,1,10,2021,3
342,3/8/2021 18:05:00,3,French,NA,Florida - FL,Florida,FL,NA,03/09/2021,2021-03-09,NA,,Haiti,NA,2021-03-08,1,10,2021,3
342,3/8/2021 18:05:00,3,French,NA,Florida - FL,Florida,FL,NA,03/09/2021,2021-03-09,NA,,Haiti,NA,2021-03-08,1,10,2021,3
342,3/8/2021 18:05:00,3,French,NA,Florida - FL,Florida,FL,NA,03/09/2021,2021-03-09,NA,,Haiti,NA,2021-03-08,1,10,2021,3
343,3/8/2021 18:05:00,3,Spanish,NA,Florida - FL,Florida,FL,NA,03/09/2021,2021-03-09,NA,,Cuba,Honduras,2021-03-08,1,10,2021,3
343,3/8/2021 18:05:00,3,Spanish,NA,Florida - FL,Florida,FL,NA,03/09/2021,2021-03-09,NA,,Cuba,Honduras,2021-03-08,1,10,2021,3
343,3/8/2021 18:05:00,3,Spanish,NA,Florida - FL,Florida,FL,NA,03/09/2021,2021-03-09,NA,,Cuba,Honduras,2021-03-08,1,10,2021,3
344,3/8/2021 18:05:00,1,Spanish,NA,Texas - TX,Texas,TX,NA,03/10/2021,2021-03-10,NA,,Cuba,NA,2021-03-08,2,10,2021,3
345,3/8/2021 18:05:00,3,NA,NA,Massachusetts - MA,Massachusetts,MA,NA,03/09/2021,2021-03-09,NA,,Guatemala,NA,2021-03-08,1,10,2021,3
345,3/8/2021 18:05:00,3,NA,NA,Massachusetts - MA,Massachusetts,MA,NA,03/09/2021,2021-03-09,NA,,Guatemala,NA,2021-03-08,1,10,2021,3
345,3/8/2021 18:05:00,3,NA,NA,Massachusetts - MA,Massachusetts,MA,NA,03/09/2021,2021-03-09,NA,,Guatemala,NA,2021-03-08,1,10,2021,3
346,3/8/2021 18:05:00,4,Romanian,NA,NA,NA,NA,NA,03/09/2021,2021-03-09,NA,,Romania,NA,2021-03-08,1,10,2021,3
346,3/8/2021 18:05:00,4,Romanian,NA,NA,NA,NA,NA,03/09/2021,2021-03-09,NA,,Romania,NA,2021-03-08,1,10,2021,3
346,3/8/2021 18:05:00,4,Romanian,NA,NA,NA,NA,NA,03/09/2021,2021-03-09,NA,,Romania,NA,2021-03-08,1,10,2021,3
346,3/8/2021 18:05:00,4,Romanian,NA,NA,NA,NA,NA,03/09/2021,2021-03-09,NA,,Romania,NA,2021-03-08,1,10,2021,3
347,3/9/2021 10:44:02,1,Spanish,NA,Oklahoma - OK,Oklahoma,OK,NA,03/09/2021,2021-03-09,NA,,Venezuela,NA,2021-03-09,0,10,2021,3
348,3/9/2021 10:45:46,3,Spanish,NA,New York - NY,New York,NY,NA,03/10/2021,2021-03-10,NA,,Ecuador,NA,2021-03-09,1,10,2021,3
348,3/9/2021 10:45:46,3,Spanish,NA,New York - NY,New York,NY,NA,03/10/2021,2021-03-10,NA,,Ecuador,NA,2021-03-09,1,10,2021,3
348,3/9/2021 10:45:46,3,Spanish,NA,New York - NY,New York,NY,NA,03/10/2021,2021-03-10,NA,,Ecuador,NA,2021-03-09,1,10,2021,3
349,3/9/2021 10:49:17,2,Spanish,NA,Georgia - GA,Georgia,GA,NA,03/10/2021,2021-03-10,NA,,Venezuela,NA,2021-03-09,1,10,2021,3
349,3/9/2021 10:49:17,2,Spanish,NA,Georgia - GA,Georgia,GA,NA,03/10/2021,2021-03-10,NA,,Venezuela,NA,2021-03-09,1,10,2021,3
350,3/9/2021 10:53:41,1,Spanish,NA,Virginia - VA,Virginia,VA,NA,03/10/2021,2021-03-10,NA,,Guatemala,NA,2021-03-09,1,10,2021,3
351,3/9/2021 10:56:51,1,Spanish,NA,Florida - FL,Florida,FL,NA,03/10/2021,2021-03-10,NA,,Cuba,NA,2021-03-09,1,10,2021,3
352,3/9/2021 10:58:56,4,Spanish,NA,Minnesota - MN,Minnesota,MN,NA,03/10/2021,2021-03-10,NA,,Ecuador,NA,2021-03-09,1,10,2021,3
352,3/9/2021 10:58:56,4,Spanish,NA,Minnesota - MN,Minnesota,MN,NA,03/10/2021,2021-03-10,NA,,Ecuador,NA,2021-03-09,1,10,2021,3
352,3/9/2021 10:58:56,4,Spanish,NA,Minnesota - MN,Minnesota,MN,NA,03/10/2021,2021-03-10,NA,,Ecuador,NA,2021-03-09,1,10,2021,3
352,3/9/2021 10:58:56,4,Spanish,NA,Minnesota - MN,Minnesota,MN,NA,03/10/2021,2021-03-10,NA,,Ecuador,NA,2021-03-09,1,10,2021,3
353,3/9/2021 11:04:20,2,Spanish,NA,Arizona - AZ,Arizona,AZ,NA,03/09/2021,2021-03-09,NA,,Cuba,NA,2021-03-09,0,10,2021,3
353,3/9/2021 11:04:20,2,Spanish,NA,Arizona - AZ,Arizona,AZ,NA,03/09/2021,2021-03-09,NA,,Cuba,NA,2021-03-09,0,10,2021,3
354,3/9/2021 16:35:31,3,Spanish,NA,Ohio - OH,Ohio,OH,NA,03/09/2021,2021-03-09,NA,,Venezuela,NA,2021-03-09,0,10,2021,3
354,3/9/2021 16:35:31,3,Spanish,NA,Ohio - OH,Ohio,OH,NA,03/09/2021,2021-03-09,NA,,Venezuela,NA,2021-03-09,0,10,2021,3
354,3/9/2021 16:35:31,3,Spanish,NA,Ohio - OH,Ohio,OH,NA,03/09/2021,2021-03-09,NA,,Venezuela,NA,2021-03-09,0,10,2021,3
355,3/10/2021 11:02:00,1,Spanish,NA,Kentucky - KY,Kentucky,KY,NA,03/10/2021,2021-03-10,NA,,Guatemala,NA,2021-03-10,0,10,2021,3
356,3/10/2021 11:12:15,4,Spanish,NA,Florida - FL,Florida,FL,NA,03/11/2021,2021-03-11,NA,,Cuba,NA,2021-03-10,1,10,2021,3
356,3/10/2021 11:12:15,4,Spanish,NA,Florida - FL,Florida,FL,NA,03/11/2021,2021-03-11,NA,,Cuba,NA,2021-03-10,1,10,2021,3
356,3/10/2021 11:12:15,4,Spanish,NA,Florida - FL,Florida,FL,NA,03/11/2021,2021-03-11,NA,,Cuba,NA,2021-03-10,1,10,2021,3
356,3/10/2021 11:12:15,4,Spanish,NA,Florida - FL,Florida,FL,NA,03/11/2021,2021-03-11,NA,,Cuba,NA,2021-03-10,1,10,2021,3
357,3/10/2021 11:12:59,2,Spanish,NA,Texas - TX,Texas,TX,NA,03/11/2021,2021-03-11,NA,,Venezuela,NA,2021-03-10,1,10,2021,3
357,3/10/2021 11:12:59,2,Spanish,NA,Texas - TX,Texas,TX,NA,03/11/2021,2021-03-11,NA,,Venezuela,NA,2021-03-10,1,10,2021,3
358,3/10/2021 11:14:20,3,Quichua,NA,New York - NY,New York,NY,NA,03/11/2021,2021-03-11,NA,,Ecuador,NA,2021-03-10,1,10,2021,3
358,3/10/2021 11:14:20,3,Quichua,NA,New York - NY,New York,NY,NA,03/11/2021,2021-03-11,NA,,Ecuador,NA,2021-03-10,1,10,2021,3
358,3/10/2021 11:14:20,3,Quichua,NA,New York - NY,New York,NY,NA,03/11/2021,2021-03-11,NA,,Ecuador,NA,2021-03-10,1,10,2021,3
359,3/10/2021 11:21:13,3,Spanish,NA,Florida - FL,Florida,FL,NA,03/11/2021,2021-03-11,NA,,Cuba,NA,2021-03-10,1,10,2021,3
359,3/10/2021 11:21:13,3,Spanish,NA,Florida - FL,Florida,FL,NA,03/11/2021,2021-03-11,NA,,Cuba,NA,2021-03-10,1,10,2021,3
359,3/10/2021 11:21:13,3,Spanish,NA,Florida - FL,Florida,FL,NA,03/11/2021,2021-03-11,NA,,Cuba,NA,2021-03-10,1,10,2021,3
360,3/10/2021 11:23:40,3,Quichua,NA,New York - NY,New York,NY,NA,03/13/2021,2021-03-13,NA,,Ecuador,NA,2021-03-10,3,10,2021,3
360,3/10/2021 11:23:40,3,Quichua,NA,New York - NY,New York,NY,NA,03/13/2021,2021-03-13,NA,,Ecuador,NA,2021-03-10,3,10,2021,3
360,3/10/2021 11:23:40,3,Quichua,NA,New York - NY,New York,NY,NA,03/13/2021,2021-03-13,NA,,Ecuador,NA,2021-03-10,3,10,2021,3
361,3/10/2021 11:25:41,3,Spanish,NA,Georgia - GA,Georgia,GA,NA,03/11/2021,2021-03-11,NA,,Venezuela,NA,2021-03-10,1,10,2021,3
361,3/10/2021 11:25:41,3,Spanish,NA,Georgia - GA,Georgia,GA,NA,03/11/2021,2021-03-11,NA,,Venezuela,NA,2021-03-10,1,10,2021,3
361,3/10/2021 11:25:41,3,Spanish,NA,Georgia - GA,Georgia,GA,NA,03/11/2021,2021-03-11,NA,,Venezuela,NA,2021-03-10,1,10,2021,3
362,3/10/2021 11:33:01,2,Spanish,NA,Texas - TX,Texas,TX,NA,03/11/2021,2021-03-11,NA,,Venezuela,NA,2021-03-10,1,10,2021,3
362,3/10/2021 11:33:01,2,Spanish,NA,Texas - TX,Texas,TX,NA,03/11/2021,2021-03-11,NA,,Venezuela,NA,2021-03-10,1,10,2021,3
363,3/10/2021 11:35:18,3,Spanish,NA,Florida - FL,Florida,FL,NA,03/11/2021,2021-03-11,NA,,Cuba,NA,2021-03-10,1,10,2021,3
363,3/10/2021 11:35:18,3,Spanish,NA,Florida - FL,Florida,FL,NA,03/11/2021,2021-03-11,NA,,Cuba,NA,2021-03-10,1,10,2021,3
363,3/10/2021 11:35:18,3,Spanish,NA,Florida - FL,Florida,FL,NA,03/11/2021,2021-03-11,NA,,Cuba,NA,2021-03-10,1,10,2021,3
364,3/10/2021 11:35:47,2,Mam,NA,North Carolina - NC,North Carolina,NC,NA,03/11/2021,2021-03-11,NA,,Guatemala,NA,2021-03-10,1,10,2021,3
364,3/10/2021 11:35:47,2,Mam,NA,North Carolina - NC,North Carolina,NC,NA,03/11/2021,2021-03-11,NA,,Guatemala,NA,2021-03-10,1,10,2021,3
365,3/10/2021 11:45:08,1,Spanish,NA,Florida - FL,Florida,FL,NA,03/11/2021,2021-03-11,NA,,Cuba,NA,2021-03-10,1,10,2021,3
366,3/10/2021 11:47:26,3,Spanish,NA,Florida - FL,Florida,FL,NA,03/11/2021,2021-03-11,NA,,Venezuela,NA,2021-03-10,1,10,2021,3
366,3/10/2021 11:47:26,3,Spanish,NA,Florida - FL,Florida,FL,NA,03/11/2021,2021-03-11,NA,,Venezuela,NA,2021-03-10,1,10,2021,3
366,3/10/2021 11:47:26,3,Spanish,NA,Florida - FL,Florida,FL,NA,03/11/2021,2021-03-11,NA,,Venezuela,NA,2021-03-10,1,10,2021,3
367,3/10/2021 12:02:19,3,Spanish,NA,Texas - TX,Texas,TX,NA,03/10/2021,2021-03-10,NA,,Venezuela,NA,2021-03-10,0,10,2021,3
367,3/10/2021 12:02:19,3,Spanish,NA,Texas - TX,Texas,TX,NA,03/10/2021,2021-03-10,NA,,Venezuela,NA,2021-03-10,0,10,2021,3
367,3/10/2021 12:02:19,3,Spanish,NA,Texas - TX,Texas,TX,NA,03/10/2021,2021-03-10,NA,,Venezuela,NA,2021-03-10,0,10,2021,3
368,3/10/2021 12:08:01,2,Spanish,NA,California - CA,California,CA,NA,03/11/2021,2021-03-11,NA,,Venezuela,NA,2021-03-10,1,10,2021,3
368,3/10/2021 12:08:01,2,Spanish,NA,California - CA,California,CA,NA,03/11/2021,2021-03-11,NA,,Venezuela,NA,2021-03-10,1,10,2021,3
369,3/10/2021 17:45:00,5,Spanish,NA,NA,NA,NA,NA,03/11/2021,2021-03-11,NA,,Cuba,NA,2021-03-10,1,10,2021,3
369,3/10/2021 17:45:00,5,Spanish,NA,NA,NA,NA,NA,03/11/2021,2021-03-11,NA,,Cuba,NA,2021-03-10,1,10,2021,3
369,3/10/2021 17:45:00,5,Spanish,NA,NA,NA,NA,NA,03/11/2021,2021-03-11,NA,,Cuba,NA,2021-03-10,1,10,2021,3
369,3/10/2021 17:45:00,5,Spanish,NA,NA,NA,NA,NA,03/11/2021,2021-03-11,NA,,Cuba,NA,2021-03-10,1,10,2021,3
369,3/10/2021 17:45:00,5,Spanish,NA,NA,NA,NA,NA,03/11/2021,2021-03-11,NA,,Cuba,NA,2021-03-10,1,10,2021,3
370,3/10/2021 17:45:00,1,Spanish,NA,NA,NA,NA,NA,03/11/2021,2021-03-11,NA,,Cuba,NA,2021-03-10,1,10,2021,3
371,3/10/2021 17:45:00,1,Spanish,NA,NA,NA,NA,NA,03/11/2021,2021-03-11,NA,,Cuba,NA,2021-03-10,1,10,2021,3
372,3/10/2021 17:45:00,1,Spanish,NA,NA,NA,NA,NA,03/11/2021,2021-03-11,NA,,Cuba,NA,2021-03-10,1,10,2021,3
373,3/10/2021 17:45:00,1,Spanish,NA,NA,NA,NA,NA,03/11/2021,2021-03-11,NA,,Cuba,NA,2021-03-10,1,10,2021,3
374,3/10/2021 17:45:00,1,Spanish,NA,NA,NA,NA,NA,03/11/2021,2021-03-11,NA,,Cuba,NA,2021-03-10,1,10,2021,3
375,3/10/2021 17:45:00,1,Spanish,NA,NA,NA,NA,NA,03/11/2021,2021-03-11,NA,,Cuba,NA,2021-03-10,1,10,2021,3
376,3/10/2021 17:45:00,1,Spanish,NA,NA,NA,NA,NA,03/11/2021,2021-03-11,NA,,Cuba,NA,2021-03-10,1,10,2021,3
377,3/10/2021 17:45:00,6,Quichua,NA,NA,NA,NA,NA,03/11/2021,2021-03-11,NA,,Ecuador,NA,2021-03-10,1,10,2021,3
377,3/10/2021 17:45:00,6,Quichua,NA,NA,NA,NA,NA,03/11/2021,2021-03-11,NA,,Ecuador,NA,2021-03-10,1,10,2021,3
377,3/10/2021 17:45:00,6,Quichua,NA,NA,NA,NA,NA,03/11/2021,2021-03-11,NA,,Ecuador,NA,2021-03-10,1,10,2021,3
377,3/10/2021 17:45:00,6,Quichua,NA,NA,NA,NA,NA,03/11/2021,2021-03-11,NA,,Ecuador,NA,2021-03-10,1,10,2021,3
377,3/10/2021 17:45:00,6,Quichua,NA,NA,NA,NA,NA,03/11/2021,2021-03-11,NA,,Ecuador,NA,2021-03-10,1,10,2021,3
377,3/10/2021 17:45:00,6,Quichua,NA,NA,NA,NA,NA,03/11/2021,2021-03-11,NA,,Ecuador,NA,2021-03-10,1,10,2021,3
378,3/10/2021 17:45:00,1,Spanish,NA,NA,NA,NA,NA,03/11/2021,2021-03-11,NA,,Cuba,NA,2021-03-10,1,10,2021,3
379,3/10/2021 17:45:00,1,Spanish,NA,NA,NA,NA,NA,03/13/2021,2021-03-13,NA,,Cuba,NA,2021-03-10,3,10,2021,3
380,3/10/2021 17:45:00,1,Spanish,NA,NA,NA,NA,NA,03/11/2021,2021-03-11,NA,,Cuba,NA,2021-03-10,1,10,2021,3
381,3/10/2021 17:45:00,1,Spanish,NA,NA,NA,NA,NA,03/11/2021,2021-03-11,NA,,Cuba,NA,2021-03-10,1,10,2021,3
382,3/10/2021 17:45:00,1,Spanish,NA,NA,NA,NA,NA,03/16/2021,2021-03-16,NA,,Cuba,NA,2021-03-10,6,10,2021,3
383,3/10/2021 17:45:00,1,Spanish,NA,NA,NA,NA,NA,03/11/2021,2021-03-11,NA,,Cuba,NA,2021-03-10,1,10,2021,3
384,3/10/2021 17:45:00,1,Spanish,NA,NA,NA,NA,NA,03/10/2021,2021-03-10,NA,,Cuba,NA,2021-03-10,0,10,2021,3
385,3/10/2021 17:45:00,1,Spanish,NA,NA,NA,NA,NA,03/11/2021,2021-03-11,NA,,Cuba,NA,2021-03-10,1,10,2021,3
386,3/10/2021 17:45:00,1,Spanish,NA,NA,NA,NA,NA,03/14/2021,2021-03-14,NA,,Nicaragua,NA,2021-03-10,4,10,2021,3
387,3/11/2021 9:09:58,1,Spanish,NA,Florida - FL,Florida,FL,NA,03/11/2021,2021-03-11,NA,,Cuba,NA,2021-03-11,0,10,2021,3
388,3/11/2021 14:38:44,3,Spanish,NA,Wisconsin - WI,Wisconsin,WI,NA,03/12/2021,2021-03-12,NA,,Venezuela, Colombia,2021-03-11,1,10,2021,3
388,3/11/2021 14:38:44,3,Spanish,NA,Wisconsin - WI,Wisconsin,WI,NA,03/12/2021,2021-03-12,NA,,Venezuela, Colombia,2021-03-11,1,10,2021,3
388,3/11/2021 14:38:44,3,Spanish,NA,Wisconsin - WI,Wisconsin,WI,NA,03/12/2021,2021-03-12,NA,,Venezuela, Colombia,2021-03-11,1,10,2021,3
389,3/11/2021 14:42:40,3,Spanish,NA,Oklahoma - OK,Oklahoma,OK,NA,03/12/2021,2021-03-12,NA,,Venezuela,NA,2021-03-11,1,10,2021,3
389,3/11/2021 14:42:40,3,Spanish,NA,Oklahoma - OK,Oklahoma,OK,NA,03/12/2021,2021-03-12,NA,,Venezuela,NA,2021-03-11,1,10,2021,3
389,3/11/2021 14:42:40,3,Spanish,NA,Oklahoma - OK,Oklahoma,OK,NA,03/12/2021,2021-03-12,NA,,Venezuela,NA,2021-03-11,1,10,2021,3
390,3/11/2021 14:47:47,3,Spanish,NA,Florida - FL,Florida,FL,NA,03/12/2021,2021-03-12,NA,,Venezuela,NA,2021-03-11,1,10,2021,3
390,3/11/2021 14:47:47,3,Spanish,NA,Florida - FL,Florida,FL,NA,03/12/2021,2021-03-12,NA,,Venezuela,NA,2021-03-11,1,10,2021,3
390,3/11/2021 14:47:47,3,Spanish,NA,Florida - FL,Florida,FL,NA,03/12/2021,2021-03-12,NA,,Venezuela,NA,2021-03-11,1,10,2021,3
391,3/11/2021 14:55:55,2,Spanish,NA,Texas - TX,Texas,TX,NA,03/12/2021,2021-03-12,NA,,Venezuela,NA,2021-03-11,1,10,2021,3
391,3/11/2021 14:55:55,2,Spanish,NA,Texas - TX,Texas,TX,NA,03/12/2021,2021-03-12,NA,,Venezuela,NA,2021-03-11,1,10,2021,3
392,3/11/2021 15:04:18,3,Spanish,NA,Florida - FL,Florida,FL,NA,03/12/2021,2021-03-12,NA,,Venezuela,NA,2021-03-11,1,10,2021,3
392,3/11/2021 15:04:18,3,Spanish,NA,Florida - FL,Florida,FL,NA,03/12/2021,2021-03-12,NA,,Venezuela,NA,2021-03-11,1,10,2021,3
392,3/11/2021 15:04:18,3,Spanish,NA,Florida - FL,Florida,FL,NA,03/12/2021,2021-03-12,NA,,Venezuela,NA,2021-03-11,1,10,2021,3
393,3/12/2021 9:59:08,4,Spanish,NA,Virginia - VA,Virginia,VA,NA,03/14/2021,2021-03-14,NA,,Mexico,NA,2021-03-12,2,11,2021,3
393,3/12/2021 9:59:08,4,Spanish,NA,Virginia - VA,Virginia,VA,NA,03/14/2021,2021-03-14,NA,,Mexico,NA,2021-03-12,2,11,2021,3
393,3/12/2021 9:59:08,4,Spanish,NA,Virginia - VA,Virginia,VA,NA,03/14/2021,2021-03-14,NA,,Mexico,NA,2021-03-12,2,11,2021,3
393,3/12/2021 9:59:08,4,Spanish,NA,Virginia - VA,Virginia,VA,NA,03/14/2021,2021-03-14,NA,,Mexico,NA,2021-03-12,2,11,2021,3
394,3/12/2021 10:00:17,4,Spanish,NA,Florida - FL,Florida,FL,NA,03/15/2021,2021-03-15,NA,,Venezuela,NA,2021-03-12,3,11,2021,3
394,3/12/2021 10:00:17,4,Spanish,NA,Florida - FL,Florida,FL,NA,03/15/2021,2021-03-15,NA,,Venezuela,NA,2021-03-12,3,11,2021,3
394,3/12/2021 10:00:17,4,Spanish,NA,Florida - FL,Florida,FL,NA,03/15/2021,2021-03-15,NA,,Venezuela,NA,2021-03-12,3,11,2021,3
394,3/12/2021 10:00:17,4,Spanish,NA,Florida - FL,Florida,FL,NA,03/15/2021,2021-03-15,NA,,Venezuela,NA,2021-03-12,3,11,2021,3
395,3/12/2021 10:07:24,2,Spanish,NA,California - CA,California,CA,NA,03/12/2021,2021-03-12,NA,,Venezuela,NA,2021-03-12,0,11,2021,3
395,3/12/2021 10:07:24,2,Spanish,NA,California - CA,California,CA,NA,03/12/2021,2021-03-12,NA,,Venezuela,NA,2021-03-12,0,11,2021,3
396,3/12/2021 10:08:37,2,Spanish,NA,Florida - FL,Florida,FL,NA,03/13/2021,2021-03-13,NA,,Cuba,NA,2021-03-12,1,11,2021,3
396,3/12/2021 10:08:37,2,Spanish,NA,Florida - FL,Florida,FL,NA,03/13/2021,2021-03-13,NA,,Cuba,NA,2021-03-12,1,11,2021,3
397,3/12/2021 12:33:39,3,Spanish,NA,Texas - TX,Texas,TX,NA,03/12/2021,2021-03-12,NA,,Venezuela,NA,2021-03-12,0,11,2021,3
397,3/12/2021 12:33:39,3,Spanish,NA,Texas - TX,Texas,TX,NA,03/12/2021,2021-03-12,NA,,Venezuela,NA,2021-03-12,0,11,2021,3
397,3/12/2021 12:33:39,3,Spanish,NA,Texas - TX,Texas,TX,NA,03/12/2021,2021-03-12,NA,,Venezuela,NA,2021-03-12,0,11,2021,3
398,3/12/2021 12:40:42,1,Spanish,NA,Tennessee - TN,Tennessee,TN,NA,03/13/2021,2021-03-13,NA,,Venezuela,NA,2021-03-12,1,11,2021,3
399,3/12/2021 12:56:06,1,Spanish,NA,Kentucky - KY,Kentucky,KY,NA,03/13/2021,2021-03-13,NA,,Venezuela,NA,2021-03-12,1,11,2021,3
400,3/12/2021 13:01:45,1,Spanish,NA,Virginia - VA,Virginia,VA,NA,03/12/2021,2021-03-12,NA,,Venezuela,NA,2021-03-12,0,11,2021,3
401,3/12/2021 13:07:06,1,Spanish,NA,Georgia - GA,Georgia,GA,NA,03/13/2021,2021-03-13,NA,,Venezuela,NA,2021-03-12,1,11,2021,3
402,3/12/2021 13:14:57,1,Spanish,NA,Texas - TX,Texas,TX,NA,03/13/2021,2021-03-13,NA,,Venezuela,NA,2021-03-12,1,11,2021,3
403,3/12/2021 13:18:24,2,Spanish,NA,Texas - TX,Texas,TX,NA,03/12/2021,2021-03-12,NA,,Cuba,NA,2021-03-12,0,11,2021,3
403,3/12/2021 13:18:24,2,Spanish,NA,Texas - TX,Texas,TX,NA,03/12/2021,2021-03-12,NA,,Cuba,NA,2021-03-12,0,11,2021,3
404,3/12/2021 14:36:00,3,Portuguese,NA,Massachusetts - MA,Massachusetts,MA,NA,03/13/2021,2021-03-13,NA,,Brazil,NA,2021-03-12,1,11,2021,3
404,3/12/2021 14:36:00,3,Portuguese,NA,Massachusetts - MA,Massachusetts,MA,NA,03/13/2021,2021-03-13,NA,,Brazil,NA,2021-03-12,1,11,2021,3
404,3/12/2021 14:36:00,3,Portuguese,NA,Massachusetts - MA,Massachusetts,MA,NA,03/13/2021,2021-03-13,NA,,Brazil,NA,2021-03-12,1,11,2021,3
405,3/12/2021 14:36:00,4,Portuguese,NA,Pennsylvania - PA,Pennsylvania,PA,NA,03/13/2021,2021-03-13,NA,,Brazil,NA,2021-03-12,1,11,2021,3
405,3/12/2021 14:36:00,4,Portuguese,NA,Pennsylvania - PA,Pennsylvania,PA,NA,03/13/2021,2021-03-13,NA,,Brazil,NA,2021-03-12,1,11,2021,3
405,3/12/2021 14:36:00,4,Portuguese,NA,Pennsylvania - PA,Pennsylvania,PA,NA,03/13/2021,2021-03-13,NA,,Brazil,NA,2021-03-12,1,11,2021,3
405,3/12/2021 14:36:00,4,Portuguese,NA,Pennsylvania - PA,Pennsylvania,PA,NA,03/13/2021,2021-03-13,NA,,Brazil,NA,2021-03-12,1,11,2021,3
406,3/12/2021 14:36:00,3,Spanish,NA,Texas - TX,Texas,TX,NA,03/13/2021,2021-03-13,NA,,Cuba,NA,2021-03-12,1,11,2021,3
406,3/12/2021 14:36:00,3,Spanish,NA,Texas - TX,Texas,TX,NA,03/13/2021,2021-03-13,NA,,Cuba,NA,2021-03-12,1,11,2021,3
406,3/12/2021 14:36:00,3,Spanish,NA,Texas - TX,Texas,TX,NA,03/13/2021,2021-03-13,NA,,Cuba,NA,2021-03-12,1,11,2021,3
407,3/12/2021 14:36:00,1,Spanish,NA,Florida - FL,Florida,FL,NA,03/13/2021,2021-03-13,NA,,Cuba,NA,2021-03-12,1,11,2021,3
408,3/12/2021 14:36:00,5,Romanian,NA,Nebraska - NE,Nebraska,NE,NA,03/13/2021,2021-03-13,NA,,Romania,NA,2021-03-12,1,11,2021,3
408,3/12/2021 14:36:00,5,Romanian,NA,Nebraska - NE,Nebraska,NE,NA,03/13/2021,2021-03-13,NA,,Romania,NA,2021-03-12,1,11,2021,3
408,3/12/2021 14:36:00,5,Romanian,NA,Nebraska - NE,Nebraska,NE,NA,03/13/2021,2021-03-13,NA,,Romania,NA,2021-03-12,1,11,2021,3
408,3/12/2021 14:36:00,5,Romanian,NA,Nebraska - NE,Nebraska,NE,NA,03/13/2021,2021-03-13,NA,,Romania,NA,2021-03-12,1,11,2021,3
408,3/12/2021 14:36:00,5,Romanian,NA,Nebraska - NE,Nebraska,NE,NA,03/13/2021,2021-03-13,NA,,Romania,NA,2021-03-12,1,11,2021,3
409,3/12/2021 14:36:00,1,Spanish,NA,Florida - FL,Florida,FL,NA,03/13/2021,2021-03-13,NA,,Cuba,NA,2021-03-12,1,11,2021,3
410,3/12/2021 14:36:00,1,Spanish,NA,Florida - FL,Florida,FL,NA,03/13/2021,2021-03-13,NA,,Cuba,NA,2021-03-12,1,11,2021,3
411,3/12/2021 14:36:00,1,Spanish,NA,Florida - FL,Florida,FL,NA,03/13/2021,2021-03-13,NA,,Cuba,NA,2021-03-12,1,11,2021,3
412,3/12/2021 14:36:00,1,Spanish,NA,Florida - FL,Florida,FL,NA,03/13/2021,2021-03-13,NA,,Cuba,NA,2021-03-12,1,11,2021,3
413,3/12/2021 14:36:00,1,Spanish,NA,Texas - TX,Texas,TX,NA,03/16/2021,2021-03-16,NA,,Cuba,NA,2021-03-12,4,11,2021,3
414,3/12/2021 14:36:00,2,Spanish,NA,Kentucky - KY,Kentucky,KY,NA,03/13/2021,2021-03-13,NA,,Cuba,NA,2021-03-12,1,11,2021,3
414,3/12/2021 14:36:00,2,Spanish,NA,Kentucky - KY,Kentucky,KY,NA,03/13/2021,2021-03-13,NA,,Cuba,NA,2021-03-12,1,11,2021,3
415,3/12/2021 14:36:00,4,Spanish,NA,Florida - FL,Florida,FL,NA,03/15/2021,2021-03-15,NA,,Cuba,NA,2021-03-12,3,11,2021,3
415,3/12/2021 14:36:00,4,Spanish,NA,Florida - FL,Florida,FL,NA,03/15/2021,2021-03-15,NA,,Cuba,NA,2021-03-12,3,11,2021,3
415,3/12/2021 14:36:00,4,Spanish,NA,Florida - FL,Florida,FL,NA,03/15/2021,2021-03-15,NA,,Cuba,NA,2021-03-12,3,11,2021,3
