,arrival_datetime,number_in_party,language,destination,method_of_travel,day_m_d_yy,company,country_of_origin,destination_city,arrival_date
0,1/26/2021 13:04:33,1,Spanish,Arizona - AZ,,01/26/2021,Alaska,Mexico,,2021-01-26
1,1/26/2021 13:37:56,1,Spanish,Arizona - AZ,,01/26/2021,,Mexico,,2021-01-26
2,1/29/2021 8:28:52,1,Spanish,Utah - UT,,01/30/2021,,Venezuela,,2021-01-29
3,1/29/2021 13:59:06,1,Mixteco,California - CA,,01/29/2021,,Mexico,,2021-01-29
4,2/1/2021 12:26:16,1,Spanish,Arizona - AZ,,02/02/2021,,Cuba,,2021-02-01
5,2/1/2021 16:08:53,1,Spanish,Maryland - MD,,02/06/2021,,Guatemala,,2021-02-01
6,2/2/2021 12:58:05,4,Spanish,Texas - TX,,02/03/2021,,Venezuela,,2021-02-02
6,2/2/2021 12:58:05,4,Spanish,Texas - TX,,02/03/2021,,Venezuela,,2021-02-02
6,2/2/2021 12:58:05,4,Spanish,Texas - TX,,02/03/2021,,Venezuela,,2021-02-02
6,2/2/2021 12:58:05,4,Spanish,Texas - TX,,02/03/2021,,Venezuela,,2021-02-02
7,2/2/2021 13:03:02,1,Spanish,Florida - FL,,02/03/2021,,Cuba,,2021-02-02
8,2/2/2021 13:08:42,1,Spanish,Tennessee - TN,,02/03/2021,,Venezuela,,2021-02-02
9,2/2/2021 13:16:09,1,Spanish,New Jersey - NJ,,02/03/2021,,Ecuador,,2021-02-02
10,2/2/2021 13:26:40,3,Spanish,Florida - FL,,02/03/2021,,Cuba,,2021-02-02
10,2/2/2021 13:26:40,3,Spanish,Florida - FL,,02/03/2021,,Cuba,,2021-02-02
10,2/2/2021 13:26:40,3,Spanish,Florida - FL,,02/03/2021,,Cuba,,2021-02-02
11,2/2/2021 13:43:00,3,Spanish,Texas - TX,,02/03/2021,,Venezuela,,2021-02-02
11,2/2/2021 13:43:00,3,Spanish,Texas - TX,,02/03/2021,,Venezuela,,2021-02-02
11,2/2/2021 13:43:00,3,Spanish,Texas - TX,,02/03/2021,,Venezuela,,2021-02-02
12,2/3/2021 13:38:51,3,Spanish,Tennessee - TN,,02/04/2021,,Venezuela,,2021-02-03
12,2/3/2021 13:38:51,3,Spanish,Tennessee - TN,,02/04/2021,,Venezuela,,2021-02-03
12,2/3/2021 13:38:51,3,Spanish,Tennessee - TN,,02/04/2021,,Venezuela,,2021-02-03
13,2/3/2021 13:51:21,3,Spanish,Florida - FL,,02/05/2021,,Venezuela,,2021-02-03
13,2/3/2021 13:51:21,3,Spanish,Florida - FL,,02/05/2021,,Venezuela,,2021-02-03
13,2/3/2021 13:51:21,3,Spanish,Florida - FL,,02/05/2021,,Venezuela,,2021-02-03
14,2/3/2021 13:58:21,2,Spanish,New York - NY,,02/04/2021,,Ecuador,,2021-02-03
14,2/3/2021 13:58:21,2,Spanish,New York - NY,,02/04/2021,,Ecuador,,2021-02-03
15,2/3/2021 14:07:27,4,Spanish,Florida - FL,,02/04/2021,,Venezuela,,2021-02-03
15,2/3/2021 14:07:27,4,Spanish,Florida - FL,,02/04/2021,,Venezuela,,2021-02-03
15,2/3/2021 14:07:27,4,Spanish,Florida - FL,,02/04/2021,,Venezuela,,2021-02-03
15,2/3/2021 14:07:27,4,Spanish,Florida - FL,,02/04/2021,,Venezuela,,2021-02-03
16,2/3/2021 14:08:17,2,Spanish,California - CA,,02/04/2021,,Guatemala,,2021-02-03
16,2/3/2021 14:08:17,2,Spanish,California - CA,,02/04/2021,,Guatemala,,2021-02-03
17,2/3/2021 14:26:29,1,Spanish,Texas - TX,,02/03/2021,,Cuba,,2021-02-03
18,2/5/2021 9:07:33,3,Spanish,Texas - TX,,02/05/2021,,Venezuela,,2021-02-05
18,2/5/2021 9:07:33,3,Spanish,Texas - TX,,02/05/2021,,Venezuela,,2021-02-05
18,2/5/2021 9:07:33,3,Spanish,Texas - TX,,02/05/2021,,Venezuela,,2021-02-05
19,2/5/2021 9:19:48,1,Spanish,Florida - FL,,02/05/2021,,Cuba,,2021-02-05
20,2/5/2021 15:59:03,5,Spanish,Idaho - ID,,02/06/2021,,Venezuela,,2021-02-05
20,2/5/2021 15:59:03,5,Spanish,Idaho - ID,,02/06/2021,,Venezuela,,2021-02-05
20,2/5/2021 15:59:03,5,Spanish,Idaho - ID,,02/06/2021,,Venezuela,,2021-02-05
20,2/5/2021 15:59:03,5,Spanish,Idaho - ID,,02/06/2021,,Venezuela,,2021-02-05
20,2/5/2021 15:59:03,5,Spanish,Idaho - ID,,02/06/2021,,Venezuela,,2021-02-05
21,2/5/2021 16:10:24,5,Spanish,Colorado - CO,,02/06/2021,,Venezuela,,2021-02-05
21,2/5/2021 16:10:24,5,Spanish,Colorado - CO,,02/06/2021,,Venezuela,,2021-02-05
21,2/5/2021 16:10:24,5,Spanish,Colorado - CO,,02/06/2021,,Venezuela,,2021-02-05
21,2/5/2021 16:10:24,5,Spanish,Colorado - CO,,02/06/2021,,Venezuela,,2021-02-05
21,2/5/2021 16:10:24,5,Spanish,Colorado - CO,,02/06/2021,,Venezuela,,2021-02-05
22,2/6/2021 11:33:36,4,Spanish,Texas - TX,,02/07/2021,,Venezuela,,2021-02-06
22,2/6/2021 11:33:36,4,Spanish,Texas - TX,,02/07/2021,,Venezuela,,2021-02-06
22,2/6/2021 11:33:36,4,Spanish,Texas - TX,,02/07/2021,,Venezuela,,2021-02-06
22,2/6/2021 11:33:36,4,Spanish,Texas - TX,,02/07/2021,,Venezuela,,2021-02-06
23,2/6/2021 11:45:23,3,Spanish,Texas - TX,,02/07/2021,,Venezuela,,2021-02-06
23,2/6/2021 11:45:23,3,Spanish,Texas - TX,,02/07/2021,,Venezuela,,2021-02-06
23,2/6/2021 11:45:23,3,Spanish,Texas - TX,,02/07/2021,,Venezuela,,2021-02-06
24,2/6/2021 12:04:24,2,Spanish,Colorado - CO,,02/07/2021,,Venezuela,,2021-02-06
24,2/6/2021 12:04:24,2,Spanish,Colorado - CO,,02/07/2021,,Venezuela,,2021-02-06
25,2/6/2021 12:24:31,1,Spanish,Florida - FL,,02/07/2021,,Guatemala,,2021-02-06
26,2/6/2021 12:37:20,2,Spanish,Texas - TX,,02/07/2021,,Venezuela,,2021-02-06
26,2/6/2021 12:37:20,2,Spanish,Texas - TX,,02/07/2021,,Venezuela,,2021-02-06
27,2/7/2021 14:21:29,1,Spanish,New York - NY,,02/08/2021,,Ecuador,,2021-02-07
28,2/7/2021 14:30:32,1,Spanish,Arizona - AZ,,02/07/2021,,Mexico,,2021-02-07
29,2/7/2021 14:39:46,2,Spanish,California - CA,,02/08/2021,,Mexico,,2021-02-07
29,2/7/2021 14:39:46,2,Spanish,California - CA,,02/08/2021,,Mexico,,2021-02-07
30,2/7/2021 14:50:22,3,Spanish,Nebraska - NE,,02/08/2021,,El Salvador,,2021-02-07
30,2/7/2021 14:50:22,3,Spanish,Nebraska - NE,,02/08/2021,,El Salvador,,2021-02-07
30,2/7/2021 14:50:22,3,Spanish,Nebraska - NE,,02/08/2021,,El Salvador,,2021-02-07
31,2/9/2021 9:56:32,1,Spanish,New Jersey - NJ,,03/13/2021,,Ecuador,,2021-02-09
32,2/9/2021 11:42:15,1,Spanish,Florida - FL,,02/10/2021,,Cuba,,2021-02-09
33,2/9/2021 11:49:45,3,Spanish,Arizona - AZ,,02/09/2021,,Venezuela,,2021-02-09
33,2/9/2021 11:49:45,3,Spanish,Arizona - AZ,,02/09/2021,,Venezuela,,2021-02-09
33,2/9/2021 11:49:45,3,Spanish,Arizona - AZ,,02/09/2021,,Venezuela,,2021-02-09
34,2/9/2021 11:49:51,1,Spanish,Florida - FL,,02/09/2021,,Cuba,,2021-02-09
35,2/9/2021 12:05:59,2,Spanish,Arizona - AZ,,02/09/2021,,Venezuela,,2021-02-09
35,2/9/2021 12:05:59,2,Spanish,Arizona - AZ,,02/09/2021,,Venezuela,,2021-02-09
36,2/9/2021 16:11:23,2,Spanish,Texas - TX,,02/10/2021,,Venezuela,,2021-02-09
36,2/9/2021 16:11:23,2,Spanish,Texas - TX,,02/10/2021,,Venezuela,,2021-02-09
37,2/10/2021 11:08:54,1,Spanish,New Jersey - NJ,,02/13/2021,,Guatemala,,2021-02-10
38,2/10/2021 11:18:56,4,Spanish,Florida - FL,,02/11/2021,,Cuba,,2021-02-10
38,2/10/2021 11:18:56,4,Spanish,Florida - FL,,02/11/2021,,Cuba,,2021-02-10
38,2/10/2021 11:18:56,4,Spanish,Florida - FL,,02/11/2021,,Cuba,,2021-02-10
38,2/10/2021 11:18:56,4,Spanish,Florida - FL,,02/11/2021,,Cuba,,2021-02-10
39,2/10/2021 11:24:18,2,Spanish,Utah - UT,,02/13/2021,,Venezuela,,2021-02-10
39,2/10/2021 11:24:18,2,Spanish,Utah - UT,,02/13/2021,,Venezuela,,2021-02-10
40,2/10/2021 13:53:39,3,Kichwa,Massachusetts - MA,,02/10/2021,,Ecuador,,2021-02-10
40,2/10/2021 13:53:39,3,Kichwa,Massachusetts - MA,,02/10/2021,,Ecuador,,2021-02-10
40,2/10/2021 13:53:39,3,Kichwa,Massachusetts - MA,,02/10/2021,,Ecuador,,2021-02-10
41,2/10/2021 13:54:50,1,Spanish,New Jersey - NJ,,02/11/2021,,Ecuador,,2021-02-10
42,2/11/2021 10:23:40,3,Spanish,Texas - TX,,02/11/2021,,Venezuela,,2021-02-11
42,2/11/2021 10:23:40,3,Spanish,Texas - TX,,02/11/2021,,Venezuela,,2021-02-11
42,2/11/2021 10:23:40,3,Spanish,Texas - TX,,02/11/2021,,Venezuela,,2021-02-11
43,2/11/2021 10:26:49,3,Spanish,Washington - WA,,02/11/2021,,Venezuela,,2021-02-11
43,2/11/2021 10:26:49,3,Spanish,Washington - WA,,02/11/2021,,Venezuela,,2021-02-11
43,2/11/2021 10:26:49,3,Spanish,Washington - WA,,02/11/2021,,Venezuela,,2021-02-11
44,2/11/2021 10:31:46,3,Spanish,Arizona - AZ,,02/11/2021,,Cuba,,2021-02-11
44,2/11/2021 10:31:46,3,Spanish,Arizona - AZ,,02/11/2021,,Cuba,,2021-02-11
44,2/11/2021 10:31:46,3,Spanish,Arizona - AZ,,02/11/2021,,Cuba,,2021-02-11
45,2/11/2021 17:37:48,1,Spanish,Mexico,,02/13/2021,,Mexico,,2021-02-11
46,2/12/2021 11:35:27,1,Spanish,New York - NY,,02/13/2021,,Ecuador,,2021-02-12
47,2/12/2021 11:39:01,1,Spanish,Florida - FL,,02/13/2021,,Venezuela,,2021-02-12
48,2/12/2021 15:54:53,1,Spanish,Florida - FL,,02/19/2021,,Mexico,,2021-02-12
49,2/13/2021 9:30:55,2,Spanish,Florida - FL,,02/14/2021,,Venezuela,,2021-02-13
49,2/13/2021 9:30:55,2,Spanish,Florida - FL,,02/14/2021,,Venezuela,,2021-02-13
50,2/13/2021 9:39:43,2,Spanish,Florida - FL,,02/13/2021,,Venezuela,,2021-02-13
50,2/13/2021 9:39:43,2,Spanish,Florida - FL,,02/13/2021,,Venezuela,,2021-02-13
51,2/13/2021 12:15:59,2,Spanish,Florida - FL,,02/16/2021,,Venezuela,,2021-02-13
51,2/13/2021 12:15:59,2,Spanish,Florida - FL,,02/16/2021,,Venezuela,,2021-02-13
52,2/13/2021 12:23:10,1,Spanish,New York - NY,,02/14/2021,,Ecuador,,2021-02-13
53,2/14/2021 10:46:50,2,Spanish,North Carolina - NC,,02/19/2021,,Nicaragua,,2021-02-14
53,2/14/2021 10:46:50,2,Spanish,North Carolina - NC,,02/19/2021,,Nicaragua,,2021-02-14
54,2/14/2021 11:17:29,1,Spanish,,,02/16/2021,,Honduras,,2021-02-14
55,2/15/2021 10:47:27,2,Spanish,Virginia - VA,,02/16/2021,,Venezuela,,2021-02-15
55,2/15/2021 10:47:27,2,Spanish,Virginia - VA,,02/16/2021,,Venezuela,,2021-02-15
56,2/15/2021 10:56:35,3,Spanish,Tennessee - TN,,02/16/2021,,Venezuela,,2021-02-15
56,2/15/2021 10:56:35,3,Spanish,Tennessee - TN,,02/16/2021,,Venezuela,,2021-02-15
56,2/15/2021 10:56:35,3,Spanish,Tennessee - TN,,02/16/2021,,Venezuela,,2021-02-15
57,2/15/2021 11:05:00,3,Spanish,Connecticut - CT,,02/16/2021,,Ecuador,,2021-02-15
57,2/15/2021 11:05:00,3,Spanish,Connecticut - CT,,02/16/2021,,Ecuador,,2021-02-15
57,2/15/2021 11:05:00,3,Spanish,Connecticut - CT,,02/16/2021,,Ecuador,,2021-02-15
58,2/15/2021 11:22:21,4,Spanish,California - CA,,02/15/2021,,Venezuela,,2021-02-15
58,2/15/2021 11:22:21,4,Spanish,California - CA,,02/15/2021,,Venezuela,,2021-02-15
58,2/15/2021 11:22:21,4,Spanish,California - CA,,02/15/2021,,Venezuela,,2021-02-15
58,2/15/2021 11:22:21,4,Spanish,California - CA,,02/15/2021,,Venezuela,,2021-02-15
59,2/15/2021 14:59:34,1,Spanish,Florida - FL,,02/17/2021,,Cuba,,2021-02-15
60,2/15/2021 15:10:49,3,Spanish,Florida - FL,,02/16/2021,,Cuba,,2021-02-15
60,2/15/2021 15:10:49,3,Spanish,Florida - FL,,02/16/2021,,Cuba,,2021-02-15
60,2/15/2021 15:10:49,3,Spanish,Florida - FL,,02/16/2021,,Cuba,,2021-02-15
61,2/16/2021 9:22:03,3,Spanish,Texas - TX,,02/17/2021,,Venezuela,,2021-02-16
61,2/16/2021 9:22:03,3,Spanish,Texas - TX,,02/17/2021,,Venezuela,,2021-02-16
61,2/16/2021 9:22:03,3,Spanish,Texas - TX,,02/17/2021,,Venezuela,,2021-02-16
62,2/16/2021 14:59:14,2,Spanish,Massachusetts - MA,,02/19/2021,,Ecuador,,2021-02-16
62,2/16/2021 14:59:14,2,Spanish,Massachusetts - MA,,02/19/2021,,Ecuador,,2021-02-16
63,2/16/2021 15:18:55,3,Kichwa,New York - NY,,02/19/2021,,Ecuador,,2021-02-16
63,2/16/2021 15:18:55,3,Kichwa,New York - NY,,02/19/2021,,Ecuador,,2021-02-16
63,2/16/2021 15:18:55,3,Kichwa,New York - NY,,02/19/2021,,Ecuador,,2021-02-16
64,2/16/2021 16:36:25,4,Spanish,Florida - FL,,02/16/2021,,Nicaragua,,2021-02-16
64,2/16/2021 16:36:25,4,Spanish,Florida - FL,,02/16/2021,,Nicaragua,,2021-02-16
64,2/16/2021 16:36:25,4,Spanish,Florida - FL,,02/16/2021,,Nicaragua,,2021-02-16
64,2/16/2021 16:36:25,4,Spanish,Florida - FL,,02/16/2021,,Nicaragua,,2021-02-16
65,2/16/2021 16:39:00,3,Spanish,Florida - FL,,02/16/2021,,Cuba,,2021-02-16
65,2/16/2021 16:39:00,3,Spanish,Florida - FL,,02/16/2021,,Cuba,,2021-02-16
65,2/16/2021 16:39:00,3,Spanish,Florida - FL,,02/16/2021,,Cuba,,2021-02-16
66,2/16/2021 16:51:08,2,Romanian,California - CA,,02/16/2021,,Romania,,2021-02-16
66,2/16/2021 16:51:08,2,Romanian,California - CA,,02/16/2021,,Romania,,2021-02-16
67,2/16/2021 17:07:14,3,Spanish,Florida - FL,,02/16/2021,,Cuba,,2021-02-16
67,2/16/2021 17:07:14,3,Spanish,Florida - FL,,02/16/2021,,Cuba,,2021-02-16
67,2/16/2021 17:07:14,3,Spanish,Florida - FL,,02/16/2021,,Cuba,,2021-02-16
68,2/16/2021 19:39:41,1,Spanish,North Carolina - NC,,02/24/2021,,Guatemala,,2021-02-16
69,2/17/2021 11:10:52,3,Spanish,Maryland - MD,,02/28/2021,,El Salvador,,2021-02-17
69,2/17/2021 11:10:52,3,Spanish,Maryland - MD,,02/28/2021,,El Salvador,,2021-02-17
69,2/17/2021 11:10:52,3,Spanish,Maryland - MD,,02/28/2021,,El Salvador,,2021-02-17
70,2/17/2021 11:25:23,3,Spanish,Oregon - OR,,02/18/2021,,Venezuela,,2021-02-17
70,2/17/2021 11:25:23,3,Spanish,Oregon - OR,,02/18/2021,,Venezuela,,2021-02-17
70,2/17/2021 11:25:23,3,Spanish,Oregon - OR,,02/18/2021,,Venezuela,,2021-02-17
71,2/17/2021 11:39:31,3,Spanish,Florida - FL,,02/18/2021,,Venezuela,,2021-02-17
71,2/17/2021 11:39:31,3,Spanish,Florida - FL,,02/18/2021,,Venezuela,,2021-02-17
71,2/17/2021 11:39:31,3,Spanish,Florida - FL,,02/18/2021,,Venezuela,,2021-02-17
72,2/17/2021 11:51:47,2,Spanish,Florida - FL,,02/18/2021,,Venezuela,,2021-02-17
72,2/17/2021 11:51:47,2,Spanish,Florida - FL,,02/18/2021,,Venezuela,,2021-02-17
73,2/17/2021 12:10:16,6,Spanish,Utah - UT,,02/17/2021,,Venezuela,,2021-02-17
73,2/17/2021 12:10:16,6,Spanish,Utah - UT,,02/17/2021,,Venezuela,,2021-02-17
73,2/17/2021 12:10:16,6,Spanish,Utah - UT,,02/17/2021,,Venezuela,,2021-02-17
73,2/17/2021 12:10:16,6,Spanish,Utah - UT,,02/17/2021,,Venezuela,,2021-02-17
73,2/17/2021 12:10:16,6,Spanish,Utah - UT,,02/17/2021,,Venezuela,,2021-02-17
73,2/17/2021 12:10:16,6,Spanish,Utah - UT,,02/17/2021,,Venezuela,,2021-02-17
74,2/17/2021 14:57:20,3,Spanish,New York - NY,,02/23/2021,,Ecuador,,2021-02-17
74,2/17/2021 14:57:20,3,Spanish,New York - NY,,02/23/2021,,Ecuador,,2021-02-17
74,2/17/2021 14:57:20,3,Spanish,New York - NY,,02/23/2021,,Ecuador,,2021-02-17
75,2/17/2021 15:05:24,2,Spanish,New York - NY,,02/18/2021,,Ecuador,,2021-02-17
75,2/17/2021 15:05:24,2,Spanish,New York - NY,,02/18/2021,,Ecuador,,2021-02-17
76,2/17/2021 15:39:11,1,Spanish,Indiana - IN,,02/18/2021,,Venezuela,,2021-02-17
77,2/17/2021 20:37:23,1,Spanish,Florida - FL,,02/25/2021,,Mexico,,2021-02-17
78,2/18/2021 9:27:32,3,Spanish,Georgia - GA,,02/19/2021,,Venezuela,,2021-02-18
78,2/18/2021 9:27:32,3,Spanish,Georgia - GA,,02/19/2021,,Venezuela,,2021-02-18
78,2/18/2021 9:27:32,3,Spanish,Georgia - GA,,02/19/2021,,Venezuela,,2021-02-18
79,2/18/2021 9:33:23,1,Spanish,Arizona - AZ,,02/18/2021,,Venezuela,,2021-02-18
80,2/18/2021 9:36:02,1,Spanish,Florida - FL,,02/19/2021,,Cuba,,2021-02-18
81,2/18/2021 11:27:42,3,Spanish,New York - NY,,02/19/2021,,Ecuador,,2021-02-18
81,2/18/2021 11:27:42,3,Spanish,New York - NY,,02/19/2021,,Ecuador,,2021-02-18
81,2/18/2021 11:27:42,3,Spanish,New York - NY,,02/19/2021,,Ecuador,,2021-02-18
82,2/18/2021 16:18:59,1,Quanjobal,California - CA,,02/21/2021,,Guatemala,,2021-02-18
83,2/19/2021 9:22:50,2,Spanish,California - CA,,02/21/2021,,Honduras,,2021-02-19
83,2/19/2021 9:22:50,2,Spanish,California - CA,,02/21/2021,,Honduras,,2021-02-19
84,2/19/2021 9:33:08,2,Spanish,New York - NY,,02/21/2021,,Ecuador,,2021-02-19
84,2/19/2021 9:33:08,2,Spanish,New York - NY,,02/21/2021,,Ecuador,,2021-02-19
85,2/19/2021 15:25:31,1,Spanish,Massachusetts - MA,,02/22/2021,,Ecuador,,2021-02-19
86,2/19/2021 15:33:50,2,Spanish,New York - NY,,02/20/2021,,Ecuador,,2021-02-19
86,2/19/2021 15:33:50,2,Spanish,New York - NY,,02/20/2021,,Ecuador,,2021-02-19
87,2/19/2021 15:35:01,2,Spanish,Florida - FL,,02/19/2021,,Guatemala,,2021-02-19
87,2/19/2021 15:35:01,2,Spanish,Florida - FL,,02/19/2021,,Guatemala,,2021-02-19
88,2/19/2021 15:43:15,2,Spanish,New York - NY,,02/20/2021,,Ecuador,,2021-02-19
88,2/19/2021 15:43:15,2,Spanish,New York - NY,,02/20/2021,,Ecuador,,2021-02-19
89,2/19/2021 15:44:04,2,Spanish,Florida - FL,,02/19/2021,,Cuba,,2021-02-19
89,2/19/2021 15:44:04,2,Spanish,Florida - FL,,02/19/2021,,Cuba,,2021-02-19
90,2/19/2021 15:56:43,3,Spanish,New York - NY,,02/21/2021,,Ecuador,,2021-02-19
90,2/19/2021 15:56:43,3,Spanish,New York - NY,,02/21/2021,,Ecuador,,2021-02-19
90,2/19/2021 15:56:43,3,Spanish,New York - NY,,02/21/2021,,Ecuador,,2021-02-19
91,2/19/2021 15:58:44,1,Spanish,Georgia - GA,,02/19/2021,,Venezuela,,2021-02-19
92,2/19/2021 15:58:53,1,Spanish,Texas - TX,,02/19/2021,,Venezuela,,2021-02-19
93,2/19/2021 16:08:51,3,Spanish,New York - NY,,02/21/2021,,Ecuador,,2021-02-19
93,2/19/2021 16:08:51,3,Spanish,New York - NY,,02/21/2021,,Ecuador,,2021-02-19
93,2/19/2021 16:08:51,3,Spanish,New York - NY,,02/21/2021,,Ecuador,,2021-02-19
94,2/20/2021 10:03:09,3,Spanish,Florida - FL,,02/21/2021,,Cuba,,2021-02-20
94,2/20/2021 10:03:09,3,Spanish,Florida - FL,,02/21/2021,,Cuba,,2021-02-20
94,2/20/2021 10:03:09,3,Spanish,Florida - FL,,02/21/2021,,Cuba,,2021-02-20
95,2/20/2021 10:15:48,3,Spanish,Florida - FL,,02/21/2021,,Cuba,,2021-02-20
95,2/20/2021 10:15:48,3,Spanish,Florida - FL,,02/21/2021,,Cuba,,2021-02-20
95,2/20/2021 10:15:48,3,Spanish,Florida - FL,,02/21/2021,,Cuba,,2021-02-20
96,2/20/2021 10:48:48,3,Spanish,Texas - TX,,02/21/2021,,Cuba,,2021-02-20
96,2/20/2021 10:48:48,3,Spanish,Texas - TX,,02/21/2021,,Cuba,,2021-02-20
96,2/20/2021 10:48:48,3,Spanish,Texas - TX,,02/21/2021,,Cuba,,2021-02-20
97,2/20/2021 13:49:15,3,Spanish,Florida - FL,,02/21/2021,,Cuba,,2021-02-20
97,2/20/2021 13:49:15,3,Spanish,Florida - FL,,02/21/2021,,Cuba,,2021-02-20
97,2/20/2021 13:49:15,3,Spanish,Florida - FL,,02/21/2021,,Cuba,,2021-02-20
98,2/20/2021 14:03:35,4,Spanish,Florida - FL,,02/22/2021,,Cuba,,2021-02-20
98,2/20/2021 14:03:35,4,Spanish,Florida - FL,,02/22/2021,,Cuba,,2021-02-20
98,2/20/2021 14:03:35,4,Spanish,Florida - FL,,02/22/2021,,Cuba,,2021-02-20
98,2/20/2021 14:03:35,4,Spanish,Florida - FL,,02/22/2021,,Cuba,,2021-02-20
99,2/21/2021 14:49:01,2,Spanish,New York - NY,,02/22/2021,,Ecuador,,2021-02-21
99,2/21/2021 14:49:01,2,Spanish,New York - NY,,02/22/2021,,Ecuador,,2021-02-21
100,2/22/2021 10:27:27,2,Spanish,Florida - FL,,02/23/2021,,Cuba,,2021-02-22
100,2/22/2021 10:27:27,2,Spanish,Florida - FL,,02/23/2021,,Cuba,,2021-02-22
101,2/22/2021 10:34:58,1,Spanish,Texas - TX,,02/23/2021,,Venezuela,,2021-02-22
102,2/22/2021 11:28:41,1,Spanish,Tennessee - TN,,02/23/2021,,Guatemala,,2021-02-22
103,2/22/2021 17:12:29,1,Spanish,Florida - FL,,02/23/2021,,Venezuela,,2021-02-22
104,2/22/2021 17:22:03,1,Spanish,Florida - FL,,02/23/2021,,Cuba,,2021-02-22
105,2/22/2021 17:28:07,1,Spanish,Florida - FL,,02/23/2021,,Cuba,,2021-02-22
106,2/22/2021 17:32:17,1,Spanish,Florida - FL,,02/23/2021,,Cuba,,2021-02-22
107,2/23/2021 9:12:05,1,Spanish,Massachusetts - MA,,02/26/2021,,Guatemala,,2021-02-23
108,2/23/2021 11:30:48,1,Mam,Tennessee - TN,,02/24/2021,,Guatemala,,2021-02-23
109,2/23/2021 13:18:40,2,Spanish,Arizona - AZ,,02/23/2021,,Venezuela,,2021-02-23
109,2/23/2021 13:18:40,2,Spanish,Arizona - AZ,,02/23/2021,,Venezuela,,2021-02-23
110,2/24/2021 12:51:21,2,Spanish,New Jersey - NJ,,02/24/2021,,Venezuela,,2021-02-24
110,2/24/2021 12:51:21,2,Spanish,New Jersey - NJ,,02/24/2021,,Venezuela,,2021-02-24
111,2/24/2021 12:51:54,3,Spanish,Florida - FL,,02/24/2021,,Cuba,,2021-02-24
111,2/24/2021 12:51:54,3,Spanish,Florida - FL,,02/24/2021,,Cuba,,2021-02-24
111,2/24/2021 12:51:54,3,Spanish,Florida - FL,,02/24/2021,,Cuba,,2021-02-24
112,2/24/2021 12:53:17,3,Spanish,Texas - TX,,02/24/2021,,Venezuela,,2021-02-24
112,2/24/2021 12:53:17,3,Spanish,Texas - TX,,02/24/2021,,Venezuela,,2021-02-24
112,2/24/2021 12:53:17,3,Spanish,Texas - TX,,02/24/2021,,Venezuela,,2021-02-24
113,2/24/2021 12:55:48,2,Spanish,Utah - UT,,02/24/2021,,Venezuela,,2021-02-24
113,2/24/2021 12:55:48,2,Spanish,Utah - UT,,02/24/2021,,Venezuela,,2021-02-24
114,2/24/2021 12:57:12,3,Spanish,Florida - FL,,02/24/2021,,Cuba,,2021-02-24
114,2/24/2021 12:57:12,3,Spanish,Florida - FL,,02/24/2021,,Cuba,,2021-02-24
114,2/24/2021 12:57:12,3,Spanish,Florida - FL,,02/24/2021,,Cuba,,2021-02-24
115,2/24/2021 12:59:36,2,Spanish,Florida - FL,,02/24/2021,,Mexico,,2021-02-24
115,2/24/2021 12:59:36,2,Spanish,Florida - FL,,02/24/2021,,Mexico,,2021-02-24
116,2/24/2021 13:14:37,5,Spanish,Tennessee - TN,,02/24/2021,,Mexico,,2021-02-24
116,2/24/2021 13:14:37,5,Spanish,Tennessee - TN,,02/24/2021,,Mexico,,2021-02-24
116,2/24/2021 13:14:37,5,Spanish,Tennessee - TN,,02/24/2021,,Mexico,,2021-02-24
116,2/24/2021 13:14:37,5,Spanish,Tennessee - TN,,02/24/2021,,Mexico,,2021-02-24
116,2/24/2021 13:14:37,5,Spanish,Tennessee - TN,,02/24/2021,,Mexico,,2021-02-24
117,2/24/2021 13:15:44,3,Spanish,Indiana - IN,,02/24/2021,,Venezuela,,2021-02-24
117,2/24/2021 13:15:44,3,Spanish,Indiana - IN,,02/24/2021,,Venezuela,,2021-02-24
117,2/24/2021 13:15:44,3,Spanish,Indiana - IN,,02/24/2021,,Venezuela,,2021-02-24
118,2/25/2021 12:03:08,2,Spanish,Arizona - AZ,,02/25/2021,,Venezuela,,2021-02-25
118,2/25/2021 12:03:08,2,Spanish,Arizona - AZ,,02/25/2021,,Venezuela,,2021-02-25
119,2/25/2021 15:16:21,1,Spanish,Georgia - GA,,02/26/2021,,Venezuela,,2021-02-25
120,2/25/2021 15:19:25,1,Spanish,Texas - TX,,02/26/2021,,Venezuela,,2021-02-25
121,2/25/2021 15:22:32,1,Spanish,Florida - FL,,02/26/2021,,Cuba,,2021-02-25
122,2/25/2021 15:27:49,1,Spanish,Texas - TX,,02/26/2021,,Venezuela,,2021-02-25
123,2/25/2021 15:29:13,1,Spanish,Washington - WA,,02/26/2021,,Venezuela,,2021-02-25
124,2/25/2021 15:40:25,2,Spanish,Texas - TX,,02/25/2021,,Cuba,,2021-02-25
124,2/25/2021 15:40:25,2,Spanish,Texas - TX,,02/25/2021,,Cuba,,2021-02-25
125,2/25/2021 15:43:25,1,Spanish,Florida - FL,,02/25/2021,,Cuba,,2021-02-25
126,2/25/2021 17:28:48,1,Mam,Pennsylvania - PA,,02/27/2021,,Guatemala,,2021-02-25
127,2/26/2021 11:17:43,3,Spanish,Texas - TX,,02/27/2021,,Venezuela,,2021-02-26
127,2/26/2021 11:17:43,3,Spanish,Texas - TX,,02/27/2021,,Venezuela,,2021-02-26
127,2/26/2021 11:17:43,3,Spanish,Texas - TX,,02/27/2021,,Venezuela,,2021-02-26
128,2/26/2021 11:18:07,4,Spanish,Florida - FL,,02/27/2021,,Cuba,,2021-02-26
128,2/26/2021 11:18:07,4,Spanish,Florida - FL,,02/27/2021,,Cuba,,2021-02-26
128,2/26/2021 11:18:07,4,Spanish,Florida - FL,,02/27/2021,,Cuba,,2021-02-26
128,2/26/2021 11:18:07,4,Spanish,Florida - FL,,02/27/2021,,Cuba,,2021-02-26
129,2/26/2021 11:28:49,3,Spanish,Texas - TX,,02/27/2021,,Venezuela,,2021-02-26
129,2/26/2021 11:28:49,3,Spanish,Texas - TX,,02/27/2021,,Venezuela,,2021-02-26
129,2/26/2021 11:28:49,3,Spanish,Texas - TX,,02/27/2021,,Venezuela,,2021-02-26
130,2/26/2021 11:29:48,4,Spanish,Texas - TX,,02/27/2021,,Venezuela,,2021-02-26
130,2/26/2021 11:29:48,4,Spanish,Texas - TX,,02/27/2021,,Venezuela,,2021-02-26
130,2/26/2021 11:29:48,4,Spanish,Texas - TX,,02/27/2021,,Venezuela,,2021-02-26
130,2/26/2021 11:29:48,4,Spanish,Texas - TX,,02/27/2021,,Venezuela,,2021-02-26
131,2/26/2021 11:44:30,1,Spanish,Florida - FL,,02/27/2021,,Venezuela,,2021-02-26
132,2/26/2021 12:05:12,1,Spanish,Texas - TX,,02/27/2021,,Venezuela,,2021-02-26
133,2/26/2021 14:51:59,1,Spanish,New Jersey - NJ,,02/27/2021,,Costa Rica,,2021-02-26
134,2/27/2021 10:10:57,3,Spanish,New Jersey - NJ,,02/28/2021,,Cuba,,2021-02-27
134,2/27/2021 10:10:57,3,Spanish,New Jersey - NJ,,02/28/2021,,Cuba,,2021-02-27
134,2/27/2021 10:10:57,3,Spanish,New Jersey - NJ,,02/28/2021,,Cuba,,2021-02-27
135,2/28/2021 11:55:55,2,Spanish,New York - NY,,03/01/2021,,Ecuador,,2021-02-28
135,2/28/2021 11:55:55,2,Spanish,New York - NY,,03/01/2021,,Ecuador,,2021-02-28
136,2/28/2021 12:13:22,3,Spanish,Florida - FL,,02/28/2021,,Venezuela,,2021-02-28
136,2/28/2021 12:13:22,3,Spanish,Florida - FL,,02/28/2021,,Venezuela,,2021-02-28
136,2/28/2021 12:13:22,3,Spanish,Florida - FL,,02/28/2021,,Venezuela,,2021-02-28
137,2/28/2021 21:32:33,1,Spanish,Georgia - GA,,03/01/2021,,Cuba,,2021-02-28
138,2/28/2021 21:37:33,1,Spanish,New York - NY,,03/01/2021,,Cuba,,2021-02-28
139,2/28/2021 21:45:48,1,Spanish,Kansas - KS,,03/02/2021,,Cuba,,2021-02-28
140,2/28/2021 21:47:26,2,Spanish,Texas - TX,,03/01/2021,,Cuba,,2021-02-28
140,2/28/2021 21:47:26,2,Spanish,Texas - TX,,03/01/2021,,Cuba,,2021-02-28
141,2/28/2021 22:02:07,2,Portuguese,Pennsylvania - PA,,03/02/2021,,Brazil,,2021-02-28
141,2/28/2021 22:02:07,2,Portuguese,Pennsylvania - PA,,03/02/2021,,Brazil,,2021-02-28
142,2/28/2021 22:10:14,1,Spanish,Texas - TX,,03/01/2021,,Cuba,,2021-02-28
143,2/28/2021 22:16:08,1,Spanish,Texas - TX,,03/06/2021,,Cuba,,2021-02-28
144,2/28/2021 22:17:58,1,Spanish,Florida - FL,,03/01/2021,,Cuba,,2021-02-28
145,2/28/2021 22:29:23,1,Spanish,Florida - FL,,03/02/2021,,Cuba,,2021-02-28
146,2/28/2021 22:30:30,1,Spanish,Florida - FL,,03/01/2021,,Cuba,,2021-02-28
147,2/28/2021 22:43:35,4,Portuguese,Massachusetts - MA,,03/01/2021,,Brazil,,2021-02-28
147,2/28/2021 22:43:35,4,Portuguese,Massachusetts - MA,,03/01/2021,,Brazil,,2021-02-28
147,2/28/2021 22:43:35,4,Portuguese,Massachusetts - MA,,03/01/2021,,Brazil,,2021-02-28
147,2/28/2021 22:43:35,4,Portuguese,Massachusetts - MA,,03/01/2021,,Brazil,,2021-02-28
148,2/28/2021 22:44:08,2,Spanish,Florida - FL,,03/01/2021,,Cuba,,2021-02-28
148,2/28/2021 22:44:08,2,Spanish,Florida - FL,,03/01/2021,,Cuba,,2021-02-28
149,2/28/2021 22:48:01,2,Spanish,Texas - TX,,03/01/2021,,Cuba,,2021-02-28
149,2/28/2021 22:48:01,2,Spanish,Texas - TX,,03/01/2021,,Cuba,,2021-02-28
150,2/28/2021 22:59:22,1,Spanish,Florida - FL,,03/02/2021,,Cuba,,2021-02-28
151,2/28/2021 23:03:58,1,Spanish,Nebraska - NE,,03/02/2021,,Cuba,,2021-02-28
152,3/1/2021 13:22:35,1,Nepali,New York - NY,,03/02/2021,,Nepal,,2021-03-01
153,3/1/2021 14:42:07,1,Spanish,Kansas - KS,,03/02/2021,,Venezuela,,2021-03-01
154,3/1/2021 14:45:49,2,Spanish,Arizona - AZ,,03/02/2021,,Venezuela,,2021-03-01
154,3/1/2021 14:45:49,2,Spanish,Arizona - AZ,,03/02/2021,,Venezuela,,2021-03-01
155,3/1/2021 14:52:57,1,Spanish,Georgia - GA,,03/02/2021,,Venezuela,,2021-03-01
156,3/1/2021 14:55:56,1,Albanian,Connecticut - CT,,03/03/2021,,Kosovo,,2021-03-01
157,3/1/2021 15:00:00,1,Spanish,Florida - FL,,03/02/2021,,Cuba,,2021-03-01
158,3/1/2021 15:05:23,1,Spanish,Texas - TX,,03/02/2021,,Venezuela,,2021-03-01
159,3/1/2021 15:09:49,1,Spanish,Florida - FL,,03/02/2021,,Venezuela,,2021-03-01
160,3/1/2021 15:11:26,2,Portuguese,Massachusetts - MA,,03/01/2021,,Brazil,,2021-03-01
160,3/1/2021 15:11:26,2,Portuguese,Massachusetts - MA,,03/01/2021,,Brazil,,2021-03-01
161,3/1/2021 15:23:46,1,Spanish,Florida - FL,,03/01/2021,,Cuba,,2021-03-01
162,3/1/2021 15:35:46,1,Hindi,California - CA,,03/01/2021,,India,,2021-03-01
163,3/1/2021 15:45:53,1,Hindi,California - CA,,03/01/2021,,India,,2021-03-01
164,3/1/2021 15:58:37,2,Spanish,Florida - FL,,03/01/2021,,Cuba,,2021-03-01
164,3/1/2021 15:58:37,2,Spanish,Florida - FL,,03/01/2021,,Cuba,,2021-03-01
165,3/1/2021 16:08:21,1,Spanish,Florida - FL,,03/01/2021,,Cuba,,2021-03-01
166,3/1/2021 16:23:08,2,Portuguese,Florida - FL,,03/02/2021,,Brazil,,2021-03-01
166,3/1/2021 16:23:08,2,Portuguese,Florida - FL,,03/02/2021,,Brazil,,2021-03-01
167,3/1/2021 16:56:05,3,Spanish,Florida - FL,,03/01/2021,,"Cuba, Uruguay",,2021-03-01
167,3/1/2021 16:56:05,3,Spanish,Florida - FL,,03/01/2021,,"Cuba, Uruguay",,2021-03-01
167,3/1/2021 16:56:05,3,Spanish,Florida - FL,,03/01/2021,,"Cuba, Uruguay",,2021-03-01
168,3/1/2021 17:13:50,2,Spanish,Texas - TX,,03/01/2021,,Venezuela,,2021-03-01
168,3/1/2021 17:13:50,2,Spanish,Texas - TX,,03/01/2021,,Venezuela,,2021-03-01
169,3/1/2021 17:25:44,1,Spanish,Nevada - NV,,03/01/2021,,Cuba,,2021-03-01
170,3/1/2021 17:31:46,1,Spanish,Texas - TX,,03/01/2021,,Cuba,,2021-03-01
171,3/1/2021 17:36:29,1,Spanish,Nevada - NV,,03/01/2021,,Cuba,,2021-03-01
172,3/1/2021 18:02:30,4,Portuguese,Massachusetts - MA,,03/02/2021,,Brazil,,2021-03-01
172,3/1/2021 18:02:30,4,Portuguese,Massachusetts - MA,,03/02/2021,,Brazil,,2021-03-01
172,3/1/2021 18:02:30,4,Portuguese,Massachusetts - MA,,03/02/2021,,Brazil,,2021-03-01
172,3/1/2021 18:02:30,4,Portuguese,Massachusetts - MA,,03/02/2021,,Brazil,,2021-03-01
173,3/1/2021 18:12:11,2,Spanish,Texas - TX,,03/01/2021,,Cuba,,2021-03-01
173,3/1/2021 18:12:11,2,Spanish,Texas - TX,,03/01/2021,,Cuba,,2021-03-01
174,3/1/2021 18:28:57,3,Spanish,California - CA,,03/01/2021,,Cuba,,2021-03-01
174,3/1/2021 18:28:57,3,Spanish,California - CA,,03/01/2021,,Cuba,,2021-03-01
174,3/1/2021 18:28:57,3,Spanish,California - CA,,03/01/2021,,Cuba,,2021-03-01
175,3/1/2021 19:39:42,1,Spanish,Nebraska - NE,,03/01/2021,,Cuba,,2021-03-01
176,3/1/2021 19:53:59,1,Spanish,Florida - FL,,03/02/2021,,Cuba,,2021-03-01
177,3/1/2021 20:09:26,1,Portuguese,Pennsylvania - PA,,03/02/2021,,Brazil,,2021-03-01
178,3/1/2021 20:12:56,1,Spanish,Texas - TX,,03/01/2021,,Cuba,,2021-03-01
179,3/1/2021 20:20:10,1,Portuguese,New Jersey - NJ,,03/02/2021,,Brazil,,2021-03-01
180,3/1/2021 20:23:35,1,Spanish,Florida - FL,,03/04/2021,,Cuba,,2021-03-01
181,3/1/2021 20:26:48,1,Portuguese,Pennsylvania - PA,,03/02/2021,,Brazil,,2021-03-01
182,3/1/2021 20:29:25,1,Spanish,Florida - FL,,03/03/2021,,Cuba,,2021-03-01
183,3/1/2021 20:33:13,1,Spanish,Florida - FL,,03/02/2021,,Cuba,,2021-03-01
184,3/1/2021 20:33:52,1,Spanish,Florida - FL,,03/02/2021,,Mexico,,2021-03-01
185,3/1/2021 20:45:03,1,Spanish,Texas - TX,,03/02/2021,,Cuba,,2021-03-01
186,3/1/2021 20:53:32,1,Spanish,Florida - FL,,03/02/2021,,Cuba,,2021-03-01
187,3/1/2021 21:02:02,1,Portuguese,New Jersey - NJ,,03/02/2021,,Brazil,,2021-03-01
188,3/1/2021 21:03:23,1,Spanish,Florida - FL,,03/02/1954,,Cuba,,2021-03-01
189,3/1/2021 21:08:47,1,Spanish,Florida - FL,,03/02/2021,,Cuba,,2021-03-01
190,3/2/2021 11:38:20,1,Spanish,Georgia - GA,,03/04/2021,,Venezuela,,2021-03-02
191,3/2/2021 11:48:15,4,Spanish,New York - NY,,03/03/2021,,Ecuador,,2021-03-02
191,3/2/2021 11:48:15,4,Spanish,New York - NY,,03/03/2021,,Ecuador,,2021-03-02
191,3/2/2021 11:48:15,4,Spanish,New York - NY,,03/03/2021,,Ecuador,,2021-03-02
191,3/2/2021 11:48:15,4,Spanish,New York - NY,,03/03/2021,,Ecuador,,2021-03-02
192,3/2/2021 13:51:49,2,Spanish,Georgia - GA,,03/03/2021,,Mexico,,2021-03-02
192,3/2/2021 13:51:49,2,Spanish,Georgia - GA,,03/03/2021,,Mexico,,2021-03-02
193,3/2/2021 14:03:28,2,Spanish,Alabama - AL,,03/03/2021,,Guatemala,,2021-03-02
193,3/2/2021 14:03:28,2,Spanish,Alabama - AL,,03/03/2021,,Guatemala,,2021-03-02
194,3/3/2021 10:48:20,1,Achi,Florida - FL,,03/04/2021,,Guatemala,,2021-03-03
195,3/3/2021 11:22:49,6,Spanish,Georgia - GA,,03/03/2021,,Venezuela,,2021-03-03
195,3/3/2021 11:22:49,6,Spanish,Georgia - GA,,03/03/2021,,Venezuela,,2021-03-03
195,3/3/2021 11:22:49,6,Spanish,Georgia - GA,,03/03/2021,,Venezuela,,2021-03-03
195,3/3/2021 11:22:49,6,Spanish,Georgia - GA,,03/03/2021,,Venezuela,,2021-03-03
195,3/3/2021 11:22:49,6,Spanish,Georgia - GA,,03/03/2021,,Venezuela,,2021-03-03
195,3/3/2021 11:22:49,6,Spanish,Georgia - GA,,03/03/2021,,Venezuela,,2021-03-03
196,3/3/2021 11:32:53,1,Spanish,Texas - TX,,03/04/2021,,Venezuela,,2021-03-03
197,3/3/2021 11:38:26,1,Spanish,California - CA,,03/03/2021,,Guatemala,,2021-03-03
198,3/3/2021 11:44:38,2,Spanish,Utah - UT,,03/03/2021,,Venezuela,,2021-03-03
198,3/3/2021 11:44:38,2,Spanish,Utah - UT,,03/03/2021,,Venezuela,,2021-03-03
199,3/3/2021 11:52:28,2,Chuj,Alabama - AL,,03/04/2021,,Guatemala,,2021-03-03
199,3/3/2021 11:52:28,2,Chuj,Alabama - AL,,03/04/2021,,Guatemala,,2021-03-03
200,3/3/2021 19:00:00,2,Spanish,"Newman Lake, WA",,03/16/2021,,Venezuela,,2021-03-03
200,3/3/2021 19:00:00,2,Spanish,"Newman Lake, WA",,03/16/2021,,Venezuela,,2021-03-03
201,3/3/2021 19:00:00,1,Spanish,"Tampa, FL",,03/04/2021,,Cuba,,2021-03-03
202,3/3/2021 19:00:00,1,Spanish,"Miami, FL",,03/04/2021,,Cuba,,2021-03-03
203,3/3/2021 19:00:00,1,Spanish,"Las Vegas, NV",,03/04/2021,,Cuba,,2021-03-03
204,3/3/2021 19:00:00,3,Portuguese,"Philadelphia, PA",,03/04/2021,,Brazil,,2021-03-03
204,3/3/2021 19:00:00,3,Portuguese,"Philadelphia, PA",,03/04/2021,,Brazil,,2021-03-03
204,3/3/2021 19:00:00,3,Portuguese,"Philadelphia, PA",,03/04/2021,,Brazil,,2021-03-03
205,3/3/2021 19:00:00,3,Spanish,"West Park, FL",,03/04/2021,,Venezuela,,2021-03-03
205,3/3/2021 19:00:00,3,Spanish,"West Park, FL",,03/04/2021,,Venezuela,,2021-03-03
205,3/3/2021 19:00:00,3,Spanish,"West Park, FL",,03/04/2021,,Venezuela,,2021-03-03
206,3/3/2021 19:00:00,4,Spanish,"Plantation, FL",,03/04/2021,,Venezuela,,2021-03-03
206,3/3/2021 19:00:00,4,Spanish,"Plantation, FL",,03/04/2021,,Venezuela,,2021-03-03
206,3/3/2021 19:00:00,4,Spanish,"Plantation, FL",,03/04/2021,,Venezuela,,2021-03-03
206,3/3/2021 19:00:00,4,Spanish,"Plantation, FL",,03/04/2021,,Venezuela,,2021-03-03
207,3/3/2021 19:00:00,2,Spanish,"Kissimee, FL",,03/04/2021,,Cuba,,2021-03-03
207,3/3/2021 19:00:00,2,Spanish,"Kissimee, FL",,03/04/2021,,Cuba,,2021-03-03
208,3/3/2021 19:00:00,1,Spanish,"Homested, FL",,03/04/2021,,Cuba,,2021-03-03
209,3/3/2021 19:00:00,1,Spanish,"West Palm Beach, FL",,03/04/2021,,Cuba,,2021-03-03
210,3/3/2021 19:00:00,1,Spanish,"Fairdale, KY",,03/04/2021,,Cuba,,2021-03-03
211,3/3/2021 19:00:00,1,Spanish,"Venice, FL",,03/04/2021,,Cuba,,2021-03-03
212,3/3/2021 19:00:00,1,Spanish,"Las Vegas, NV",,03/04/2021,,Cuba,,2021-03-03
213,3/3/2021 19:00:00,1,Spanish,"Miami, FL",,03/04/2021,,Cuba,,2021-03-03
214,3/3/2021 19:00:00,3,Portuguese,"Pampano Beach, FL",,03/04/2021,,Brazil,,2021-03-03
214,3/3/2021 19:00:00,3,Portuguese,"Pampano Beach, FL",,03/04/2021,,Brazil,,2021-03-03
214,3/3/2021 19:00:00,3,Portuguese,"Pampano Beach, FL",,03/04/2021,,Brazil,,2021-03-03
215,3/3/2021 19:00:00,1,Spanish,"Hialeah, FL",,03/04/2021,,Cuba,,2021-03-03
216,3/3/2021 19:00:00,1,Portuguese,"Panama City, FL",,03/04/2021,,Brazil,,2021-03-03
217,3/3/2021 19:00:00,1,Spanish,"Houston, TX",,03/04/2021,,Cuba,,2021-03-03
218,3/3/2021 19:00:00,1,Spanish,"Houston, TX",,03/07/2021,,Cuba,,2021-03-03
219,3/3/2021 19:00:00,3,Portuguese,"Farmingham, MA",,03/04/2021,,Brazil,,2021-03-03
219,3/3/2021 19:00:00,3,Portuguese,"Farmingham, MA",,03/04/2021,,Brazil,,2021-03-03
219,3/3/2021 19:00:00,3,Portuguese,"Farmingham, MA",,03/04/2021,,Brazil,,2021-03-03
220,3/3/2021 19:00:00,2,Portuguese,"Boston, MA",,03/04/2021,,Brazil,,2021-03-03
220,3/3/2021 19:00:00,2,Portuguese,"Boston, MA",,03/04/2021,,Brazil,,2021-03-03
221,3/3/2021 19:00:00,3,Portuguese,"Hoover, AL",,03/04/2021,,Brazil,,2021-03-03
221,3/3/2021 19:00:00,3,Portuguese,"Hoover, AL",,03/04/2021,,Brazil,,2021-03-03
221,3/3/2021 19:00:00,3,Portuguese,"Hoover, AL",,03/04/2021,,Brazil,,2021-03-03
222,3/3/2021 19:00:00,2,Spanish,"Metarie, LA",,03/04/2021,,Nicaragua,,2021-03-03
222,3/3/2021 19:00:00,2,Spanish,"Metarie, LA",,03/04/2021,,Nicaragua,,2021-03-03
223,3/3/2021 19:00:00,3,Spanish,"Tampa, FL",,03/04/2021,,Cuba,,2021-03-03
223,3/3/2021 19:00:00,3,Spanish,"Tampa, FL",,03/04/2021,,Cuba,,2021-03-03
223,3/3/2021 19:00:00,3,Spanish,"Tampa, FL",,03/04/2021,,Cuba,,2021-03-03
224,3/3/2021 19:00:00,3,Portuguese,"Marshfield, MA",,03/04/2021,,Brazil,,2021-03-03
224,3/3/2021 19:00:00,3,Portuguese,"Marshfield, MA",,03/04/2021,,Brazil,,2021-03-03
224,3/3/2021 19:00:00,3,Portuguese,"Marshfield, MA",,03/04/2021,,Brazil,,2021-03-03
225,3/4/2021 16:05:50,4,Spanish,Florida - FL,,03/04/2021,,Venezuela,,2021-03-04
225,3/4/2021 16:05:50,4,Spanish,Florida - FL,,03/04/2021,,Venezuela,,2021-03-04
225,3/4/2021 16:05:50,4,Spanish,Florida - FL,,03/04/2021,,Venezuela,,2021-03-04
225,3/4/2021 16:05:50,4,Spanish,Florida - FL,,03/04/2021,,Venezuela,,2021-03-04
226,3/4/2021 16:16:27,3,Spanish,Texas - TX,,03/04/2021,,Venezuela,,2021-03-04
226,3/4/2021 16:16:27,3,Spanish,Texas - TX,,03/04/2021,,Venezuela,,2021-03-04
226,3/4/2021 16:16:27,3,Spanish,Texas - TX,,03/04/2021,,Venezuela,,2021-03-04
227,3/4/2021 16:29:04,3,Spanish,Texas - TX,,03/04/2021,,Venezuela,,2021-03-04
227,3/4/2021 16:29:04,3,Spanish,Texas - TX,,03/04/2021,,Venezuela,,2021-03-04
227,3/4/2021 16:29:04,3,Spanish,Texas - TX,,03/04/2021,,Venezuela,,2021-03-04
228,3/4/2021 16:30:06,4,Spanish,Florida - FL,,03/04/2021,,Cuba,,2021-03-04
228,3/4/2021 16:30:06,4,Spanish,Florida - FL,,03/04/2021,,Cuba,,2021-03-04
228,3/4/2021 16:30:06,4,Spanish,Florida - FL,,03/04/2021,,Cuba,,2021-03-04
228,3/4/2021 16:30:06,4,Spanish,Florida - FL,,03/04/2021,,Cuba,,2021-03-04
229,3/4/2021 16:49:33,1,Spanish,Texas - TX,,03/04/2021,,Cuba,,2021-03-04
230,3/4/2021 17:01:39,3,Spanish,Florida - FL,,03/04/2021,,Cuba,,2021-03-04
230,3/4/2021 17:01:39,3,Spanish,Florida - FL,,03/04/2021,,Cuba,,2021-03-04
230,3/4/2021 17:01:39,3,Spanish,Florida - FL,,03/04/2021,,Cuba,,2021-03-04
231,3/4/2021 18:22:00,2,Spanish,"Miami, FL",,03/07/2021,,Cuba,,2021-03-04
231,3/4/2021 18:22:00,2,Spanish,"Miami, FL",,03/07/2021,,Cuba,,2021-03-04
232,3/4/2021 18:22:00,1,Spanish,"Miami, FL",,03/05/2021,,Cuba,,2021-03-04
233,3/4/2021 18:22:00,3,Spanish,"Miami, FL",,03/04/2021,,Cuba,,2021-03-04
233,3/4/2021 18:22:00,3,Spanish,"Miami, FL",,03/04/2021,,Cuba,,2021-03-04
233,3/4/2021 18:22:00,3,Spanish,"Miami, FL",,03/04/2021,,Cuba,,2021-03-04
234,3/4/2021 18:22:00,2,Spanish,"Miami, FL",,03/05/2021,,Cuba,,2021-03-04
234,3/4/2021 18:22:00,2,Spanish,"Miami, FL",,03/05/2021,,Cuba,,2021-03-04
235,3/4/2021 18:22:00,1,Spanish,"Miami, FL",,03/04/2021,,Cuba,,2021-03-04
236,3/4/2021 18:22:00,1,Spanish,"Miami, FL",,03/05/2021,,Cuba,,2021-03-04
237,3/4/2021 18:22:00,3,Spanish,"Miami, FL",,03/05/2021,,Cuba,,2021-03-04
237,3/4/2021 18:22:00,3,Spanish,"Miami, FL",,03/05/2021,,Cuba,,2021-03-04
237,3/4/2021 18:22:00,3,Spanish,"Miami, FL",,03/05/2021,,Cuba,,2021-03-04
238,3/4/2021 18:22:00,3,Spanish,"Houston, TX",,03/05/2021,,Cuba,,2021-03-04
238,3/4/2021 18:22:00,3,Spanish,"Houston, TX",,03/05/2021,,Cuba,,2021-03-04
238,3/4/2021 18:22:00,3,Spanish,"Houston, TX",,03/05/2021,,Cuba,,2021-03-04
239,3/4/2021 18:22:00,1,Spanish,"Miami, FL",,03/05/2021,,Cuba,,2021-03-04
240,3/4/2021 18:22:00,1,Spanish,"Houston, TX",,03/05/2021,,Cuba,,2021-03-04
241,3/4/2021 18:22:00,1,Spanish,"Miami, FL",,03/05/2021,,Cuba,,2021-03-04
242,3/4/2021 18:22:00,1,Spanish,"Houston, TX",,03/05/2021,,Cuba,,2021-03-04
243,3/4/2021 18:22:00,4,Spanish,"San Antonio, TX",,03/04/2021,,Cuba,,2021-03-04
243,3/4/2021 18:22:00,4,Spanish,"San Antonio, TX",,03/04/2021,,Cuba,,2021-03-04
243,3/4/2021 18:22:00,4,Spanish,"San Antonio, TX",,03/04/2021,,Cuba,,2021-03-04
243,3/4/2021 18:22:00,4,Spanish,"San Antonio, TX",,03/04/2021,,Cuba,,2021-03-04
244,3/4/2021 18:22:00,2,Spanish,"Detroit, MI",,03/05/2021,,Cuba,,2021-03-04
244,3/4/2021 18:22:00,2,Spanish,"Detroit, MI",,03/05/2021,,Cuba,,2021-03-04
245,3/4/2021 18:22:00,1,Spanish,"Tampa, FL",,03/05/2021,,,,2021-03-04
246,3/4/2021 18:22:00,1,Spanish,"Miami, FL",,03/05/2021,,,,2021-03-04
247,3/4/2021 18:22:00,1,Spanish,"Miami, FL",,03/05/2021,,,,2021-03-04
248,3/4/2021 18:22:00,1,Spanish,"Miami, FL",,03/05/2021,,,,2021-03-04
249,3/4/2021 18:22:00,3,Portuguese,"Framingham, MA",,03/05/2021,,,,2021-03-04
249,3/4/2021 18:22:00,3,Portuguese,"Framingham, MA",,03/05/2021,,,,2021-03-04
249,3/4/2021 18:22:00,3,Portuguese,"Framingham, MA",,03/05/2021,,,,2021-03-04
250,3/4/2021 18:22:00,1,Portuguese,"San Francisco, CA",,03/08/2021,,,,2021-03-04
251,3/4/2021 18:22:00,1,Portuguese,"Quincy, MA",,03/05/2021,,,,2021-03-04
252,3/4/2021 18:22:00,1,Spanish,"Tampa, FL",,03/04/2021,,,,2021-03-04
253,3/4/2021 18:22:00,1,Spanish,"Tampa, FL",,03/05/2021,,,,2021-03-04
254,3/4/2021 18:22:00,3,Spanish,"Phoenix, AZ",,03/05/2021,,,,2021-03-04
254,3/4/2021 18:22:00,3,Spanish,"Phoenix, AZ",,03/05/2021,,,,2021-03-04
254,3/4/2021 18:22:00,3,Spanish,"Phoenix, AZ",,03/05/2021,,,,2021-03-04
255,3/4/2021 18:22:00,1,Spanish,"Miami, FL",,03/05/2021,,,,2021-03-04
256,3/4/2021 18:22:00,1,Spanish,"San Diego, CA",,03/08/2021,,,,2021-03-04
257,3/4/2021 18:22:00,1,Creole,"Miami, FL",,03/07/2021,,,,2021-03-04
258,3/4/2021 18:22:00,1,Spanish,"Cypress, TX",,03/05/2021,,,,2021-03-04
259,3/4/2021 18:22:00,1,Spanish,"Miami, FL",,03/05/2021,,,,2021-03-04
260,3/4/2021 18:22:00,1,Spanish,"San Antonio, TX",,03/05/2021,,,,2021-03-04
261,3/4/2021 18:22:00,2,Spanish,"Detroit, MI",,03/05/2021,,,,2021-03-04
261,3/4/2021 18:22:00,2,Spanish,"Detroit, MI",,03/05/2021,,,,2021-03-04
262,3/4/2021 18:22:00,3,Portuguese,"Milford, MS",,03/04/2021,,,,2021-03-04
262,3/4/2021 18:22:00,3,Portuguese,"Milford, MS",,03/04/2021,,,,2021-03-04
262,3/4/2021 18:22:00,3,Portuguese,"Milford, MS",,03/04/2021,,,,2021-03-04
263,3/4/2021 18:23:00,2,Spanish,,,03/05/2021,,,,2021-03-04
263,3/4/2021 18:23:00,2,Spanish,,,03/05/2021,,,,2021-03-04
264,3/5/2021 10:04:00,1,Spanish,Florida - FL,,03/05/2021,,Venezuela,,2021-03-05
265,3/5/2021 10:14:59,4,Spanish,Florida - FL,,03/05/2021,,Venezuela,,2021-03-05
265,3/5/2021 10:14:59,4,Spanish,Florida - FL,,03/05/2021,,Venezuela,,2021-03-05
265,3/5/2021 10:14:59,4,Spanish,Florida - FL,,03/05/2021,,Venezuela,,2021-03-05
265,3/5/2021 10:14:59,4,Spanish,Florida - FL,,03/05/2021,,Venezuela,,2021-03-05
266,3/5/2021 10:25:27,4,Spanish,Texas - TX,,03/05/2021,,Venezuela,,2021-03-05
266,3/5/2021 10:25:27,4,Spanish,Texas - TX,,03/05/2021,,Venezuela,,2021-03-05
266,3/5/2021 10:25:27,4,Spanish,Texas - TX,,03/05/2021,,Venezuela,,2021-03-05
266,3/5/2021 10:25:27,4,Spanish,Texas - TX,,03/05/2021,,Venezuela,,2021-03-05
267,3/5/2021 10:30:38,1,Spanish,Texas - TX,,03/05/2021,,Venezuela,,2021-03-05
268,3/5/2021 11:36:14,1,Achi,California - CA,,03/07/2021,,Guatemala,,2021-03-05
269,3/5/2021 11:47:29,4,Spanish,Colorado - CO,,03/09/2021,,Mexico,,2021-03-05
269,3/5/2021 11:47:29,4,Spanish,Colorado - CO,,03/09/2021,,Mexico,,2021-03-05
269,3/5/2021 11:47:29,4,Spanish,Colorado - CO,,03/09/2021,,Mexico,,2021-03-05
269,3/5/2021 11:47:29,4,Spanish,Colorado - CO,,03/09/2021,,Mexico,,2021-03-05
270,3/5/2021 11:51:14,1,Spanish,California - CA,,03/06/2021,,Guatemala,,2021-03-05
271,3/5/2021 11:56:51,1,Achi,New Jersey - NJ,,03/07/2021,,Guatemala,,2021-03-05
272,3/5/2021 11:59:56,1,Spanish,New York - NY,,03/06/2021,,Guatemala,,2021-03-05
273,3/5/2021 15:16:50,1,Kichwa,New York - NY,,03/16/2021,,Ecuador,,2021-03-05
274,3/6/2021 10:49:44,2,Spanish,Georgia - GA,,03/07/2021,,Venezuela,,2021-03-06
274,3/6/2021 10:49:44,2,Spanish,Georgia - GA,,03/07/2021,,Venezuela,,2021-03-06
275,3/6/2021 10:55:58,1,Spanish,New Jersey - NJ,,03/07/2021,,Ecuador,,2021-03-06
276,3/6/2021 11:05:34,1,Spanish,Florida - FL,,03/07/2021,,Cuba,,2021-03-06
277,3/6/2021 11:10:59,1,Spanish,Texas - TX,,03/07/2021,,Venezuela,,2021-03-06
278,3/6/2021 11:22:05,1,Spanish,Florida - FL,,03/07/2021,,Nicaragua,,2021-03-06
279,3/6/2021 19:50:00,3,Spanish,"Miami, FL",,03/07/2021,,Cuba,,2021-03-06
279,3/6/2021 19:50:00,3,Spanish,"Miami, FL",,03/07/2021,,Cuba,,2021-03-06
279,3/6/2021 19:50:00,3,Spanish,"Miami, FL",,03/07/2021,,Cuba,,2021-03-06
280,3/6/2021 19:50:00,3,Spanish,"Riviera Beach, FL",,03/07/2021,,,,2021-03-06
280,3/6/2021 19:50:00,3,Spanish,"Riviera Beach, FL",,03/07/2021,,,,2021-03-06
280,3/6/2021 19:50:00,3,Spanish,"Riviera Beach, FL",,03/07/2021,,,,2021-03-06
281,3/6/2021 19:50:00,1,Spanish,"Baton Rouge, LA",,03/07/2021,,,,2021-03-06
282,3/6/2021 19:50:00,2,,"Cutter Bay, FL",,03/10/2021,,,,2021-03-06
282,3/6/2021 19:50:00,2,,"Cutter Bay, FL",,03/10/2021,,,,2021-03-06
283,3/6/2021 19:50:00,3,Spanish,"Holliwood, FL",,03/07/2021,,,,2021-03-06
283,3/6/2021 19:50:00,3,Spanish,"Holliwood, FL",,03/07/2021,,,,2021-03-06
283,3/6/2021 19:50:00,3,Spanish,"Holliwood, FL",,03/07/2021,,,,2021-03-06
284,3/6/2021 19:50:00,1,Spanish,"Houston, TX",,03/07/2021,,,,2021-03-06
285,3/6/2021 19:50:00,1,Spanish,"Miami, FL",,03/07/2021,,,,2021-03-06
286,3/6/2021 19:50:00,4,Romanian,"Scottsbluff, NE",,03/07/2021,,Romania,,2021-03-06
286,3/6/2021 19:50:00,4,Romanian,"Scottsbluff, NE",,03/07/2021,,Romania,,2021-03-06
286,3/6/2021 19:50:00,4,Romanian,"Scottsbluff, NE",,03/07/2021,,Romania,,2021-03-06
286,3/6/2021 19:50:00,4,Romanian,"Scottsbluff, NE",,03/07/2021,,Romania,,2021-03-06
287,3/6/2021 19:50:00,3,Spanish,"Miami, FL",,03/07/2021,,Cuba,,2021-03-06
287,3/6/2021 19:50:00,3,Spanish,"Miami, FL",,03/07/2021,,Cuba,,2021-03-06
287,3/6/2021 19:50:00,3,Spanish,"Miami, FL",,03/07/2021,,Cuba,,2021-03-06
288,3/6/2021 19:50:00,3,Romanian,"Scottsbluff, NE",,03/07/2021,,Romania,,2021-03-06
288,3/6/2021 19:50:00,3,Romanian,"Scottsbluff, NE",,03/07/2021,,Romania,,2021-03-06
288,3/6/2021 19:50:00,3,Romanian,"Scottsbluff, NE",,03/07/2021,,Romania,,2021-03-06
289,3/6/2021 19:50:00,3,Spanish,,,03/07/2021,,Cuba,,2021-03-06
289,3/6/2021 19:50:00,3,Spanish,,,03/07/2021,,Cuba,,2021-03-06
289,3/6/2021 19:50:00,3,Spanish,,,03/07/2021,,Cuba,,2021-03-06
290,3/6/2021 19:50:00,3,Spanish,,,03/07/2021,,Cuba/Brazil,,2021-03-06
290,3/6/2021 19:50:00,3,Spanish,,,03/07/2021,,Cuba/Brazil,,2021-03-06
290,3/6/2021 19:50:00,3,Spanish,,,03/07/2021,,Cuba/Brazil,,2021-03-06
291,3/6/2021 19:50:00,3,Spanish,,,03/08/2021,,Nicaragua,,2021-03-06
291,3/6/2021 19:50:00,3,Spanish,,,03/08/2021,,Nicaragua,,2021-03-06
291,3/6/2021 19:50:00,3,Spanish,,,03/08/2021,,Nicaragua,,2021-03-06
292,3/6/2021 19:50:00,3,Spanish,,,03/07/2021,,Nicaragua,,2021-03-06
292,3/6/2021 19:50:00,3,Spanish,,,03/07/2021,,Nicaragua,,2021-03-06
292,3/6/2021 19:50:00,3,Spanish,,,03/07/2021,,Nicaragua,,2021-03-06
293,3/6/2021 19:50:00,4,Portuguese,,,03/09/2021,,Brazil,,2021-03-06
293,3/6/2021 19:50:00,4,Portuguese,,,03/09/2021,,Brazil,,2021-03-06
293,3/6/2021 19:50:00,4,Portuguese,,,03/09/2021,,Brazil,,2021-03-06
293,3/6/2021 19:50:00,4,Portuguese,,,03/09/2021,,Brazil,,2021-03-06
294,3/6/2021 19:50:00,2,Portuguese,,,03/07/2021,,Brazil,,2021-03-06
294,3/6/2021 19:50:00,2,Portuguese,,,03/07/2021,,Brazil,,2021-03-06
295,3/6/2021 19:50:00,2,Portuguese,,,03/07/2021,,Brazil,,2021-03-06
295,3/6/2021 19:50:00,2,Portuguese,,,03/07/2021,,Brazil,,2021-03-06
296,3/6/2021 19:50:00,1,,,,03/07/2021,,India,,2021-03-06
297,3/6/2021 19:50:00,1,Spanish,,,03/07/2021,,Cuba,,2021-03-06
298,3/6/2021 19:50:00,1,Spanish,,,03/07/2021,,Venezuela,,2021-03-06
299,3/6/2021 19:50:00,1,Spanish,,,03/08/2021,,Cuba,,2021-03-06
300,3/6/2021 19:50:00,1,Spanish,Tennessee - TN,,03/08/2021,,Cuba,,2021-03-06
301,3/6/2021 19:50:00,1,Spanish,"Miami, FL",,03/18/2021,,Cuba,,2021-03-06
302,3/7/2021 14:16:25,2,Spanish,Florida - FL,,03/12/2021,,Venezuela,,2021-03-07
302,3/7/2021 14:16:25,2,Spanish,Florida - FL,,03/12/2021,,Venezuela,,2021-03-07
303,3/7/2021 14:32:39,2,Spanish,Florida - FL,,03/12/2021,,Venezuela,,2021-03-07
303,3/7/2021 14:32:39,2,Spanish,Florida - FL,,03/12/2021,,Venezuela,,2021-03-07
304,3/7/2021 14:53:10,3,Spanish,Texas - TX,,03/09/2021,,Cuba,,2021-03-07
304,3/7/2021 14:53:10,3,Spanish,Texas - TX,,03/09/2021,,Cuba,,2021-03-07
304,3/7/2021 14:53:10,3,Spanish,Texas - TX,,03/09/2021,,Cuba,,2021-03-07
305,3/7/2021 16:48:59,3,Spanish,Texas - TX,,03/08/2021,,Cuba,,2021-03-07
305,3/7/2021 16:48:59,3,Spanish,Texas - TX,,03/08/2021,,Cuba,,2021-03-07
305,3/7/2021 16:48:59,3,Spanish,Texas - TX,,03/08/2021,,Cuba,,2021-03-07
306,3/7/2021 17:24:52,1,Spanish,California - CA,,03/08/2021,,Cuba,,2021-03-07
307,3/8/2021 14:29:32,2,Spanish,"Florida, Texas",,03/11/2021,,Venezuela,,2021-03-08
307,3/8/2021 14:29:32,2,Spanish,"Florida, Texas",,03/11/2021,,Venezuela,,2021-03-08
308,3/8/2021 14:34:50,5,Spanish,Tennessee - TN,,03/09/2021,,Venezuela,,2021-03-08
308,3/8/2021 14:34:50,5,Spanish,Tennessee - TN,,03/09/2021,,Venezuela,,2021-03-08
308,3/8/2021 14:34:50,5,Spanish,Tennessee - TN,,03/09/2021,,Venezuela,,2021-03-08
308,3/8/2021 14:34:50,5,Spanish,Tennessee - TN,,03/09/2021,,Venezuela,,2021-03-08
308,3/8/2021 14:34:50,5,Spanish,Tennessee - TN,,03/09/2021,,Venezuela,,2021-03-08
309,3/8/2021 14:34:59,2,Spanish,Texas - TX,,03/09/2021,,Cuba,,2021-03-08
309,3/8/2021 14:34:59,2,Spanish,Texas - TX,,03/09/2021,,Cuba,,2021-03-08
310,3/8/2021 14:37:44,2,Spanish,Texas - TX,,03/09/2021,,Venezuela,,2021-03-08
310,3/8/2021 14:37:44,2,Spanish,Texas - TX,,03/09/2021,,Venezuela,,2021-03-08
311,3/8/2021 14:38:06,1,Spanish,Florida - FL,,03/08/2021,,Venezuela,,2021-03-08
312,3/8/2021 14:42:33,1,Spanish,Texas - TX,,03/09/2021,,Venezuela,,2021-03-08
313,3/8/2021 14:46:39,1,Spanish,Texas - TX,,03/09/2021,,Venezuela,,2021-03-08
314,3/8/2021 14:47:32,1,Spanish,South Carolina - SC,,03/11/2021,,Nicaragua,,2021-03-08
315,3/8/2021 14:47:58,6,Spanish,Florida - FL,,03/09/2021,,"Venezuela, Cuba",,2021-03-08
315,3/8/2021 14:47:58,6,Spanish,Florida - FL,,03/09/2021,,"Venezuela, Cuba",,2021-03-08
315,3/8/2021 14:47:58,6,Spanish,Florida - FL,,03/09/2021,,"Venezuela, Cuba",,2021-03-08
315,3/8/2021 14:47:58,6,Spanish,Florida - FL,,03/09/2021,,"Venezuela, Cuba",,2021-03-08
315,3/8/2021 14:47:58,6,Spanish,Florida - FL,,03/09/2021,,"Venezuela, Cuba",,2021-03-08
315,3/8/2021 14:47:58,6,Spanish,Florida - FL,,03/09/2021,,"Venezuela, Cuba",,2021-03-08
316,3/8/2021 14:47:58,1,Spanish,Florida - FL,,03/09/2021,,Cuba,,2021-03-08
317,3/8/2021 14:55:54,1,Spanish,Florida - FL,,03/09/2021,,Cuba,,2021-03-08
318,3/8/2021 15:01:01,1,Spanish,Utah - UT,,03/09/2021,,Venezuela,,2021-03-08
319,3/8/2021 15:12:21,1,Spanish,Florida - FL,,03/10/2021,,Cuba,,2021-03-08
320,3/8/2021 18:05:00,1,Spanish,,,03/09/2021,,Cuba,,2021-03-08
321,3/8/2021 18:05:00,2,Spanish,Colorado - CO,,03/09/2021,,Cuba,,2021-03-08
321,3/8/2021 18:05:00,2,Spanish,Colorado - CO,,03/09/2021,,Cuba,,2021-03-08
322,3/8/2021 18:05:00,1,Spanish,Florida - FL,,03/09/2021,,Cuba,,2021-03-08
323,3/8/2021 18:05:00,1,Spanish,Kentucky - KY,,03/10/2021,,Cuba,,2021-03-08
324,3/8/2021 18:05:00,1,Spanish,Florida - FL,,03/09/2021,,Cuba,,2021-03-08
325,3/8/2021 18:05:00,1,Spanish,,,03/09/2021,,Cuba,,2021-03-08
326,3/8/2021 18:05:00,1,Spanish,Florida - FL,,03/09/2021,,Cuba,,2021-03-08
327,3/8/2021 18:05:00,1,Spanish,Florida - FL,,03/09/2021,,Cuba,,2021-03-08
328,3/8/2021 18:05:00,3,Punjabi,California - CA,,03/09/2021,,India,,2021-03-08
328,3/8/2021 18:05:00,3,Punjabi,California - CA,,03/09/2021,,India,,2021-03-08
328,3/8/2021 18:05:00,3,Punjabi,California - CA,,03/09/2021,,India,,2021-03-08
329,3/8/2021 18:05:00,1,Spanish,Florida - FL,,03/09/2021,,Cuba,,2021-03-08
330,3/8/2021 18:05:00,2,Spanish,Texas - TX,,03/09/2021,,Cuba,,2021-03-08
330,3/8/2021 18:05:00,2,Spanish,Texas - TX,,03/09/2021,,Cuba,,2021-03-08
331,3/8/2021 18:05:00,3,Portuguese,,,03/09/2021,,Brazil,,2021-03-08
331,3/8/2021 18:05:00,3,Portuguese,,,03/09/2021,,Brazil,,2021-03-08
331,3/8/2021 18:05:00,3,Portuguese,,,03/09/2021,,Brazil,,2021-03-08
332,3/8/2021 18:05:00,4,Spanish,Florida - FL,,03/09/2021,,Cuba,,2021-03-08
332,3/8/2021 18:05:00,4,Spanish,Florida - FL,,03/09/2021,,Cuba,,2021-03-08
332,3/8/2021 18:05:00,4,Spanish,Florida - FL,,03/09/2021,,Cuba,,2021-03-08
332,3/8/2021 18:05:00,4,Spanish,Florida - FL,,03/09/2021,,Cuba,,2021-03-08
333,3/8/2021 18:05:00,2,Spanish,Nevada - NV,,03/09/2021,,Cuba,,2021-03-08
333,3/8/2021 18:05:00,2,Spanish,Nevada - NV,,03/09/2021,,Cuba,,2021-03-08
334,3/8/2021 18:05:00,3,Spanish,Florida - FL,,03/09/2021,,Cuba,,2021-03-08
334,3/8/2021 18:05:00,3,Spanish,Florida - FL,,03/09/2021,,Cuba,,2021-03-08
334,3/8/2021 18:05:00,3,Spanish,Florida - FL,,03/09/2021,,Cuba,,2021-03-08
335,3/8/2021 18:05:00,2,Spanish,,,03/10/2021,,Cuba,,2021-03-08
335,3/8/2021 18:05:00,2,Spanish,,,03/10/2021,,Cuba,,2021-03-08
336,3/8/2021 18:05:00,3,Spanish,New York - NY,,03/09/2021,,Ecuador,,2021-03-08
336,3/8/2021 18:05:00,3,Spanish,New York - NY,,03/09/2021,,Ecuador,,2021-03-08
336,3/8/2021 18:05:00,3,Spanish,New York - NY,,03/09/2021,,Ecuador,,2021-03-08
337,3/8/2021 18:05:00,3,Portuguese,Florida - FL,,03/09/2021,,Brazil,,2021-03-08
337,3/8/2021 18:05:00,3,Portuguese,Florida - FL,,03/09/2021,,Brazil,,2021-03-08
337,3/8/2021 18:05:00,3,Portuguese,Florida - FL,,03/09/2021,,Brazil,,2021-03-08
338,3/8/2021 18:05:00,3,Portuguese,,,03/09/2021,,Brazil,,2021-03-08
338,3/8/2021 18:05:00,3,Portuguese,,,03/09/2021,,Brazil,,2021-03-08
338,3/8/2021 18:05:00,3,Portuguese,,,03/09/2021,,Brazil,,2021-03-08
339,3/8/2021 18:05:00,3,Spanish,Vermont - VT,,03/10/2021,,Cuba,,2021-03-08
339,3/8/2021 18:05:00,3,Spanish,Vermont - VT,,03/10/2021,,Cuba,,2021-03-08
339,3/8/2021 18:05:00,3,Spanish,Vermont - VT,,03/10/2021,,Cuba,,2021-03-08
340,3/8/2021 18:05:00,2,Spanish,Texas - TX,,03/09/2021,,Venezuela,,2021-03-08
340,3/8/2021 18:05:00,2,Spanish,Texas - TX,,03/09/2021,,Venezuela,,2021-03-08
341,3/8/2021 18:05:00,3,Spanish,Florida - FL,,03/09/2021,,Cuba,,2021-03-08
341,3/8/2021 18:05:00,3,Spanish,Florida - FL,,03/09/2021,,Cuba,,2021-03-08
341,3/8/2021 18:05:00,3,Spanish,Florida - FL,,03/09/2021,,Cuba,,2021-03-08
342,3/8/2021 18:05:00,3,French,Florida - FL,,03/09/2021,,Haiti,,2021-03-08
342,3/8/2021 18:05:00,3,French,Florida - FL,,03/09/2021,,Haiti,,2021-03-08
342,3/8/2021 18:05:00,3,French,Florida - FL,,03/09/2021,,Haiti,,2021-03-08
343,3/8/2021 18:05:00,3,Spanish,Florida - FL,,03/09/2021,,Cuba/Honduras/Mexico,,2021-03-08
343,3/8/2021 18:05:00,3,Spanish,Florida - FL,,03/09/2021,,Cuba/Honduras/Mexico,,2021-03-08
343,3/8/2021 18:05:00,3,Spanish,Florida - FL,,03/09/2021,,Cuba/Honduras/Mexico,,2021-03-08
344,3/8/2021 18:05:00,1,Spanish,Texas - TX,,03/10/2021,,Cuba,,2021-03-08
345,3/8/2021 18:05:00,3,,Massachusetts - MA,,03/09/2021,,Guatemala,,2021-03-08
345,3/8/2021 18:05:00,3,,Massachusetts - MA,,03/09/2021,,Guatemala,,2021-03-08
345,3/8/2021 18:05:00,3,,Massachusetts - MA,,03/09/2021,,Guatemala,,2021-03-08
346,3/8/2021 18:05:00,4,Romanian,,,03/09/2021,,Romania,,2021-03-08
346,3/8/2021 18:05:00,4,Romanian,,,03/09/2021,,Romania,,2021-03-08
346,3/8/2021 18:05:00,4,Romanian,,,03/09/2021,,Romania,,2021-03-08
346,3/8/2021 18:05:00,4,Romanian,,,03/09/2021,,Romania,,2021-03-08
347,3/9/2021 10:44:02,1,Spanish,Oklahoma - OK,,03/09/2021,,Venezuela,,2021-03-09
348,3/9/2021 10:45:46,3,Spanish,New York - NY,,03/10/2021,,Ecuador,,2021-03-09
348,3/9/2021 10:45:46,3,Spanish,New York - NY,,03/10/2021,,Ecuador,,2021-03-09
348,3/9/2021 10:45:46,3,Spanish,New York - NY,,03/10/2021,,Ecuador,,2021-03-09
349,3/9/2021 10:49:17,2,Spanish,Georgia - GA,,03/10/2021,,Venezuela,,2021-03-09
349,3/9/2021 10:49:17,2,Spanish,Georgia - GA,,03/10/2021,,Venezuela,,2021-03-09
350,3/9/2021 10:53:41,1,Spanish,Virginia - VA,,03/10/2021,,Guatemala,,2021-03-09
351,3/9/2021 10:56:51,1,Spanish,Florida - FL,,03/10/2021,,Cuba,,2021-03-09
352,3/9/2021 10:58:56,4,Spanish,Minnesota - MN,,03/10/2021,,Ecuador,,2021-03-09
352,3/9/2021 10:58:56,4,Spanish,Minnesota - MN,,03/10/2021,,Ecuador,,2021-03-09
352,3/9/2021 10:58:56,4,Spanish,Minnesota - MN,,03/10/2021,,Ecuador,,2021-03-09
352,3/9/2021 10:58:56,4,Spanish,Minnesota - MN,,03/10/2021,,Ecuador,,2021-03-09
353,3/9/2021 11:04:20,2,Spanish,Arizona - AZ,,03/09/2021,,Cuba,,2021-03-09
353,3/9/2021 11:04:20,2,Spanish,Arizona - AZ,,03/09/2021,,Cuba,,2021-03-09
354,3/9/2021 16:35:31,3,Spanish,Ohio - OH,,03/09/2021,,Venezuela,,2021-03-09
354,3/9/2021 16:35:31,3,Spanish,Ohio - OH,,03/09/2021,,Venezuela,,2021-03-09
354,3/9/2021 16:35:31,3,Spanish,Ohio - OH,,03/09/2021,,Venezuela,,2021-03-09
355,3/10/2021 11:02:00,1,Spanish,Kentucky - KY,,03/10/2021,,Guatemala,,2021-03-10
356,3/10/2021 11:12:15,4,Spanish,Florida - FL,,03/11/2021,,Cuba,,2021-03-10
356,3/10/2021 11:12:15,4,Spanish,Florida - FL,,03/11/2021,,Cuba,,2021-03-10
356,3/10/2021 11:12:15,4,Spanish,Florida - FL,,03/11/2021,,Cuba,,2021-03-10
356,3/10/2021 11:12:15,4,Spanish,Florida - FL,,03/11/2021,,Cuba,,2021-03-10
357,3/10/2021 11:12:59,2,Spanish,Texas - TX,,03/11/2021,,Venezuela,,2021-03-10
357,3/10/2021 11:12:59,2,Spanish,Texas - TX,,03/11/2021,,Venezuela,,2021-03-10
358,3/10/2021 11:14:20,3,Kichwa,New York - NY,,03/11/2021,,Ecuador,,2021-03-10
358,3/10/2021 11:14:20,3,Kichwa,New York - NY,,03/11/2021,,Ecuador,,2021-03-10
358,3/10/2021 11:14:20,3,Kichwa,New York - NY,,03/11/2021,,Ecuador,,2021-03-10
359,3/10/2021 11:21:13,3,Spanish,Florida - FL,,03/11/2021,,Cuba,,2021-03-10
359,3/10/2021 11:21:13,3,Spanish,Florida - FL,,03/11/2021,,Cuba,,2021-03-10
359,3/10/2021 11:21:13,3,Spanish,Florida - FL,,03/11/2021,,Cuba,,2021-03-10
360,3/10/2021 11:23:40,3,Kichwa,New York - NY,,03/13/2021,,Ecuador,,2021-03-10
360,3/10/2021 11:23:40,3,Kichwa,New York - NY,,03/13/2021,,Ecuador,,2021-03-10
360,3/10/2021 11:23:40,3,Kichwa,New York - NY,,03/13/2021,,Ecuador,,2021-03-10
361,3/10/2021 11:25:41,3,Spanish,Georgia - GA,,03/11/2021,,Venezuela,,2021-03-10
361,3/10/2021 11:25:41,3,Spanish,Georgia - GA,,03/11/2021,,Venezuela,,2021-03-10
361,3/10/2021 11:25:41,3,Spanish,Georgia - GA,,03/11/2021,,Venezuela,,2021-03-10
362,3/10/2021 11:33:01,2,Spanish,Texas - TX,,03/11/2021,,Venezuela,,2021-03-10
362,3/10/2021 11:33:01,2,Spanish,Texas - TX,,03/11/2021,,Venezuela,,2021-03-10
363,3/10/2021 11:35:18,3,Spanish,Florida - FL,,03/11/2021,,Cuba,,2021-03-10
363,3/10/2021 11:35:18,3,Spanish,Florida - FL,,03/11/2021,,Cuba,,2021-03-10
363,3/10/2021 11:35:18,3,Spanish,Florida - FL,,03/11/2021,,Cuba,,2021-03-10
364,3/10/2021 11:35:47,2,Mam,North Carolina - NC,,03/11/2021,,Guatemala,,2021-03-10
364,3/10/2021 11:35:47,2,Mam,North Carolina - NC,,03/11/2021,,Guatemala,,2021-03-10
365,3/10/2021 11:45:08,1,Spanish,Florida - FL,,03/11/2021,,Cuba,,2021-03-10
366,3/10/2021 11:47:26,3,Spanish,Florida - FL,,03/11/2021,,Venezuela,,2021-03-10
366,3/10/2021 11:47:26,3,Spanish,Florida - FL,,03/11/2021,,Venezuela,,2021-03-10
366,3/10/2021 11:47:26,3,Spanish,Florida - FL,,03/11/2021,,Venezuela,,2021-03-10
367,3/10/2021 12:02:19,3,Spanish,Texas - TX,,03/10/2021,,Venezuela,,2021-03-10
367,3/10/2021 12:02:19,3,Spanish,Texas - TX,,03/10/2021,,Venezuela,,2021-03-10
367,3/10/2021 12:02:19,3,Spanish,Texas - TX,,03/10/2021,,Venezuela,,2021-03-10
368,3/10/2021 12:08:01,2,Spanish,California - CA,,03/11/2021,,Venezuela,,2021-03-10
368,3/10/2021 12:08:01,2,Spanish,California - CA,,03/11/2021,,Venezuela,,2021-03-10
369,3/10/2021 17:45:00,5,Spanish,,,03/11/2021,,Cuba,,2021-03-10
369,3/10/2021 17:45:00,5,Spanish,,,03/11/2021,,Cuba,,2021-03-10
369,3/10/2021 17:45:00,5,Spanish,,,03/11/2021,,Cuba,,2021-03-10
369,3/10/2021 17:45:00,5,Spanish,,,03/11/2021,,Cuba,,2021-03-10
369,3/10/2021 17:45:00,5,Spanish,,,03/11/2021,,Cuba,,2021-03-10
370,3/10/2021 17:45:00,1,Spanish,,,03/11/2021,,Cuba,,2021-03-10
371,3/10/2021 17:45:00,1,Spanish,,,03/11/2021,,Cuba,,2021-03-10
372,3/10/2021 17:45:00,1,Spanish,,,03/11/2021,,Cuba,,2021-03-10
373,3/10/2021 17:45:00,1,Spanish,,,03/11/2021,,Cuba,,2021-03-10
374,3/10/2021 17:45:00,1,Spanish,,,03/11/2021,,Cuba,,2021-03-10
375,3/10/2021 17:45:00,1,Spanish,,,03/11/2021,,Cuba,,2021-03-10
376,3/10/2021 17:45:00,1,Spanish,,,03/11/2021,,Cuba,,2021-03-10
377,3/10/2021 17:45:00,6,Kichwa,,,03/11/2021,,Ecuador,,2021-03-10
377,3/10/2021 17:45:00,6,Kichwa,,,03/11/2021,,Ecuador,,2021-03-10
377,3/10/2021 17:45:00,6,Kichwa,,,03/11/2021,,Ecuador,,2021-03-10
377,3/10/2021 17:45:00,6,Kichwa,,,03/11/2021,,Ecuador,,2021-03-10
377,3/10/2021 17:45:00,6,Kichwa,,,03/11/2021,,Ecuador,,2021-03-10
377,3/10/2021 17:45:00,6,Kichwa,,,03/11/2021,,Ecuador,,2021-03-10
378,3/10/2021 17:45:00,1,Spanish,,,03/11/2021,,Cuba,,2021-03-10
379,3/10/2021 17:45:00,1,Spanish,,,03/13/2021,,Cuba,,2021-03-10
380,3/10/2021 17:45:00,1,Spanish,,,03/11/2021,,Cuba,,2021-03-10
381,3/10/2021 17:45:00,1,Spanish,,,03/11/2021,,Cuba,,2021-03-10
382,3/10/2021 17:45:00,1,Spanish,,,03/16/2021,,Cuba,,2021-03-10
383,3/10/2021 17:45:00,1,Spanish,,,03/11/2021,,Cuba,,2021-03-10
384,3/10/2021 17:45:00,1,Spanish,,,03/10/2021,,Cuba,,2021-03-10
385,3/10/2021 17:45:00,1,Spanish,,,03/11/2021,,Cuba,,2021-03-10
386,3/10/2021 17:45:00,1,Spanish,,,03/14/2021,,Nicaragua,,2021-03-10
387,3/11/2021 9:09:58,1,Spanish,Florida - FL,,03/11/2021,,Cuba,,2021-03-11
388,3/11/2021 14:38:44,3,Spanish,Wisconsin - WI,,03/12/2021,,"Venezuela, Colombia",,2021-03-11
388,3/11/2021 14:38:44,3,Spanish,Wisconsin - WI,,03/12/2021,,"Venezuela, Colombia",,2021-03-11
388,3/11/2021 14:38:44,3,Spanish,Wisconsin - WI,,03/12/2021,,"Venezuela, Colombia",,2021-03-11
389,3/11/2021 14:42:40,3,Spanish,Oklahoma - OK,,03/12/2021,,Venezuela,,2021-03-11
389,3/11/2021 14:42:40,3,Spanish,Oklahoma - OK,,03/12/2021,,Venezuela,,2021-03-11
389,3/11/2021 14:42:40,3,Spanish,Oklahoma - OK,,03/12/2021,,Venezuela,,2021-03-11
390,3/11/2021 14:47:47,3,Spanish,Florida - FL,,03/12/2021,,Venezuela,,2021-03-11
390,3/11/2021 14:47:47,3,Spanish,Florida - FL,,03/12/2021,,Venezuela,,2021-03-11
390,3/11/2021 14:47:47,3,Spanish,Florida - FL,,03/12/2021,,Venezuela,,2021-03-11
391,3/11/2021 14:55:55,2,Spanish,Texas - TX,,03/12/2021,,Venezuela,,2021-03-11
391,3/11/2021 14:55:55,2,Spanish,Texas - TX,,03/12/2021,,Venezuela,,2021-03-11
392,3/11/2021 15:04:18,3,Spanish,Florida - FL,,03/12/2021,,Venezuela,,2021-03-11
392,3/11/2021 15:04:18,3,Spanish,Florida - FL,,03/12/2021,,Venezuela,,2021-03-11
392,3/11/2021 15:04:18,3,Spanish,Florida - FL,,03/12/2021,,Venezuela,,2021-03-11
393,3/12/2021 9:59:08,4,Spanish,Virginia - VA,,03/14/2021,,Mexico,,2021-03-12
393,3/12/2021 9:59:08,4,Spanish,Virginia - VA,,03/14/2021,,Mexico,,2021-03-12
393,3/12/2021 9:59:08,4,Spanish,Virginia - VA,,03/14/2021,,Mexico,,2021-03-12
393,3/12/2021 9:59:08,4,Spanish,Virginia - VA,,03/14/2021,,Mexico,,2021-03-12
394,3/12/2021 10:00:17,4,Spanish,Florida - FL,,03/15/2021,,Venezuela,,2021-03-12
394,3/12/2021 10:00:17,4,Spanish,Florida - FL,,03/15/2021,,Venezuela,,2021-03-12
394,3/12/2021 10:00:17,4,Spanish,Florida - FL,,03/15/2021,,Venezuela,,2021-03-12
394,3/12/2021 10:00:17,4,Spanish,Florida - FL,,03/15/2021,,Venezuela,,2021-03-12
395,3/12/2021 10:07:24,2,Spanish,California - CA,,03/12/2021,,Venezuela,,2021-03-12
395,3/12/2021 10:07:24,2,Spanish,California - CA,,03/12/2021,,Venezuela,,2021-03-12
396,3/12/2021 10:08:37,2,Spanish,Florida - FL,,03/13/2021,,Cuba,,2021-03-12
396,3/12/2021 10:08:37,2,Spanish,Florida - FL,,03/13/2021,,Cuba,,2021-03-12
397,3/12/2021 12:33:39,3,Spanish,Texas - TX,,03/12/2021,,Venezuela,,2021-03-12
397,3/12/2021 12:33:39,3,Spanish,Texas - TX,,03/12/2021,,Venezuela,,2021-03-12
397,3/12/2021 12:33:39,3,Spanish,Texas - TX,,03/12/2021,,Venezuela,,2021-03-12
398,3/12/2021 12:40:42,1,Spanish,Tennessee - TN,,03/13/2021,,Venezuela,,2021-03-12
399,3/12/2021 12:56:06,1,Spanish,Kentucky - KY,,03/13/2021,,Venezuela,,2021-03-12
400,3/12/2021 13:01:45,1,Spanish,Virginia - VA,,03/12/2021,,Venezuela,,2021-03-12
401,3/12/2021 13:07:06,1,Spanish,Georgia - GA,,03/13/2021,,Venezuela,,2021-03-12
402,3/12/2021 13:14:57,1,Spanish,Texas - TX,,03/13/2021,,Venezuela,,2021-03-12
403,3/12/2021 13:18:24,2,Spanish,Texas - TX,,03/12/2021,,Cuba,,2021-03-12
403,3/12/2021 13:18:24,2,Spanish,Texas - TX,,03/12/2021,,Cuba,,2021-03-12
404,3/12/2021 14:36:00,3,Portuguese,Massachusetts - MA,,03/13/2021,,Brazil,,2021-03-12
404,3/12/2021 14:36:00,3,Portuguese,Massachusetts - MA,,03/13/2021,,Brazil,,2021-03-12
404,3/12/2021 14:36:00,3,Portuguese,Massachusetts - MA,,03/13/2021,,Brazil,,2021-03-12
405,3/12/2021 14:36:00,4,Portuguese,Pennsylvania - PA,,03/13/2021,,Brazil,,2021-03-12
405,3/12/2021 14:36:00,4,Portuguese,Pennsylvania - PA,,03/13/2021,,Brazil,,2021-03-12
405,3/12/2021 14:36:00,4,Portuguese,Pennsylvania - PA,,03/13/2021,,Brazil,,2021-03-12
405,3/12/2021 14:36:00,4,Portuguese,Pennsylvania - PA,,03/13/2021,,Brazil,,2021-03-12
406,3/12/2021 14:36:00,3,Spanish,Texas - TX,,03/13/2021,,Cuba,,2021-03-12
406,3/12/2021 14:36:00,3,Spanish,Texas - TX,,03/13/2021,,Cuba,,2021-03-12
406,3/12/2021 14:36:00,3,Spanish,Texas - TX,,03/13/2021,,Cuba,,2021-03-12
407,3/12/2021 14:36:00,1,Spanish,Florida - FL,,03/13/2021,,Cuba,,2021-03-12
408,3/12/2021 14:36:00,5,Romanian,Nebraska - NE,,03/13/2021,,Romania,,2021-03-12
408,3/12/2021 14:36:00,5,Romanian,Nebraska - NE,,03/13/2021,,Romania,,2021-03-12
408,3/12/2021 14:36:00,5,Romanian,Nebraska - NE,,03/13/2021,,Romania,,2021-03-12
408,3/12/2021 14:36:00,5,Romanian,Nebraska - NE,,03/13/2021,,Romania,,2021-03-12
408,3/12/2021 14:36:00,5,Romanian,Nebraska - NE,,03/13/2021,,Romania,,2021-03-12
409,3/12/2021 14:36:00,1,Spanish,Florida - FL,,03/13/2021,,Cuba,,2021-03-12
410,3/12/2021 14:36:00,1,Spanish,Florida - FL,,03/13/2021,,Cuba,,2021-03-12
411,3/12/2021 14:36:00,1,Spanish,Florida - FL,,03/13/2021,,Cuba,,2021-03-12
412,3/12/2021 14:36:00,1,Spanish,Florida - FL,,03/13/2021,,Cuba,,2021-03-12
413,3/12/2021 14:36:00,1,Spanish,Texas - TX,,03/16/2021,,Cuba,,2021-03-12
414,3/12/2021 14:36:00,2,Spanish,Kentucky - KY,,03/13/2021,,Cuba,,2021-03-12
414,3/12/2021 14:36:00,2,Spanish,Kentucky - KY,,03/13/2021,,Cuba,,2021-03-12
415,3/12/2021 14:36:00,4,Spanish,Florida - FL,,03/15/2021,,Cuba,,2021-03-12
415,3/12/2021 14:36:00,4,Spanish,Florida - FL,,03/15/2021,,Cuba,,2021-03-12
415,3/12/2021 14:36:00,4,Spanish,Florida - FL,,03/15/2021,,Cuba,,2021-03-12
415,3/12/2021 14:36:00,4,Spanish,Florida - FL,,03/15/2021,,Cuba,,2021-03-12
416,3/12/2021 14:36:00,1,Spanish,Kentucky - KY,,03/13/2021,,Cuba,,2021-03-12
417,3/12/2021 14:36:00,1,Spanish,Florida - FL,,03/13/2021,,Cuba,,2021-03-12
418,3/12/2021 14:36:00,6,Romanian,,,03/13/2021,,Romania,,2021-03-12
418,3/12/2021 14:36:00,6,Romanian,,,03/13/2021,,Romania,,2021-03-12
418,3/12/2021 14:36:00,6,Romanian,,,03/13/2021,,Romania,,2021-03-12
418,3/12/2021 14:36:00,6,Romanian,,,03/13/2021,,Romania,,2021-03-12
418,3/12/2021 14:36:00,6,Romanian,,,03/13/2021,,Romania,,2021-03-12
418,3/12/2021 14:36:00,6,Romanian,,,03/13/2021,,Romania,,2021-03-12
419,3/13/2021 13:26:10,2,Spanish,Virginia - VA,,03/15/2021,,Venezuela,,2021-03-13
419,3/13/2021 13:26:10,2,Spanish,Virginia - VA,,03/15/2021,,Venezuela,,2021-03-13
420,3/13/2021 13:39:47,4,Spanish,Oklahoma - OK,,03/14/2021,,Venezuela,,2021-03-13
420,3/13/2021 13:39:47,4,Spanish,Oklahoma - OK,,03/14/2021,,Venezuela,,2021-03-13
420,3/13/2021 13:39:47,4,Spanish,Oklahoma - OK,,03/14/2021,,Venezuela,,2021-03-13
420,3/13/2021 13:39:47,4,Spanish,Oklahoma - OK,,03/14/2021,,Venezuela,,2021-03-13
421,3/13/2021 14:19:23,2,Spanish,Texas - TX,,03/14/2021,,Venezuela,,2021-03-13
421,3/13/2021 14:19:23,2,Spanish,Texas - TX,,03/14/2021,,Venezuela,,2021-03-13
422,3/13/2021 14:31:46,2,Spanish,Florida - FL,,03/14/2021,,Venezuela,,2021-03-13
422,3/13/2021 14:31:46,2,Spanish,Florida - FL,,03/14/2021,,Venezuela,,2021-03-13
423,3/13/2021 14:53:51,1,Spanish,Georgia - GA,,03/14/2021,,Venezuela,,2021-03-13
424,3/13/2021 15:14:31,1,Spanish,Arizona - AZ,,03/17/2021,,Mexico,,2021-03-13
425,3/14/2021 14:34:20,1,Spanish,Texas - TX,,03/15/2021,,Cuba,,2021-03-14
426,3/14/2021 14:40:28,1,Spanish,Florida - FL,,03/15/2021,,Cuba,,2021-03-14
427,3/14/2021 14:41:28,1,Spanish,Florida - FL,,03/15/2021,,Venezuela,,2021-03-14
428,3/14/2021 14:41:47,1,Spanish,Florida - FL,,03/14/2021,,Cuba,,2021-03-14
429,3/14/2021 14:48:37,1,Spanish,Tennessee - TN,,03/15/2021,,Guatemala,,2021-03-14
430,3/14/2021 15:01:35,4,Spanish,Florida - FL,,03/14/2021,,Venezuela,,2021-03-14
430,3/14/2021 15:01:35,4,Spanish,Florida - FL,,03/14/2021,,Venezuela,,2021-03-14
430,3/14/2021 15:01:35,4,Spanish,Florida - FL,,03/14/2021,,Venezuela,,2021-03-14
430,3/14/2021 15:01:35,4,Spanish,Florida - FL,,03/14/2021,,Venezuela,,2021-03-14
431,3/14/2021 15:03:08,2,Spanish,Florida - FL,,03/15/2021,,Cuba,,2021-03-14
431,3/14/2021 15:03:08,2,Spanish,Florida - FL,,03/15/2021,,Cuba,,2021-03-14
432,3/14/2021 15:03:58,1,Spanish,Oklahoma - OK,,03/15/2021,,Venezuela,,2021-03-14
433,3/14/2021 15:11:28,4,Spanish,Florida - FL,,03/16/2021,,Venezuela,,2021-03-14
433,3/14/2021 15:11:28,4,Spanish,Florida - FL,,03/16/2021,,Venezuela,,2021-03-14
433,3/14/2021 15:11:28,4,Spanish,Florida - FL,,03/16/2021,,Venezuela,,2021-03-14
433,3/14/2021 15:11:28,4,Spanish,Florida - FL,,03/16/2021,,Venezuela,,2021-03-14
434,3/14/2021 15:13:33,1,Spanish,Virginia - VA,,03/15/2021,,Venezuela,,2021-03-14
435,3/14/2021 15:23:46,4,Spanish,Florida - FL,,03/14/2021,,Venezuela,,2021-03-14
435,3/14/2021 15:23:46,4,Spanish,Florida - FL,,03/14/2021,,Venezuela,,2021-03-14
435,3/14/2021 15:23:46,4,Spanish,Florida - FL,,03/14/2021,,Venezuela,,2021-03-14
435,3/14/2021 15:23:46,4,Spanish,Florida - FL,,03/14/2021,,Venezuela,,2021-03-14
436,3/14/2021 17:21:00,3,Spanish,Indiana - IN,,03/15/2021,,,,2021-03-14
436,3/14/2021 17:21:00,3,Spanish,Indiana - IN,,03/15/2021,,,,2021-03-14
436,3/14/2021 17:21:00,3,Spanish,Indiana - IN,,03/15/2021,,,,2021-03-14
437,3/14/2021 17:21:00,3,Portuguese,New Jersey - NJ,,03/14/2021,,,,2021-03-14
437,3/14/2021 17:21:00,3,Portuguese,New Jersey - NJ,,03/14/2021,,,,2021-03-14
437,3/14/2021 17:21:00,3,Portuguese,New Jersey - NJ,,03/14/2021,,,,2021-03-14
438,3/14/2021 17:21:00,3,Portuguese,Massachusetts - MA,,03/15/2021,,Brazil,,2021-03-14
438,3/14/2021 17:21:00,3,Portuguese,Massachusetts - MA,,03/15/2021,,Brazil,,2021-03-14
438,3/14/2021 17:21:00,3,Portuguese,Massachusetts - MA,,03/15/2021,,Brazil,,2021-03-14
439,3/14/2021 17:21:00,4,Spanish,Florida - FL,,03/15/2021,,,,2021-03-14
439,3/14/2021 17:21:00,4,Spanish,Florida - FL,,03/15/2021,,,,2021-03-14
439,3/14/2021 17:21:00,4,Spanish,Florida - FL,,03/15/2021,,,,2021-03-14
439,3/14/2021 17:21:00,4,Spanish,Florida - FL,,03/15/2021,,,,2021-03-14
440,3/14/2021 17:21:00,1,Portuguese,Pennsylvania - PA,,03/14/2021,,Brazil,,2021-03-14
441,3/14/2021 17:21:00,1,Spanish,Florida - FL,,03/16/2021,,,,2021-03-14
442,3/14/2021 17:21:00,4,Spanish,Texas - TX,,03/14/2021,,,,2021-03-14
442,3/14/2021 17:21:00,4,Spanish,Texas - TX,,03/14/2021,,,,2021-03-14
442,3/14/2021 17:21:00,4,Spanish,Texas - TX,,03/14/2021,,,,2021-03-14
442,3/14/2021 17:21:00,4,Spanish,Texas - TX,,03/14/2021,,,,2021-03-14
443,3/14/2021 17:21:00,1,Spanish,Florida - FL,,03/15/2021,,,,2021-03-14
444,3/14/2021 17:21:00,1,Spanish,Florida - FL,,03/15/2021,,,,2021-03-14
445,3/14/2021 17:21:00,4,Romanian,California - CA,,03/14/2021,,Romania,,2021-03-14
445,3/14/2021 17:21:00,4,Romanian,California - CA,,03/14/2021,,Romania,,2021-03-14
445,3/14/2021 17:21:00,4,Romanian,California - CA,,03/14/2021,,Romania,,2021-03-14
445,3/14/2021 17:21:00,4,Romanian,California - CA,,03/14/2021,,Romania,,2021-03-14
446,3/14/2021 17:21:00,3,Portuguese,North Carolina - NC,,03/14/2021,,Brazil,,2021-03-14
446,3/14/2021 17:21:00,3,Portuguese,North Carolina - NC,,03/14/2021,,Brazil,,2021-03-14
446,3/14/2021 17:21:00,3,Portuguese,North Carolina - NC,,03/14/2021,,Brazil,,2021-03-14
447,3/14/2021 17:21:00,2,,New York - NY,Air,03/16/2021,,,,2021-03-14
447,3/14/2021 17:21:00,2,,New York - NY,Air,03/16/2021,,,,2021-03-14
448,3/14/2021 17:21:00,3,Portuguese,Pennsylvania - PA,,03/15/2021,,Brazil,,2021-03-14
448,3/14/2021 17:21:00,3,Portuguese,Pennsylvania - PA,,03/15/2021,,Brazil,,2021-03-14
448,3/14/2021 17:21:00,3,Portuguese,Pennsylvania - PA,,03/15/2021,,Brazil,,2021-03-14
449,3/14/2021 17:21:00,3,Spanish,Florida - FL,,03/15/2021,,,,2021-03-14
449,3/14/2021 17:21:00,3,Spanish,Florida - FL,,03/15/2021,,,,2021-03-14
449,3/14/2021 17:21:00,3,Spanish,Florida - FL,,03/15/2021,,,,2021-03-14
450,3/14/2021 17:21:00,1,Spanish,Florida - FL,Air,03/15/2021,,,,2021-03-14
451,3/14/2021 17:21:00,1,Spanish,Florida - FL,,03/15/2021,,,,2021-03-14
452,3/14/2021 17:21:00,3,Spanish,Texas - TX,Car,03/14/2021,,,,2021-03-14
452,3/14/2021 17:21:00,3,Spanish,Texas - TX,Car,03/14/2021,,,,2021-03-14
452,3/14/2021 17:21:00,3,Spanish,Texas - TX,Car,03/14/2021,,,,2021-03-14
453,3/14/2021 17:21:00,1,,,,03/15/2021,,Cuba,,2021-03-14
454,3/14/2021 17:21:00,1,,,,03/15/2021,,Cuba,,2021-03-14
455,3/14/2021 17:21:00,1,,,,03/15/2021,,Cuba,,2021-03-14
456,3/15/2021 10:13:28,2,Spanish,Texas - TX,Air,03/16/2021,AA,Venezuela,,2021-03-15
456,3/15/2021 10:13:28,2,Spanish,Texas - TX,Air,03/16/2021,AA,Venezuela,,2021-03-15
457,3/15/2021 10:23:56,3,Spanish,Virginia - VA,Air,03/16/2021,AA,Venezuela,,2021-03-15
457,3/15/2021 10:23:56,3,Spanish,Virginia - VA,Air,03/16/2021,AA,Venezuela,,2021-03-15
457,3/15/2021 10:23:56,3,Spanish,Virginia - VA,Air,03/16/2021,AA,Venezuela,,2021-03-15
458,3/15/2021 10:33:05,2,Spanish,Florida - FL,,03/17/2021,,Venezuela,,2021-03-15
458,3/15/2021 10:33:05,2,Spanish,Florida - FL,,03/17/2021,,Venezuela,,2021-03-15
459,3/15/2021 10:46:54,3,Spanish,Florida - FL,Air,03/16/2021,AA,Venezuela,,2021-03-15
459,3/15/2021 10:46:54,3,Spanish,Florida - FL,Air,03/16/2021,AA,Venezuela,,2021-03-15
459,3/15/2021 10:46:54,3,Spanish,Florida - FL,Air,03/16/2021,AA,Venezuela,,2021-03-15
460,3/15/2021 11:04:03,2,Spanish,Florida - FL,Air,03/16/2021,AA,Venezuela,,2021-03-15
460,3/15/2021 11:04:03,2,Spanish,Florida - FL,Air,03/16/2021,AA,Venezuela,,2021-03-15
461,3/15/2021 11:52:17,1,Spanish,New York - NY,Air,03/16/2021,AA,Venezuela,,2021-03-15
462,3/15/2021 11:52:54,4,Spanish,New York - NY,Air,03/16/2021,AA,Ecuador,,2021-03-15
462,3/15/2021 11:52:54,4,Spanish,New York - NY,Air,03/16/2021,AA,Ecuador,,2021-03-15
462,3/15/2021 11:52:54,4,Spanish,New York - NY,Air,03/16/2021,AA,Ecuador,,2021-03-15
462,3/15/2021 11:52:54,4,Spanish,New York - NY,Air,03/16/2021,AA,Ecuador,,2021-03-15
463,3/15/2021 11:58:53,1,Spanish,Texas - TX,Air,03/16/2021,AA,Venezuela,,2021-03-15
464,3/15/2021 11:59:46,1,Spanish,Florida - FL,Air,03/15/2021,Delta,Cuba,,2021-03-15
465,3/15/2021 12:21:40,4,Spanish,Florida - FL,Air,03/16/2021,AA,Venezuela,,2021-03-15
465,3/15/2021 12:21:40,4,Spanish,Florida - FL,Air,03/16/2021,AA,Venezuela,,2021-03-15
465,3/15/2021 12:21:40,4,Spanish,Florida - FL,Air,03/16/2021,AA,Venezuela,,2021-03-15
465,3/15/2021 12:21:40,4,Spanish,Florida - FL,Air,03/16/2021,AA,Venezuela,,2021-03-15
466,3/15/2021 12:35:58,4,Spanish,Arizona - AZ,Air,03/15/2021,,Venezuela,,2021-03-15
466,3/15/2021 12:35:58,4,Spanish,Arizona - AZ,Air,03/15/2021,,Venezuela,,2021-03-15
466,3/15/2021 12:35:58,4,Spanish,Arizona - AZ,Air,03/15/2021,,Venezuela,,2021-03-15
466,3/15/2021 12:35:58,4,Spanish,Arizona - AZ,Air,03/15/2021,,Venezuela,,2021-03-15
467,3/15/2021 12:47:42,2,Spanish,Virginia - VA,,03/17/2021,,Ecuador,,2021-03-15
467,3/15/2021 12:47:42,2,Spanish,Virginia - VA,,03/17/2021,,Ecuador,,2021-03-15
468,3/15/2021 12:56:12,2,Spanish,Illinois - IL,Air,03/17/2021,United,Ecuador,,2021-03-15
468,3/15/2021 12:56:12,2,Spanish,Illinois - IL,Air,03/17/2021,United,Ecuador,,2021-03-15
469,3/15/2021 17:29:35,1,Spanish,New Jersey - NJ,Air,03/17/2021,AA,Venezuela,,2021-03-15
470,3/15/2021 18:13:22,1,Spanish,Texas - TX,Car,03/16/2021,,Venezuela,,2021-03-15
471,3/16/2021 10:48:59,3,Spanish,New Jersey - NJ,Air,03/17/2021,Delta,Ecuador,,2021-03-16
471,3/16/2021 10:48:59,3,Spanish,New Jersey - NJ,Air,03/17/2021,Delta,Ecuador,,2021-03-16
471,3/16/2021 10:48:59,3,Spanish,New Jersey - NJ,Air,03/17/2021,Delta,Ecuador,,2021-03-16
472,3/16/2021 10:54:35,3,Spanish,Florida - FL,,03/17/2021,,Cuba,,2021-03-16
472,3/16/2021 10:54:35,3,Spanish,Florida - FL,,03/17/2021,,Cuba,,2021-03-16
472,3/16/2021 10:54:35,3,Spanish,Florida - FL,,03/17/2021,,Cuba,,2021-03-16
473,3/16/2021 10:59:28,3,Spanish,New York - NY,Air,03/17/2021,United,Ecuador,,2021-03-16
473,3/16/2021 10:59:28,3,Spanish,New York - NY,Air,03/17/2021,United,Ecuador,,2021-03-16
473,3/16/2021 10:59:28,3,Spanish,New York - NY,Air,03/17/2021,United,Ecuador,,2021-03-16
474,3/16/2021 11:08:18,4,Spanish,Indiana - IN,,03/17/2021,,Venezuela,,2021-03-16
474,3/16/2021 11:08:18,4,Spanish,Indiana - IN,,03/17/2021,,Venezuela,,2021-03-16
474,3/16/2021 11:08:18,4,Spanish,Indiana - IN,,03/17/2021,,Venezuela,,2021-03-16
474,3/16/2021 11:08:18,4,Spanish,Indiana - IN,,03/17/2021,,Venezuela,,2021-03-16
475,3/16/2021 13:49:27,4,Spanish,New York - NY,Air,03/19/2021,United,Ecuador,,2021-03-16
475,3/16/2021 13:49:27,4,Spanish,New York - NY,Air,03/19/2021,United,Ecuador,,2021-03-16
475,3/16/2021 13:49:27,4,Spanish,New York - NY,Air,03/19/2021,United,Ecuador,,2021-03-16
475,3/16/2021 13:49:27,4,Spanish,New York - NY,Air,03/19/2021,United,Ecuador,,2021-03-16
476,3/16/2021 13:54:59,2,Spanish,Massachusetts - MA,,03/17/2021,,Ecuador,,2021-03-16
476,3/16/2021 13:54:59,2,Spanish,Massachusetts - MA,,03/17/2021,,Ecuador,,2021-03-16
477,3/16/2021 14:03:36,1,Spanish,Florida - FL,Air,03/17/2021,American,Cuba,,2021-03-16
478,3/16/2021 14:05:56,1,Spanish,Florida - FL,,03/17/2021,,Venezuela,,2021-03-16
479,3/16/2021 14:18:26,1,Spanish,New Jersey - NJ,,03/17/2021,,Venezuela,,2021-03-16
480,3/16/2021 14:28:27,1,Spanish,Pennsylvania - PA,Air,03/17/2021,American,Venezuela,,2021-03-16
481,3/16/2021 15:04:09,1,Spanish,Indiana - IN,,03/17/2021,,Venezuela,,2021-03-16
482,3/16/2021 15:28:00,2,Portuguese,Pennsylvania - PA,,03/17/2021,American,Brazil,,2021-03-16
482,3/16/2021 15:28:00,2,Portuguese,Pennsylvania - PA,,03/17/2021,American,Brazil,,2021-03-16
483,3/16/2021 15:28:00,3,Portuguese,Massachusetts - MA,,03/16/2021,,Brazil,,2021-03-16
483,3/16/2021 15:28:00,3,Portuguese,Massachusetts - MA,,03/16/2021,,Brazil,,2021-03-16
483,3/16/2021 15:28:00,3,Portuguese,Massachusetts - MA,,03/16/2021,,Brazil,,2021-03-16
484,3/16/2021 15:28:00,2,Spanish,Florida - FL,,03/16/2021,,Cuba,,2021-03-16
484,3/16/2021 15:28:00,2,Spanish,Florida - FL,,03/16/2021,,Cuba,,2021-03-16
485,3/16/2021 15:28:00,2,Spanish,Florida - FL,Air,03/17/2021,,,,2021-03-16
485,3/16/2021 15:28:00,2,Spanish,Florida - FL,Air,03/17/2021,,,,2021-03-16
486,3/16/2021 15:28:00,3,Portuguese,Florida - FL,,03/16/2021,,Brazil,,2021-03-16
486,3/16/2021 15:28:00,3,Portuguese,Florida - FL,,03/16/2021,,Brazil,,2021-03-16
486,3/16/2021 15:28:00,3,Portuguese,Florida - FL,,03/16/2021,,Brazil,,2021-03-16
487,3/16/2021 15:28:00,3,Spanish,New York - NY,,03/16/2021,,Ecuador,,2021-03-16
487,3/16/2021 15:28:00,3,Spanish,New York - NY,,03/16/2021,,Ecuador,,2021-03-16
487,3/16/2021 15:28:00,3,Spanish,New York - NY,,03/16/2021,,Ecuador,,2021-03-16
488,3/16/2021 15:28:00,4,Spanish,New Mexico - NM,Car,03/16/2021,,Cuba,,2021-03-16
488,3/16/2021 15:28:00,4,Spanish,New Mexico - NM,Car,03/16/2021,,Cuba,,2021-03-16
488,3/16/2021 15:28:00,4,Spanish,New Mexico - NM,Car,03/16/2021,,Cuba,,2021-03-16
488,3/16/2021 15:28:00,4,Spanish,New Mexico - NM,Car,03/16/2021,,Cuba,,2021-03-16
489,3/16/2021 15:28:00,4,Portuguese,Connecticut - CT,,03/17/2021,,Brazil,,2021-03-16
489,3/16/2021 15:28:00,4,Portuguese,Connecticut - CT,,03/17/2021,,Brazil,,2021-03-16
489,3/16/2021 15:28:00,4,Portuguese,Connecticut - CT,,03/17/2021,,Brazil,,2021-03-16
489,3/16/2021 15:28:00,4,Portuguese,Connecticut - CT,,03/17/2021,,Brazil,,2021-03-16
490,3/16/2021 15:28:00,1,,Texas - TX,Air,03/17/2021,American,,,2021-03-16
491,3/16/2021 15:28:00,2,,Florida - FL,Air,03/17/2021,American,Cuba,,2021-03-16
491,3/16/2021 15:28:00,2,,Florida - FL,Air,03/17/2021,American,Cuba,,2021-03-16
492,3/16/2021 15:28:00,1,Spanish,Texas - TX,,03/16/2021,,Cuba,,2021-03-16
493,3/16/2021 15:28:00,1,Spanish,Nevada - NV,Air,03/17/2021,Southwest,Cuba,,2021-03-16
494,3/16/2021 15:28:00,3,Spanish,Minnesota - MN,,03/16/2021,,,,2021-03-16
494,3/16/2021 15:28:00,3,Spanish,Minnesota - MN,,03/16/2021,,,,2021-03-16
494,3/16/2021 15:28:00,3,Spanish,Minnesota - MN,,03/16/2021,,,,2021-03-16
495,3/16/2021 15:28:00,3,Spanish,Texas - TX,,03/16/2021,,Cuba,,2021-03-16
495,3/16/2021 15:28:00,3,Spanish,Texas - TX,,03/16/2021,,Cuba,,2021-03-16
495,3/16/2021 15:28:00,3,Spanish,Texas - TX,,03/16/2021,,Cuba,,2021-03-16
496,3/16/2021 15:28:00,3,Spanish,Texas - TX,,03/17/2021,,,,2021-03-16
496,3/16/2021 15:28:00,3,Spanish,Texas - TX,,03/17/2021,,,,2021-03-16
496,3/16/2021 15:28:00,3,Spanish,Texas - TX,,03/17/2021,,,,2021-03-16
497,3/16/2021 15:28:00,3,Italian,Nebraska - NE,,03/16/2021,,Romania,,2021-03-16
497,3/16/2021 15:28:00,3,Italian,Nebraska - NE,,03/16/2021,,Romania,,2021-03-16
497,3/16/2021 15:28:00,3,Italian,Nebraska - NE,,03/16/2021,,Romania,,2021-03-16
498,3/17/2021 10:26:33,1,Spanish,Idaho - ID,Air,03/18/2021,Delta,Peru,,2021-03-17
499,3/17/2021 10:41:09,3,Spanish,Indiana - IN,Air,03/17/2021,American,Venezuela,,2021-03-17
499,3/17/2021 10:41:09,3,Spanish,Indiana - IN,Air,03/17/2021,American,Venezuela,,2021-03-17
499,3/17/2021 10:41:09,3,Spanish,Indiana - IN,Air,03/17/2021,American,Venezuela,,2021-03-17
500,3/17/2021 10:47:34,1,Spanish,Florida - FL,Air,03/19/2021,American,Venezuela,,2021-03-17
501,3/17/2021 10:52:51,1,Spanish,South Carolina - SC,Air,03/19/2021,United,Venezuela,,2021-03-17
502,3/17/2021 10:59:01,1,Spanish,Florida - FL,Air,03/18/2021,American,Venezuela,,2021-03-17
503,3/17/2021 13:24:44,1,Ixil,Texas - TX,,03/17/2021,,Guatemala,,2021-03-17
504,3/17/2021 17:41:42,1,Spanish,Florida - FL,Private Vehicle,03/17/2021,,Cuba,,2021-03-17
505,3/17/2021 17:56:32,1,Spanish,Florida - FL,Air,03/18/2021,Sun Country,Cuba,,2021-03-17
506,3/18/2021 11:48:05,4,Spanish,North Carolina - NC,,03/19/2021,,Mexico,,2021-03-18
506,3/18/2021 11:48:05,4,Spanish,North Carolina - NC,,03/19/2021,,Mexico,,2021-03-18
506,3/18/2021 11:48:05,4,Spanish,North Carolina - NC,,03/19/2021,,Mexico,,2021-03-18
506,3/18/2021 11:48:05,4,Spanish,North Carolina - NC,,03/19/2021,,Mexico,,2021-03-18
507,3/18/2021 12:05:36,3,Kichwa,New York - NY,,03/19/2021,,Ecuador,,2021-03-18
507,3/18/2021 12:05:36,3,Kichwa,New York - NY,,03/19/2021,,Ecuador,,2021-03-18
507,3/18/2021 12:05:36,3,Kichwa,New York - NY,,03/19/2021,,Ecuador,,2021-03-18
508,3/18/2021 14:38:00,1,Spanish,Florida - FL,,03/19/2021,,,,2021-03-18
509,3/18/2021 14:38:00,1,Spanish,Florida - FL,Air,03/26/2021,American,,,2021-03-18
510,3/18/2021 14:38:00,1,Spanish,,,03/19/2021,,,,2021-03-18
511,3/18/2021 14:38:00,1,Spanish,Florida - FL,,03/19/2021,,,,2021-03-18
512,3/18/2021 14:38:00,3,Portuguese,Pennsylvania - PA,,03/19/2021,,Brazil,,2021-03-18
512,3/18/2021 14:38:00,3,Portuguese,Pennsylvania - PA,,03/19/2021,,Brazil,,2021-03-18
512,3/18/2021 14:38:00,3,Portuguese,Pennsylvania - PA,,03/19/2021,,Brazil,,2021-03-18
513,3/18/2021 14:38:00,3,Spanish,Florida - FL,,03/19/2021,,,,2021-03-18
513,3/18/2021 14:38:00,3,Spanish,Florida - FL,,03/19/2021,,,,2021-03-18
513,3/18/2021 14:38:00,3,Spanish,Florida - FL,,03/19/2021,,,,2021-03-18
514,3/18/2021 14:38:00,2,Spanish,Arizona - AZ,,03/18/2021,,,,2021-03-18
514,3/18/2021 14:38:00,2,Spanish,Arizona - AZ,,03/18/2021,,,,2021-03-18
515,3/18/2021 14:38:00,5,Portuguese,Massachusetts - MA,,03/19/2021,,Brazil,,2021-03-18
515,3/18/2021 14:38:00,5,Portuguese,Massachusetts - MA,,03/19/2021,,Brazil,,2021-03-18
515,3/18/2021 14:38:00,5,Portuguese,Massachusetts - MA,,03/19/2021,,Brazil,,2021-03-18
515,3/18/2021 14:38:00,5,Portuguese,Massachusetts - MA,,03/19/2021,,Brazil,,2021-03-18
515,3/18/2021 14:38:00,5,Portuguese,Massachusetts - MA,,03/19/2021,,Brazil,,2021-03-18
516,3/18/2021 14:38:00,2,Spanish,Florida - FL,,03/19/2021,,,,2021-03-18
516,3/18/2021 14:38:00,2,Spanish,Florida - FL,,03/19/2021,,,,2021-03-18
517,3/18/2021 14:38:00,4,Spanish,Florida - FL,,03/19/2021,,,,2021-03-18
517,3/18/2021 14:38:00,4,Spanish,Florida - FL,,03/19/2021,,,,2021-03-18
517,3/18/2021 14:38:00,4,Spanish,Florida - FL,,03/19/2021,,,,2021-03-18
517,3/18/2021 14:38:00,4,Spanish,Florida - FL,,03/19/2021,,,,2021-03-18
518,3/19/2021 13:04:00,3,Spanish,Florida - FL,,03/19/2021,,,,2021-03-19
518,3/19/2021 13:04:00,3,Spanish,Florida - FL,,03/19/2021,,,,2021-03-19
518,3/19/2021 13:04:00,3,Spanish,Florida - FL,,03/19/2021,,,,2021-03-19
519,3/19/2021 13:04:00,2,Spanish,Texas - TX,,03/20/2021,,,,2021-03-19
519,3/19/2021 13:04:00,2,Spanish,Texas - TX,,03/20/2021,,,,2021-03-19
520,3/19/2021 13:04:00,2,Spanish,Texas - TX,,03/20/2021,,,,2021-03-19
520,3/19/2021 13:04:00,2,Spanish,Texas - TX,,03/20/2021,,,,2021-03-19
521,3/19/2021 13:04:00,2,Spanish,Texas - TX,Air,03/20/2021,American,,,2021-03-19
521,3/19/2021 13:04:00,2,Spanish,Texas - TX,Air,03/20/2021,American,,,2021-03-19
522,3/19/2021 13:04:00,3,Spanish,Texas - TX,,03/19/2021,,,,2021-03-19
522,3/19/2021 13:04:00,3,Spanish,Texas - TX,,03/19/2021,,,,2021-03-19
522,3/19/2021 13:04:00,3,Spanish,Texas - TX,,03/19/2021,,,,2021-03-19
523,3/19/2021 13:04:00,4,Spanish,"Boston, Massachusetts",,03/19/2021,,,,2021-03-19
523,3/19/2021 13:04:00,4,Spanish,"Boston, Massachusetts",,03/19/2021,,,,2021-03-19
523,3/19/2021 13:04:00,4,Spanish,"Boston, Massachusetts",,03/19/2021,,,,2021-03-19
523,3/19/2021 13:04:00,4,Spanish,"Boston, Massachusetts",,03/19/2021,,,,2021-03-19
524,3/19/2021 13:04:00,2,Kichwa,,Air,03/20/2021,United,Ecuador,,2021-03-19
524,3/19/2021 13:04:00,2,Kichwa,,Air,03/20/2021,United,Ecuador,,2021-03-19
525,3/19/2021 13:04:00,2,Spanish,,,03/19/2021,,Venezuela,,2021-03-19
525,3/19/2021 13:04:00,2,Spanish,,,03/19/2021,,Venezuela,,2021-03-19
526,3/19/2021 18:48:00,4,Spanish,"Hialeah, FL",,03/20/2021,,Cuba,,2021-03-19
526,3/19/2021 18:48:00,4,Spanish,"Hialeah, FL",,03/20/2021,,Cuba,,2021-03-19
526,3/19/2021 18:48:00,4,Spanish,"Hialeah, FL",,03/20/2021,,Cuba,,2021-03-19
526,3/19/2021 18:48:00,4,Spanish,"Hialeah, FL",,03/20/2021,,Cuba,,2021-03-19
527,3/19/2021 18:48:00,3,,New York - NY,Air,03/22/2021,American,Ecuador,,2021-03-19
527,3/19/2021 18:48:00,3,,New York - NY,Air,03/22/2021,American,Ecuador,,2021-03-19
527,3/19/2021 18:48:00,3,,New York - NY,Air,03/22/2021,American,Ecuador,,2021-03-19
528,3/19/2021 18:48:00,2,Spanish,"Homestead, FL",,03/19/2021,,Cuba,,2021-03-19
528,3/19/2021 18:48:00,2,Spanish,"Homestead, FL",,03/19/2021,,Cuba,,2021-03-19
529,3/19/2021 18:48:00,4,Spanish,"Kissimmee, FL",Air,03/25/2021,Frontier,Cuba,,2021-03-19
529,3/19/2021 18:48:00,4,Spanish,"Kissimmee, FL",Air,03/25/2021,Frontier,Cuba,,2021-03-19
529,3/19/2021 18:48:00,4,Spanish,"Kissimmee, FL",Air,03/25/2021,Frontier,Cuba,,2021-03-19
529,3/19/2021 18:48:00,4,Spanish,"Kissimmee, FL",Air,03/25/2021,Frontier,Cuba,,2021-03-19
530,3/19/2021 18:48:00,2,English,"Harriman, NY",Air,03/20/2021,American,Brazil,,2021-03-19
530,3/19/2021 18:48:00,2,English,"Harriman, NY",Air,03/20/2021,American,Brazil,,2021-03-19
531,3/19/2021 18:48:00,1,Spanish,"Miami, Fl",,03/19/2021,,Cuba,,2021-03-19
532,3/19/2021 18:48:00,3,Portuguese,"Boston, MA",,03/19/2021,,Brazil,,2021-03-19
532,3/19/2021 18:48:00,3,Portuguese,"Boston, MA",,03/19/2021,,Brazil,,2021-03-19
532,3/19/2021 18:48:00,3,Portuguese,"Boston, MA",,03/19/2021,,Brazil,,2021-03-19
533,3/19/2021 18:48:00,1,Spanish,"Detroit, MI",,03/27/2021,,Cuba,,2021-03-19
534,3/19/2021 18:48:00,4,Portuguese,"Westborough, MA",,03/19/2021,,Brazil,,2021-03-19
534,3/19/2021 18:48:00,4,Portuguese,"Westborough, MA",,03/19/2021,,Brazil,,2021-03-19
534,3/19/2021 18:48:00,4,Portuguese,"Westborough, MA",,03/19/2021,,Brazil,,2021-03-19
534,3/19/2021 18:48:00,4,Portuguese,"Westborough, MA",,03/19/2021,,Brazil,,2021-03-19
535,3/19/2021 18:48:00,1,Spanish,"Palm Springs, FL",Air,03/20/2021,American,Cuba,,2021-03-19
536,3/19/2021 18:48:00,2,Portuguese,"Danbury, CT",Air,03/19/2021,,Brazil,,2021-03-19
536,3/19/2021 18:48:00,2,Portuguese,"Danbury, CT",Air,03/19/2021,,Brazil,,2021-03-19
537,3/19/2021 18:48:00,2,Creole,Pennsylvania - PA,Air,03/22/2021,American,Haiti,,2021-03-19
537,3/19/2021 18:48:00,2,Creole,Pennsylvania - PA,Air,03/22/2021,American,Haiti,,2021-03-19
538,3/19/2021 18:48:00,3,Portuguese,Massachusetts - MA,,03/19/2021,,Brazil,,2021-03-19
538,3/19/2021 18:48:00,3,Portuguese,Massachusetts - MA,,03/19/2021,,Brazil,,2021-03-19
538,3/19/2021 18:48:00,3,Portuguese,Massachusetts - MA,,03/19/2021,,Brazil,,2021-03-19
539,3/19/2021 18:48:00,3,Portuguese,Florida - FL,,03/19/2021,,Brazil,,2021-03-19
539,3/19/2021 18:48:00,3,Portuguese,Florida - FL,,03/19/2021,,Brazil,,2021-03-19
539,3/19/2021 18:48:00,3,Portuguese,Florida - FL,,03/19/2021,,Brazil,,2021-03-19
540,3/19/2021 18:48:00,4,Spanish,Tennessee - TN,Air,03/19/2021,,Venezuela,,2021-03-19
540,3/19/2021 18:48:00,4,Spanish,Tennessee - TN,Air,03/19/2021,,Venezuela,,2021-03-19
540,3/19/2021 18:48:00,4,Spanish,Tennessee - TN,Air,03/19/2021,,Venezuela,,2021-03-19
540,3/19/2021 18:48:00,4,Spanish,Tennessee - TN,Air,03/19/2021,,Venezuela,,2021-03-19
541,3/19/2021 18:48:00,6,Italian,California - CA,Air,03/20/2021,,Romania,,2021-03-19
541,3/19/2021 18:48:00,6,Italian,California - CA,Air,03/20/2021,,Romania,,2021-03-19
541,3/19/2021 18:48:00,6,Italian,California - CA,Air,03/20/2021,,Romania,,2021-03-19
541,3/19/2021 18:48:00,6,Italian,California - CA,Air,03/20/2021,,Romania,,2021-03-19
541,3/19/2021 18:48:00,6,Italian,California - CA,Air,03/20/2021,,Romania,,2021-03-19
541,3/19/2021 18:48:00,6,Italian,California - CA,Air,03/20/2021,,Romania,,2021-03-19
542,3/19/2021 18:48:00,4,Spanish,Florida - FL,Air,03/21/2021,Sun Country,Cuba,,2021-03-19
542,3/19/2021 18:48:00,4,Spanish,Florida - FL,Air,03/21/2021,Sun Country,Cuba,,2021-03-19
542,3/19/2021 18:48:00,4,Spanish,Florida - FL,Air,03/21/2021,Sun Country,Cuba,,2021-03-19
542,3/19/2021 18:48:00,4,Spanish,Florida - FL,Air,03/21/2021,Sun Country,Cuba,,2021-03-19
543,3/19/2021 18:48:00,3,Spanish,Florida - FL,Air,03/20/2021,United,Cuba,,2021-03-19
543,3/19/2021 18:48:00,3,Spanish,Florida - FL,Air,03/20/2021,United,Cuba,,2021-03-19
543,3/19/2021 18:48:00,3,Spanish,Florida - FL,Air,03/20/2021,United,Cuba,,2021-03-19
544,3/19/2021 18:48:00,3,Punjabi,,Air,03/20/2021,United,India,,2021-03-19
544,3/19/2021 18:48:00,3,Punjabi,,Air,03/20/2021,United,India,,2021-03-19
544,3/19/2021 18:48:00,3,Punjabi,,Air,03/20/2021,United,India,,2021-03-19
545,3/19/2021 18:48:00,3,Spanish,,Air,03/20/2021,American,Cuba,,2021-03-19
545,3/19/2021 18:48:00,3,Spanish,,Air,03/20/2021,American,Cuba,,2021-03-19
545,3/19/2021 18:48:00,3,Spanish,,Air,03/20/2021,American,Cuba,,2021-03-19
546,3/20/2021 14:00:00,4,Spanish,New York - NY,Air,03/22/2021,American,Ecuador,,2021-03-20
546,3/20/2021 14:00:00,4,Spanish,New York - NY,Air,03/22/2021,American,Ecuador,,2021-03-20
546,3/20/2021 14:00:00,4,Spanish,New York - NY,Air,03/22/2021,American,Ecuador,,2021-03-20
546,3/20/2021 14:00:00,4,Spanish,New York - NY,Air,03/22/2021,American,Ecuador,,2021-03-20
547,3/20/2021 14:00:01,2,Spanish,Texas - TX,Air,03/22/2021,American,Venezuela,,2021-03-20
547,3/20/2021 14:00:01,2,Spanish,Texas - TX,Air,03/22/2021,American,Venezuela,,2021-03-20
548,3/20/2021 14:00:02,3,Spanish,Florida - FL,Air,03/21/2021,,Cuba,,2021-03-20
548,3/20/2021 14:00:02,3,Spanish,Florida - FL,Air,03/21/2021,,Cuba,,2021-03-20
548,3/20/2021 14:00:02,3,Spanish,Florida - FL,Air,03/21/2021,,Cuba,,2021-03-20
549,3/20/2021 14:00:03,2,Spanish,Georgia - GA,Air,03/21/2021,American,Venezuela,,2021-03-20
549,3/20/2021 14:00:03,2,Spanish,Georgia - GA,Air,03/21/2021,American,Venezuela,,2021-03-20
550,3/21/2021 11:01:25,2,Spanish,Massachusetts - MA,Air,03/21/2021,American,Nicaragua,,2021-03-21
550,3/21/2021 11:01:25,2,Spanish,Massachusetts - MA,Air,03/21/2021,American,Nicaragua,,2021-03-21
551,3/21/2021 11:12:06,4,Spanish,Texas - TX,Air,03/22/2021,United,Venezuela,,2021-03-21
551,3/21/2021 11:12:06,4,Spanish,Texas - TX,Air,03/22/2021,United,Venezuela,,2021-03-21
551,3/21/2021 11:12:06,4,Spanish,Texas - TX,Air,03/22/2021,United,Venezuela,,2021-03-21
551,3/21/2021 11:12:06,4,Spanish,Texas - TX,Air,03/22/2021,United,Venezuela,,2021-03-21
552,3/21/2021 12:57:28,3,Spanish,Texas - TX,,03/21/2021,,Chile,,2021-03-21
552,3/21/2021 12:57:28,3,Spanish,Texas - TX,,03/21/2021,,Chile,,2021-03-21
552,3/21/2021 12:57:28,3,Spanish,Texas - TX,,03/21/2021,,Chile,,2021-03-21
553,3/22/2021 14:11:54,1,Spanish,Florida - FL,,03/22/2021,,Venezuela,,2021-03-22
554,3/22/2021 14:16:53,1,Spanish,Florida - FL,,03/22/2021,,Venezuela,,2021-03-22
555,3/22/2021 14:20:14,2,Spanish,Florida - FL,,03/22/2021,,Venezuela,,2021-03-22
555,3/22/2021 14:20:14,2,Spanish,Florida - FL,,03/22/2021,,Venezuela,,2021-03-22
556,3/22/2021 14:23:32,3,Spanish,Florida - FL,,03/22/2021,,Venezuela,,2021-03-22
556,3/22/2021 14:23:32,3,Spanish,Florida - FL,,03/22/2021,,Venezuela,,2021-03-22
556,3/22/2021 14:23:32,3,Spanish,Florida - FL,,03/22/2021,,Venezuela,,2021-03-22
557,3/22/2021 14:24:08,1,Spanish,Utah - UT,Air,03/24/2021,United,Venezuela,,2021-03-22
558,3/22/2021 14:26:04,2,Spanish,Utah - UT,,03/22/2021,,Venezuela,,2021-03-22
558,3/22/2021 14:26:04,2,Spanish,Utah - UT,,03/22/2021,,Venezuela,,2021-03-22
559,3/22/2021 14:37:29,3,Spanish,New York - NY,Air,03/24/2021,Delta,Ecuador,,2021-03-22
559,3/22/2021 14:37:29,3,Spanish,New York - NY,Air,03/24/2021,Delta,Ecuador,,2021-03-22
559,3/22/2021 14:37:29,3,Spanish,New York - NY,Air,03/24/2021,Delta,Ecuador,,2021-03-22
560,3/22/2021 14:38:27,2,Spanish,New York - NY,,03/22/2021,,Venezuela,,2021-03-22
560,3/22/2021 14:38:27,2,Spanish,New York - NY,,03/22/2021,,Venezuela,,2021-03-22
561,3/22/2021 14:47:22,2,Spanish,New York - NY,Air,03/24/2021,Delta,Ecuador,,2021-03-22
561,3/22/2021 14:47:22,2,Spanish,New York - NY,Air,03/24/2021,Delta,Ecuador,,2021-03-22
562,3/22/2021 14:53:59,4,Spanish,Texas - TX,Air,04/02/2021,,Venezuela,,2021-03-22
562,3/22/2021 14:53:59,4,Spanish,Texas - TX,Air,04/02/2021,,Venezuela,,2021-03-22
562,3/22/2021 14:53:59,4,Spanish,Texas - TX,Air,04/02/2021,,Venezuela,,2021-03-22
562,3/22/2021 14:53:59,4,Spanish,Texas - TX,Air,04/02/2021,,Venezuela,,2021-03-22
563,3/22/2021 14:54:54,4,Spanish,Florida - FL,,03/22/2021,,Cuba,,2021-03-22
563,3/22/2021 14:54:54,4,Spanish,Florida - FL,,03/22/2021,,Cuba,,2021-03-22
563,3/22/2021 14:54:54,4,Spanish,Florida - FL,,03/22/2021,,Cuba,,2021-03-22
563,3/22/2021 14:54:54,4,Spanish,Florida - FL,,03/22/2021,,Cuba,,2021-03-22
564,3/22/2021 15:00:09,1,Spanish,Florida - FL,Air,03/24/2021,,Venezuela,,2021-03-22
565,3/22/2021 15:30:58,3,Spanish,Texas - TX,,03/22/2021,,Venezuela,,2021-03-22
565,3/22/2021 15:30:58,3,Spanish,Texas - TX,,03/22/2021,,Venezuela,,2021-03-22
565,3/22/2021 15:30:58,3,Spanish,Texas - TX,,03/22/2021,,Venezuela,,2021-03-22
566,3/22/2021 15:33:52,3,Spanish,Virginia - VA,,03/22/2021,,Venezuela,,2021-03-22
566,3/22/2021 15:33:52,3,Spanish,Virginia - VA,,03/22/2021,,Venezuela,,2021-03-22
566,3/22/2021 15:33:52,3,Spanish,Virginia - VA,,03/22/2021,,Venezuela,,2021-03-22
567,3/22/2021 15:51:37,3,Spanish,Florida - FL,,03/22/2021,,Cuba,,2021-03-22
567,3/22/2021 15:51:37,3,Spanish,Florida - FL,,03/22/2021,,Cuba,,2021-03-22
567,3/22/2021 15:51:37,3,Spanish,Florida - FL,,03/22/2021,,Cuba,,2021-03-22
568,3/23/2021 6:12:00,3,French,"West Palm Beach, Fl",,03/23/2021,,Haiti,,2021-03-23
568,3/23/2021 6:12:00,3,French,"West Palm Beach, Fl",,03/23/2021,,Haiti,,2021-03-23
568,3/23/2021 6:12:00,3,French,"West Palm Beach, Fl",,03/23/2021,,Haiti,,2021-03-23
569,3/23/2021 6:12:00,3,French,"Irvington, NJ",Other,03/23/2021,,Haiti,,2021-03-23
569,3/23/2021 6:12:00,3,French,"Irvington, NJ",Other,03/23/2021,,Haiti,,2021-03-23
569,3/23/2021 6:12:00,3,French,"Irvington, NJ",Other,03/23/2021,,Haiti,,2021-03-23
570,3/23/2021 6:12:00,1,Spanish,"Houston, TX",Private Vehicle,03/27/2021,,Cuba,,2021-03-23
571,3/23/2021 6:12:00,2,Spanish,"Omaha, NE",,03/25/2021,,Cuba,,2021-03-23
571,3/23/2021 6:12:00,2,Spanish,"Omaha, NE",,03/25/2021,,Cuba,,2021-03-23
572,3/23/2021 6:12:00,3,Spanish,"Houston, TX",Air,03/24/2021,,Cuba/Venezuela,,2021-03-23
572,3/23/2021 6:12:00,3,Spanish,"Houston, TX",Air,03/24/2021,,Cuba/Venezuela,,2021-03-23
572,3/23/2021 6:12:00,3,Spanish,"Houston, TX",Air,03/24/2021,,Cuba/Venezuela,,2021-03-23
573,3/23/2021 6:12:00,3,Spanish,"Miami, FL",Air,04/03/2021,American,Venezuela,,2021-03-23
573,3/23/2021 6:12:00,3,Spanish,"Miami, FL",Air,04/03/2021,American,Venezuela,,2021-03-23
573,3/23/2021 6:12:00,3,Spanish,"Miami, FL",Air,04/03/2021,American,Venezuela,,2021-03-23
574,3/23/2021 6:12:00,1,Spanish,"Tampa, FL",Air,03/24/2021,Delta,Cuba,,2021-03-23
575,3/23/2021 6:12:00,1,Spanish,"Dallas, TX",Other,03/24/2021,American,Venezuela,,2021-03-23
576,3/23/2021 6:12:00,1,Portuguese,"Framingham, MA",,03/24/2021,,Brazil,,2021-03-23
577,3/23/2021 6:12:00,1,French,"Palm Bay, FL",Air,03/25/2021,American,Haiti,,2021-03-23
578,3/23/2021 6:12:00,2,Spanish,"Spring Valley, NY",Air,03/25/2021,Southwest,Ecuador,,2021-03-23
578,3/23/2021 6:12:00,2,Spanish,"Spring Valley, NY",Air,03/25/2021,Southwest,Ecuador,,2021-03-23
579,3/23/2021 6:12:00,3,Portuguese,"Danbury, CT",Air,03/25/2021,American,Brazil,,2021-03-23
579,3/23/2021 6:12:00,3,Portuguese,"Danbury, CT",Air,03/25/2021,American,Brazil,,2021-03-23
579,3/23/2021 6:12:00,3,Portuguese,"Danbury, CT",Air,03/25/2021,American,Brazil,,2021-03-23
580,3/23/2021 6:12:00,2,Spanish,"Charleston, SC",,03/25/2021,,Guatemala,,2021-03-23
580,3/23/2021 6:12:00,2,Spanish,"Charleston, SC",,03/25/2021,,Guatemala,,2021-03-23
581,3/23/2021 6:12:00,1,Spanish,"Houston, TX",Other,03/23/2021,,Cuba,,2021-03-23
582,3/23/2021 12:17:42,3,Spanish,Wisconsin - WI,,03/23/2021,,Mexico,,2021-03-23
582,3/23/2021 12:17:42,3,Spanish,Wisconsin - WI,,03/23/2021,,Mexico,,2021-03-23
582,3/23/2021 12:17:42,3,Spanish,Wisconsin - WI,,03/23/2021,,Mexico,,2021-03-23
583,3/23/2021 12:23:26,1,Spanish,Kentucky - KY,,03/23/2021,,Cuba,,2021-03-23
584,3/23/2021 12:28:40,1,Spanish,Virginia - VA,,03/23/2021,,Venezuela,,2021-03-23
585,3/23/2021 12:36:43,2,Spanish,Florida - FL,,03/24/2021,,Venezuela,,2021-03-23
585,3/23/2021 12:36:43,2,Spanish,Florida - FL,,03/24/2021,,Venezuela,,2021-03-23
586,3/23/2021 12:43:32,1,Spanish,Texas - TX,,03/24/2021,,Venezuela,,2021-03-23
587,3/23/2021 12:45:06,1,Spanish,Florida - FL,Air,03/24/2021,American,Venezuela,,2021-03-23
588,3/23/2021 13:16:57,1,Spanish,Texas - TX,Air,03/24/2021,American,Venezuela,,2021-03-23
589,3/23/2021 13:39:49,5,Spanish,Indiana - IN,,03/23/2021,,Venezuela,,2021-03-23
589,3/23/2021 13:39:49,5,Spanish,Indiana - IN,,03/23/2021,,Venezuela,,2021-03-23
589,3/23/2021 13:39:49,5,Spanish,Indiana - IN,,03/23/2021,,Venezuela,,2021-03-23
589,3/23/2021 13:39:49,5,Spanish,Indiana - IN,,03/23/2021,,Venezuela,,2021-03-23
589,3/23/2021 13:39:49,5,Spanish,Indiana - IN,,03/23/2021,,Venezuela,,2021-03-23
590,3/23/2021 13:47:41,1,Spanish,Texas - TX,Air,03/24/2021,United,Cuba,,2021-03-23
591,3/23/2021 13:54:44,3,Kichwa,New York - NY,Air,03/25/2021,Delta,Ecuador,,2021-03-23
591,3/23/2021 13:54:44,3,Kichwa,New York - NY,Air,03/25/2021,Delta,Ecuador,,2021-03-23
591,3/23/2021 13:54:44,3,Kichwa,New York - NY,Air,03/25/2021,Delta,Ecuador,,2021-03-23
592,3/23/2021 14:11:17,2,Spanish,Texas - TX,,03/24/2021,,Venezuela,,2021-03-23
592,3/23/2021 14:11:17,2,Spanish,Texas - TX,,03/24/2021,,Venezuela,,2021-03-23
593,3/23/2021 14:11:21,4,Spanish,Texas - TX,,03/23/2021,,Venezuela,,2021-03-23
593,3/23/2021 14:11:21,4,Spanish,Texas - TX,,03/23/2021,,Venezuela,,2021-03-23
593,3/23/2021 14:11:21,4,Spanish,Texas - TX,,03/23/2021,,Venezuela,,2021-03-23
593,3/23/2021 14:11:21,4,Spanish,Texas - TX,,03/23/2021,,Venezuela,,2021-03-23
594,3/23/2021 16:19:16,5,Spanish,Florida - FL,,03/23/2021,,Venezuela,,2021-03-23
594,3/23/2021 16:19:16,5,Spanish,Florida - FL,,03/23/2021,,Venezuela,,2021-03-23
594,3/23/2021 16:19:16,5,Spanish,Florida - FL,,03/23/2021,,Venezuela,,2021-03-23
594,3/23/2021 16:19:16,5,Spanish,Florida - FL,,03/23/2021,,Venezuela,,2021-03-23
594,3/23/2021 16:19:16,5,Spanish,Florida - FL,,03/23/2021,,Venezuela,,2021-03-23
595,3/23/2021 16:26:47,4,Spanish,Florida - FL,,03/23/2021,,Venezuela,,2021-03-23
595,3/23/2021 16:26:47,4,Spanish,Florida - FL,,03/23/2021,,Venezuela,,2021-03-23
595,3/23/2021 16:26:47,4,Spanish,Florida - FL,,03/23/2021,,Venezuela,,2021-03-23
595,3/23/2021 16:26:47,4,Spanish,Florida - FL,,03/23/2021,,Venezuela,,2021-03-23
596,3/23/2021 16:40:35,4,Spanish,Texas - TX,,03/23/2021,,Venezuela,,2021-03-23
596,3/23/2021 16:40:35,4,Spanish,Texas - TX,,03/23/2021,,Venezuela,,2021-03-23
596,3/23/2021 16:40:35,4,Spanish,Texas - TX,,03/23/2021,,Venezuela,,2021-03-23
596,3/23/2021 16:40:35,4,Spanish,Texas - TX,,03/23/2021,,Venezuela,,2021-03-23
597,3/23/2021 17:31:40,2,Spanish,Texas - TX,Air,03/24/2021,United,Cuba,,2021-03-23
597,3/23/2021 17:31:40,2,Spanish,Texas - TX,Air,03/24/2021,United,Cuba,,2021-03-23
598,3/23/2021 17:36:59,1,Spanish,Florida - FL,Air,03/28/2021,American,Cuba,,2021-03-23
599,3/23/2021 17:40:30,1,Spanish,Arizona - AZ,,03/23/2021,,Venezuela,,2021-03-23
600,3/24/2021 13:20:30,2,Spanish,Georgia - GA,,03/24/2021,,Venezuela,,2021-03-24
600,3/24/2021 13:20:30,2,Spanish,Georgia - GA,,03/24/2021,,Venezuela,,2021-03-24
601,3/24/2021 13:20:35,4,Spanish,Florida - FL,,03/24/2021,,Venezuela,,2021-03-24
601,3/24/2021 13:20:35,4,Spanish,Florida - FL,,03/24/2021,,Venezuela,,2021-03-24
601,3/24/2021 13:20:35,4,Spanish,Florida - FL,,03/24/2021,,Venezuela,,2021-03-24
601,3/24/2021 13:20:35,4,Spanish,Florida - FL,,03/24/2021,,Venezuela,,2021-03-24
602,3/24/2021 13:30:00,2,Spanish,Florida - FL,,03/24/2021,,Venezuela,,2021-03-24
602,3/24/2021 13:30:00,2,Spanish,Florida - FL,,03/24/2021,,Venezuela,,2021-03-24
603,3/24/2021 13:30:29,2,Spanish,New Jersey - NJ,,03/24/2021,,Venezuela,,2021-03-24
603,3/24/2021 13:30:29,2,Spanish,New Jersey - NJ,,03/24/2021,,Venezuela,,2021-03-24
604,3/24/2021 13:53:02,3,Spanish,Texas - TX,,03/24/2021,,Venezuela,,2021-03-24
604,3/24/2021 13:53:02,3,Spanish,Texas - TX,,03/24/2021,,Venezuela,,2021-03-24
604,3/24/2021 13:53:02,3,Spanish,Texas - TX,,03/24/2021,,Venezuela,,2021-03-24
605,3/24/2021 14:00:57,2,Spanish,New Jersey - NJ,,03/24/2021,,Venezuela,,2021-03-24
605,3/24/2021 14:00:57,2,Spanish,New Jersey - NJ,,03/24/2021,,Venezuela,,2021-03-24
606,3/24/2021 14:11:53,4,Spanish,Florida - FL,,03/24/2021,,Venezuela,,2021-03-24
606,3/24/2021 14:11:53,4,Spanish,Florida - FL,,03/24/2021,,Venezuela,,2021-03-24
606,3/24/2021 14:11:53,4,Spanish,Florida - FL,,03/24/2021,,Venezuela,,2021-03-24
606,3/24/2021 14:11:53,4,Spanish,Florida - FL,,03/24/2021,,Venezuela,,2021-03-24
607,3/24/2021 15:38:23,1,Spanish,Arizona - AZ,,03/25/2021,,Venezuela,,2021-03-24
608,3/24/2021 15:50:23,2,Spanish,Florida - FL,Air,03/25/2021,American,Cuba,,2021-03-24
608,3/24/2021 15:50:23,2,Spanish,Florida - FL,Air,03/25/2021,American,Cuba,,2021-03-24
609,3/24/2021 15:52:40,1,Spanish,Florida - FL,,03/24/2021,,Venezuela,,2021-03-24
610,3/24/2021 16:02:38,1,Spanish,Texas - TX,,03/24/2021,,Venezuela,,2021-03-24
611,3/24/2021 16:04:00,1,Spanish,Texas - TX,Air,03/26/2021,American,Venezuela,,2021-03-24
